,user_id,tweet_id,time,location,polarity,subjectivity,text, hashtags
1154,284165738,749691196969213952,2016-07-03 15:48,"England, UK",-0.04999999999999996,0.95,Huge Muslim prayer event to celebrate Eid is cancelled  via  Sad fact of  ,#Brexit #StrongerIn
1155,76150275,749691154606718978,2016-07-03 15:47,London,0.05,0.15,Just as well Iceland gave England an early  or if England gad  could be them being stuffed by our European neighbours,#Brexit #Bremain
1156,1148678077,749688788700520452,2016-07-03 15:38,,0.0,0.0,GUARANTEED!  won't happen.  will never be activated.     ,#Brexit #Article50 #EUref #UK #EU #VoteLeave #VoteRemain
1157,3382843617,749684518249005057,2016-07-03 15:21,Das Trumpenreich,0.0,0.0,Brexit: Yet another example of biased polling  americanthinker. rexit_yet_another_example_of_biased_polling.html …       ,#BREXIT #Leave #VoteLeave #IndependenceDay #Remain #VoteRemain #UKIP
1158,713984912,749683684303921152,2016-07-03 15:18,South Carolina,0.05000000000000002,0.5, must have a general election before activating article 50    ,#Britain #BREXIT #BREMAIN #politics
1159,4045929347,749679979416416257,2016-07-03 15:03,"North West, England",0.4055555555555556,0.5666666666666668,Blackpool Beach was beautiful 2day in the sun.Thx  & European Clean Beach law   pic.twitter.,#StrongerIn #Brexit
1160,2910517857,749678797939732480,2016-07-03 14:58,Moscow Metro's ,0.3,0.4,I liked a  video from   The Financial Argument for  (  ,#Brexit #VoteLeave #VoteRemain
1161,501139438,749677532396609537,2016-07-03 14:53,London,0.3,0.5," : this is being terrorised in your own home. ""German woman from Chester phones radio station""   itv.  …",#Brexit #Bremain
1162,2561981287,749675302356455424,2016-07-03 14:44,,0.8,0.75, Saw some great banners today in London.    pic.twitter.,#marchforeurope #bremain #brexit
1163,746734775008911360,749670745257771009,2016-07-03 14:26,"Bristol, England",0.2,0.2,Businesses prepare legal challenge over Brexit negotiations  6a-4124-11e6-b22f-79eb4891c97d … via     ,#remainineu #brexit #breentry #bremain
1164,61220264,749667016802435073,2016-07-03 14:11,,0.0,0.0,Spanish sense of humour    pic.twitter.,#brexit #bremain #strongerin
1165,2237037052,749663269661642752,2016-07-03 13:57,,0.2,0.2,Article 50 process on Brexit faces legal challenge. Email your support for this legal challenge    mishcon. /article_50_process_on_brexit_faces_legal_challenge_to_ensure_parliamentary_involvement_07_2016 …,#StrongerIn #Brexit
1166,802057369,749661867690323968,2016-07-03 13:51,"Great Britain, Europe, Earth",0.0,0.0,If you support  listen to this   …        ,#Remain #StrongerIn #OneEurope #Europe #EU #Brexit #NotInMyName #Democracy #News
1167,494041315,749651606988328960,2016-07-03 13:10,"Stockport,  Greater Manchester",0.0,0.0,Gove the puppet master. My cartoon.        pic.twitter.,#BorisJohnson #Brexit #Bremain #brexit #MichaelGove #boris #bojo
1168,4720651,749648153880698880,2016-07-03 12:57,UK,0.0,0.0,  NO to  ! NO to racism ! pic.twitter.,#StrongerIn #Remain #Brexit
1169,14998564,749647683002986496,2016-07-03 12:55,"Grimsby, N E Lincs, England",0.0,0.0,RT  : I blame  on those who made undeliverable promises (  )     ,#Brexit #LibDems #INTogether #Bremain #UK
1170,1336407462,749637048869412864,2016-07-03 12:12,India,0.0,0.0,Changes like Brexit need a supermajority: Swaminathan Aiyar       ,#Brexit #Bremain #UK #EU #Europe #GreatBritain
1171,5145071,749636602893217793,2016-07-03 12:11,USA! --I..bow..to..no..human,0.0,0.0,Breaking! ISIS march in solidarity with   fascists    pic.twitter.,#marchforeurope #bremain #Brexit #PatriotSpring #UKIP
1172,111596475,749633204324151296,2016-07-03 11:57,❤️TEXAS❤️USA❤️,0.3,0.1,Dear   A picture is worth a 1000 words  >  xoxo ~s pic.twitter.,#Scotland #Brexit #Bremain
1173,200500118,749631129502834688,2016-07-03 11:49,European Union,0.0,0.0,The truth about  didn’t stand a chance in the online bubble   theguardian. …,#Brexit #Bremain
1174,272474937,749616333168467968,2016-07-03 10:50,Cambridge,0.625,0.5,Interesting point just made to me: the term  set us up for a departure. Did we consider  ? Forget hand over the remain box!,#Brexit #Bremain
1175,5145071,749610772465000449,2016-07-03 10:28,USA! --I..bow..to..no..human,0.016666666666666663,0.4000000000000001,  : morally bankrupt depraved fascist scum. Full stop.     …,#marchforeurope #bremain #Brexit #PatriotSpring
1176,20400324,749610558073307136,2016-07-03 10:27,Manchester,0.75,1.0,I  for the   vote with  & unlocked my own Flag Profile pic! What will you vote?    …,#VoteIn #Brexit #EURef #ivoted
1177,124274340,749607747793059841,2016-07-03 10:16,Intersectional Feminist,-0.05,0.1,"""Political strategists worldwide are using bot- generated propaganda and misdirection."" Bots   &  ",#StrongerIn #Brexit
1178,5145071,749605396600360961,2016-07-03 10:07,USA! --I..bow..to..no..human,-0.3333333333333333,0.6666666666666666,UK:Teen seriously injured after machete attack  examiner.co. shire- …       ,#ramadan #jihad #Brexit #Bremain #marchforeurope
1179,494041315,749603333380374528,2016-07-03 09:58,"Stockport,  Greater Manchester",0.0,0.0,My cartoon on spooky Tory treachery        pic.twitter.,#brexitpm #gove #MichaelGove #BorisJohnson #Brexit #Bremain #gove
1180,41924020,749597792637714432,2016-07-03 09:36,"Caldas da Rainha, PT",0.0,0.0,March for Europe - Interview with 2 Chanting pro-EU Men  via      ,#shameonyou #StrongerIn #antiBrexit #Brexit
1181,717362844497551360,749597721976311808,2016-07-03 09:36,"Henrietta, NY",-0.55,0.7,Too late now idiots. This is why the  should not have happened  independent.co.  …    ,#EUreferendum #BrexitLies #Brexit #StrongerIn #EUref
1182,211871994,749596721701851136,2016-07-03 09:32,"Preston, Lancs UK",-0.175,0.35000000000000003,Any  seen  this weekend? Looks like that   scaremongering actually wasn't. Not good.,#VoteLeave #VoteRemain #Brexit
1183,19346439,749593341587812352,2016-07-03 09:19,"No Bots Please, We're British",0.6,0.25,The Best  Responses to  (Yes Really)   ,#Remain #Brexit #StrongerIn #VoteRemain
1184,1242631568,749590871369211905,2016-07-03 09:09,"Lambeth, London",0.0,0.0,What has the ECHR ever done for us? video        theguardian.  …,#Brexit #Leave #Remain #Strongerin #anothereurope #ThanksalotBrexiteers
1185,74468291,749590341452521473,2016-07-03 09:07,planet earth ,0.0,0.0,A vote of confidence in  - sign the petition  te-of-confidence-in-jeremy-corbyn-after-brexit?bucket= … via    ,#corbyn #VoteLeave #brexit #VoteRemain
1186,1274725776,749590028980985856,2016-07-03 09:06,"Dubai, United Arab Emirates",0.43333333333333335,0.8333333333333334,      It's easy for anyone to send you     …,#Brexit #VoteLeave #VoteIn #StayIn #Pound #Euro #Gold
1187,44404558,749586481249935360,2016-07-03 08:51,Dorset,0.0,1.0,Well done  finally some sense being spoken      …,#Remain #Strongerin #Brexit
1188,1685931420,749583814519885825,2016-07-03 08:41,"Oxford, England",0.8,0.75,A Great way to prevent           ,#Brexit #EU #StrongerIn #EURef #EURefResults #EUReferendum #UK #Remain #InOrOut #Article50
1189,2311561,749581614771015680,2016-07-03 08:32,London UK: Zurich Switzerland ,0.5681818181818181,0.3772727272727273,Andrea Leadsom v Theresa May: Who's best equipped to lead UK as new PM post  result   ,#Brexit #EURef #VoteRemain #Leave
1190,748445719044956160,749580825327464448,2016-07-03 08:29,United Kingdom,0.0,0.0,Brexit’s fallout: ADRIFT        ,#brexit #bremain #euref #eureferendum #eu #remain #leave
1191,709863948686909441,749578152796680193,2016-07-03 08:18,,0.3,0.95,   fact is she's being honest. The only certainty about  is d uncertainty. ,#Brexit #StrongerIn
1192,29017307,749574527504510976,2016-07-03 08:04,New York,0.0,0.5,Tony Blair: UK should keep Brexit options open      bbc.co. cs-36698055 …,#BREAKING #TonyBlair #brexit #bremain
1193,11481712,749574303469953024,2016-07-03 08:03,"Swansea, Wales",0.0,0.0, ch-professor-michael-dougan-assesses-uks-position-following-vote-leave-eu… every  argument debunked by EU lawyer? I think so    ,#leave #Brexit #Bremain #breentry
1194,3003739203,749572756229029888,2016-07-03 07:57,European Union,0.0,0.0,This is why we need to rely upon parliamentary democracy   cnbc. se-bots-could-sway-the-brexit-vote.html …  ,#Brexit #Bremain
1195,133300661,749568909934747648,2016-07-03 07:42,Glasgow,0.75,1.0,I  for the   vote with  & unlocked my own Flag Profile pic! What will you vote?    …,#VoteIn #Brexit #EURef #ivoted
1196,45082428,749567892765552640,2016-07-03 07:38,"Diliman, Quezon City",0.0625,0.5,After a 2hr debate on    I survived provided that I'm not an Econ major she asked me if I believe in law of attraction.,#Brexit #Bremain
1197,920626381,749567832766156800,2016-07-03 07:37,,-0.5,0.3,How Our Mainstream Media Failed Democracy  huffingtonpost.co. en- …     ,#via #Bremain #Brexit #Remain
1198,724551449204559872,749566456782737409,2016-07-03 07:32,"BFE, Oklahoma, USA",0.0,0.0,Candidates who are listening to THE PEOPLE are considering how to  not how to implement   …,#Bremain #Brexit
1199,920626381,749565111124328448,2016-07-03 07:27,,0.08333333333333333,0.22916666666666666, theguardian.  …   Older generation eating up their children's future. ,#Remain #Bremain #Brexit
1200,249390676,749561367498264576,2016-07-03 07:12,"UK, Ireland, Europe",0.0,0.0,Who would you prefer to be in a room alone with? Steak Knife Gove or BoJo Boris? well the latter for moi.   ,#bremain #brexit #marian
1201,24877249,749557988642398208,2016-07-03 06:58,Prague,0.75,0.45,'I will alway love EU': The best signs from London's anti-Brexit march  ch-for-europe-signs/ … via   ,#8Y1o_CnXS054 #VoteRemain #brexit
1202,52110780,749553711928659969,2016-07-03 06:41,"London, UK",0.2,0.25,Genuinely worried about the effect of  on British scientific research.   bbc.co. nvironment-36685379 …,#Brexit #StrongerIn
1203,109323607,749550851786678272,2016-07-03 06:30,London,-0.175,0.175,Called   spearheaded out campaign & tied the hands of  . Make no mistake  is a Tory mess. pic.twitter.,#EUref #StrongerIN #Brexit
1204,2876865054,749549520090910721,2016-07-03 06:25,"Singapore, formerly London",0.0,0.0, washingtonpost. l- … The nature of our press and its role in the referendum has not been sufficiently examined.  ,#Brexit #StrongerIn
1205,2324931559,749545287233003520,2016-07-03 06:08,Brussels,-0.75,1.0,Observation:   (pro-British intervention in  ) was pro-    (anti-participation  ) was pro-  .,#WW1 #Brexit #WW1 #Bremain
1206,523104566,749544833686142980,2016-07-03 06:06,Central Finland,0.25,0.5,"""Was the famous british politeness and moderaty just a mask they wore?""      …",#PostRefRacism #Brexit #RacismSux #Bremain
1207,560960526,749543268602507264,2016-07-03 06:00,"Hull, UK",0.17045454545454544,0.4545454545454545,Our new vid should help you ease off the Brexit Blues!     youtube. gLTuU … pic.twitter.,#sundaymorning #brexit #bremain
1208,298722510,749543239250739200,2016-07-03 06:00,,0.5,0.5,  let's test the emergency migrant handbrake Cameron &  boasted about or was it just more LIES . ,#bbcnews #Marr #StrongerIn #Brexit
1209,19863380,749543226378510336,2016-07-03 06:00,"England, United Kingdom",0.0,1.0,Only 48% of people will find the mistake.        pic.twitter.,#Brexit #EUref #EUreferendum #VoteRemain #VoteLeave #BrexitLies #nhs
1210,341605069,749539866619314176,2016-07-03 05:46,"EvrywhAir (I Adam,U Eve;-)",1.0,0.3,    2016 June 23  .. Best cartoons pic.twitter.,#BRexit #BRemain #Stay #Leave #EUreferendum
1211,238966388,749537677297451008,2016-07-03 05:38,"South East, England",0.3166666666666667,0.5166666666666667,  does the free movement safeguard clause in the EEA agreement present a suitable compromise? Discuss  ,#Brexit #Bremain
1212,108587399,749535697225256960,2016-07-03 05:30,Westminster,0.0,1.0,   The only one who can lead  and not leave us with  lite ,#Brexit #Bremain #AndreaLeadsom4Leader
1213,736831979459649536,749535078208901120,2016-07-03 05:27,United Kingdom,-0.25,0.75,Poll Reveals:  Fragile Manibuable Mentally Ill Blubbering Youth Bragaid      are_AndroidApp_Tweet …,#Bremain #Brexit #EU #EUreferendum #UKIP
1214,2409490190,749533300658675712,2016-07-03 05:20,Leeds,0.0,0.0,"Q: ""What makes you like the EU?"" A: ""I don't like the EU!""  0MYJY …   ",#Brexit #VoteLeave #VoteRemain
1215,404842444,749530298552094720,2016-07-03 05:08,Comunidad Valenciana,0.0,0.0,The Beatles on     ,#Brexitsoundtracks #Brexit #Bremain #Breverse
1216,2185616992,749530131396517889,2016-07-03 05:08,,0.25,0.25,Thousands march for bremain. Agree or not remember we are democracy. If marching minority win democracy loses.   ,#Bremain #brexit #democracy
1217,1630983686,749528038468124673,2016-07-03 04:59,"London, UK",0.8,1.0,"I am a proud ""Europhile Crybaby"". Thoughts:  facebook. =10154307082678033&set=a.442044838032.220193.647738032&type=3&theater …  ",#Brexit #StrongerIn
1218,160582379,749524337422700544,2016-07-03 04:45,belgium/belgie,-0.2047619047619048,0.8452380952380952,So far all the experts and analyst who told people  was a horrible idea have been proven right & then some..  ,#Brexit #VoteLeave #Strongerin
1219,101598139,749520949737906176,2016-07-03 04:31,Land of Hope and Glory,0.25,0.45,The latest The tory-totty Daily!  -totty?edition_id=8c80d7e0-40f8-11e6-8b0f-0cc47a0d164b …  ,#brexit #strongerin
1220,727914960072921089,749520751313690628,2016-07-03 04:30,Alola Region PokeMonsun&moon,0.75,1.0,I  for the   vote with  & unlocked my own Flag Profile pic! What will you vote?    …,#VoteIn #Brexit #EURef #ivoted
1221,7587032,749520155374264320,2016-07-03 04:28,"London, UK",0.05,0.35, Let people vote for party that stands for  or  now truth of claims is apparent and the rats have jumped. ,#Brexit #Bremain #BresignNow
1222,86773909,749514126767128576,2016-07-03 04:04,London,0.175,0.575,The kind of stuff  and  campaigners usually cover up: Fortress Europe kills to protect imperialism  revolutionarycommunist.  …,#Bremain #Brexit
1223,742361039879188481,749509630250913792,2016-07-03 03:46,"London, England",0.7,0.6000000000000001, 's Good Morning Britain sums up  for me    youtube. tUQYY&feature=share …,#AztecCamera #Brexit #EURef2 #VoteRemain
1224,65110002,749509253677912064,2016-07-03 03:45,eamonntgardiner.wordpress.com,0.0,0.0,Britain will bottle it when it comes to exiting EU - Independent.ie    just like I said  again,#brexit #bremain #suez
1225,1292457972,749508562376921088,2016-07-03 03:42,"London, England",0.0,0.0,        “The death of populism”   …,#politics #Brexit #EUreferendum #stayingin #LeaveEU #StrongerIn #UKIP #UKreferendum
1226,2479878525,749507866948689921,2016-07-03 03:39,London,0.06666666666666668,0.06666666666666668, protesters say  didn't really want to vote  & should have a 2nd vote (& a 3rd if they lose again i assume!?) ,#Bremain #Britain #Brexit #Poor
1227,2962759227,749507005073666048,2016-07-03 03:36,"London, UK",-0.25,0.4,anti  march: dog firmly in favour of  !  Square  instagram.,#brexit #bremain
1228,454369172,749506455498264576,2016-07-03 03:33,London,0.0,0.0,My thoughts on  - you can read or listen!  antoinespeaks.co. -leave-arent-racist-some-are-and-all-will-be-guilty-by-association…     ,#brexit #VoteLeave #VoteRemain #borisJohnson #britain #eu
1229,2654656340,749506044225662976,2016-07-03 03:32,"London, England",0.2,0.1, it is like the knocked out boxer at the count of 15 wants to fight on  pain  ,#voteremain #brexit #farage
1230,3432022138,749503183890817024,2016-07-03 03:20,"Manchester, England",0.0,0.0,If May becomes PM watch out for the rise of UKIP. A  candidate must not be the one to take us out of Europe.  ,#VoteRemain #Democracy #Brexit
1231,24735132,749501351315505152,2016-07-03 03:13,"Higher Penwortham, England",0.0,0.125,  Protests and arguments. Let history judge us and let's focus on the future  (and I did vote remain!) ,#Brexit #Bremain #BreUnite #Brepair
1232,305592049,749494521419878404,2016-07-03 02:46,"Saskatoon, Saskatchewan",0.0,0.0,Thousands at 'March for  '  protest via        bbc. 90?ocid=socialflow_facebook&ns_mchannel=social&ns_campaign=bbcnews&ns_source=facebook%3FSThisFB …,#Europe #Brexit #VoteRemain #EUReferendum #BrIN #MarchForEurope #UK
1233,717362844497551360,749487287306706944,2016-07-03 02:17,"Henrietta, NY",0.0,0.125, And  :   The   And An Uncertain Future  inquisitr. -climate-change-global-warming-refugee-crisis…  ,#Brexit #ClimateChange #GlobalWarming #RefugeeCrisis #environment #StrongerIn
1234,105630657,749483788955189248,2016-07-03 02:03,Netherlands,0.0,0.75,Pre-  blog by   used   for  prediction: money betted vs. total bets  zerohedge.  …,#Brexit #Bookies #wrong #statistic #Bremain
1235,332321094,749480536696053760,2016-07-03 01:50,"Glasgow,Scotland ",0.75,1.0,I  for the   vote with  & unlocked my own Flag Profile pic! What will you vote?    …,#VoteIn #Brexit #EURef #ivoted
1236,114273855,749463401345191936,2016-07-03 00:42,,0.0,0.0,Charlie Hebdo has given its verdict on  and it's not flattering  u don't need to know French ,#Brexit #StrongerIn
1237,64998939,749459403342946308,2016-07-03 00:27,Global,0.0,0.5,Open Letter re EU referendum result calls for review of claimed deceptions & their impact on voters   ,#Brexit #Bremain
1238,1710743832,749459263425249280,2016-07-03 00:26,somewhere out of this world,0.0,0.0,      BREAKING NEWS DAVID CAMERON VOTED FOR  people are being played,#TeamAJ #WeAreThe48 #NotMyVote #Bremain #Brexit #iwantmyeuback #Brexit
1239,264731106,749452447245033472,2016-07-02 23:59,"Hawaiian Paradise Park, HI",0.0,0.0,Thousands at 'March for Europe' Brexit protest        bbc.co. 90 …,#Bremain #Remain #Brexit #UK #EU #UKpolitics
1240,1710743832,749445757074309120,2016-07-02 23:32,somewhere out of this world,0.125,0.25,     THE BRITISH PEOPLE ARE BEING PLAYED FOR HIGHER TAXATION pic.twitter.,#WeAreThe48 #NotMyVote #Brexit #Bremain
1241,738907431401578501,749444987679637505,2016-07-02 23:29,"Belfast & elsewhere, mainly UK",0.0,0.0, campaign won't accept a democratic decision over   any surprise since the  is undemocratic!,#VoteRemain #Brexit #EU
1242,43134024,749443061395120129,2016-07-02 23:22,"Boston, MA",0.0,0.0,SRSLY: BoJo the  bro      propublica. bojo-the-brexit-bro …,#Brexit #BorisJohnson #UKtoStay #Bremain
1243,1650834678,749435973931560960,2016-07-02 22:53,London,0.0,0.5,Share if you agree enough is enough is enough...   …   ,#Brexit #EUreferendum #VoteRemain
1244,1103152116,749427768262221824,2016-07-02 22:21,Australia,0.21111111111111114,0.5555555555555556,a tantrum? with such a close vote it is a brave govt that ignores half the country's wishes  bbc. 90 …  ,#brexit #bremain
1245,32278797,749420944058257408,2016-07-02 21:54,"San Jose, CA",0.0,0.0,Shouts for Brexit and then legs it!      pic.twitter.,#Brexit #StrongerIn
1246,713984912,749408954569162752,2016-07-02 21:06,South Carolina,0.0,0.0,Thousands at 'March for Europe'  protest     Ad7CcB3rg …,#Brexit #Bremain #EU #UK
1247,748438936830214144,749401656278876161,2016-07-02 20:37,Great Britain & N Ireland,0.0,0.0,When do you think?     …,#betteroffin #Brexit
1248,23749423,749400548437209088,2016-07-02 20:33,far far away,0.125,0.22916666666666666,First  blames  for dividing the country and when they lose the  go apeshit on doing that same thing. ,#Bremain #Brexit #referendum #facepalm
1249,1380628428,749399764920373248,2016-07-02 20:30,,0.5,0.5,I wonder how many    protestors were entitled to vote in  or just went for the lols ,#Bremain #MarchForEurope #March4Europe #EUref #Brexit
1250,352627276,749399118431318016,2016-07-02 20:27,,0.8,0.9,Welcome to the Euro family by Sketchaganda     ,#VoteLeave #StrongerIn #Brexit #EUReferendum
1251,1720816128,749387540076044289,2016-07-02 19:41,San Francisco,0.0,0.0,Invasion of Europe           youtube. TV2i8 …,#Brexit #VoteLeave #VoteRemain #EU #NoBorders #Trump #BuildTheWall #AmericaFirst
1252,375710349,749385544149327872,2016-07-02 19:33,London,0.0,0.0,I wonder which way she voted?       Square  instagram.,#brexit #bremain #eu #europe #marchforeurope
1253,748445719044956160,749385388674932736,2016-07-02 19:32,United Kingdom,-0.875,1.0,Brexit's Brutal Blow to the NHS  huffingtonpost.co. brexit-nhs_b_10710928.html …       ,#brexit #bremain #euref #eureferendum #eu #remain #leave
1254,741003451560304640,749378601053749248,2016-07-02 19:05,,-0.1,0.2,Still no economic collapse remainers   ,#voteremain #brexit #ProjectFear
1255,19110265,749377262873636864,2016-07-02 19:00,London,0.25,0.55,interesting march today: lots of different viewpoints but a shared feeling of solidarity & positivity towards the EU.  ,#brexit #bremain
1256,204723035,749374584588120065,2016-07-02 18:49,Mega-City Four,0.19166666666666665,0.39166666666666666, and keep on marching to one of 27 other EU states if you love it so much.    ,#marchforeurope #Bremain #Brexit #EUref #UKIP
1257,356376608,749371969758437377,2016-07-02 18:39,"London, England",1.0,0.3,Best one i've seen today.      pic.twitter.,#MarchForEurope #LondonStays #Bremain #Brexit #EUreferendum
1258,29017307,749365685395021824,2016-07-02 18:14,New York,0.0,0.0,Thousands Protest in London Against Brexit      wsj. ands-protest-in-london-against-brexit-1467478717 …,#Brexit #Bregret #Bremain #London
1259,309224568,749364910790959104,2016-07-02 18:11,United Kingdom,0.24545454545454545,0.3181818181818182,   New Zealand offers UK top trade negotiators for post-Brexit deals | via   telegraph.co.  …,#Brexit #strongerIN
1260,138355370,749364186023653377,2016-07-02 18:08,County Durham,0.3125,0.5, how can a peaceful rally be undemocratic?! Protest against  and manipulation by  politicians  ,#Leave #LeaveLies #Brexit #StrongerIn #EUref
1261,3379156816,749363602860236800,2016-07-02 18:06,"North Berwick, Scotland",0.75,1.0,I  for the   vote with  & unlocked my own Flag Profile pic! What will you vote?    …,#VoteIn #Brexit #EURef #ivoted
1262,210541046,749363580370313216,2016-07-02 18:06,Portsmouth,0.0,0.0,The Guardian on Boris's demeanour immediately after     are_iOSApp_Other … pic.twitter.,#Brexit #VoteLeave #VoteRemain
1263,1260687384,749362323287080960,2016-07-02 18:01,Harrow  NW London,-0.16666666666666666,0.5116666666666666, many youngsters on Erasmus programme are uncertain about their future. Very unsettling!!   ,#brexit #voteremain #EUreferendum
1264,29017307,749362019372044288,2016-07-02 18:00,New York,0.0,0.0,Elders and debtors     breakingviews.  …,#Bremain #Brexit #Bregret
1265,2293181529,749358494923517952,2016-07-02 17:46,"London, UK",0.0,0.5625,Why leave EU only to rejoin again in the future.      pic.twitter.,#notinmyname #bremain #strongertogether #brexit #londonstays
1266,748263300572405764,749355732152094720,2016-07-02 17:35,Out in the World,1.0,0.3,This is the best opportunity for  to get rid of Britain. I hope they don't let this go.   ,#EU #Brexit #Bremain #EUref
1267,65470224,749355078985904129,2016-07-02 17:32,"Palermo, Sicily",0.0,0.0,nobody voted for no plan    theguardian.  …,#brexit #bremain
1268,132547999,749355048698671104,2016-07-02 17:32,United Kingdom,0.6,0.35,.   or  - The UK have the best opportunity to reshape the whole EU again post-WWII aftermath and UK can update terms.,#Brexit #Bremain
1269,417812149,749354462230122497,2016-07-02 17:30,Surrey,0.0,0.22083333333333333,Retweeted Joe Public (  ): That  manifesto in Private Eye   pic.twitter. ,#Brexit #VoteRemain #EUref
1270,3043626838,749352523090235396,2016-07-02 17:22,ShiteVille Paedotopia,0.0,0.0,        Urban definition of.. DOING A BORIS  ng-a-boris…,#BoJo #BorisJohnson #Boris #BoJotheclown #Brexit #Bremain #bremainvsbrexit #EU
1271,746371177174679552,749349688361484288,2016-07-02 17:11,"South East, England",-0.1,0.07083333333333333,The Tories will drag Britain over the  cliff because they fear loosing millions of voters to UKIP   ,#Brexit #Remain #UKtoStay #StrongerIn
1272,2240254399,749347751155142656,2016-07-02 17:03,The Revolution,0.0,0.125, splitting up the UK? Cardiff and Caernarfon rallies seek independent Wales -  bbc.co. 36693676 …  ,#Brexit #bremain #fuckbrexit
1273,1362795199,749347122814812161,2016-07-02 17:00,"Under Your Bed, Englandshire",-0.06666666666666668,0.25,Legal academic says  campaign was ‘criminally irresponsible’  independent.co.  …   ,#VoteLeave #Brexit #EURefResults #VoteRemain
1274,2676721215,749336805741326336,2016-07-02 16:19,,-0.07142857142857142,0.21428571428571427,Every single member of parliament both houses should be made to watch this     ,#StrongerIn #brexit #EUref #BoJonomics
1275,3059111189,749333519160270848,2016-07-02 16:06,Kalifaat Nederigistan,-0.16666666666666666,0.06666666666666668,Less protesters in  then there are homeless people.  ,#London #Brexit #Bremain
1276,1852318687,749333248078127104,2016-07-02 16:05,,0.0,0.0,  Let's protest in march because we wasn't bothered voting on referendum day.,#Bremain #Brexit
1277,1427541488,749332879969292288,2016-07-02 16:04,"Brussels, Belgium",0.0,0.0, would rob us of our fundamental rights as  .     pic.twitter.,#Brexit #eucitizens #LibDemFightback #Bremain
1278,475695277,749328570154090496,2016-07-02 15:47,North london,0.75,1.0,I  for the   vote with  & unlocked my own Flag Profile pic! What will you vote?    …,#VoteIn #Brexit #EURef #ivoted
1279,3589914859,749321391464407040,2016-07-02 15:18,,-0.8,0.9,Well no surprises here:  lies to world about rise in hate crimes since   breitbart. …,#Bremain #Brexit
1280,38213919,749319921369288709,2016-07-02 15:12,"Tonbridge, UK",0.0,0.0,"Even   has advice for  . ""Fate be changed. Look inside. Mend the bond torn by pride"" ",#Brave #Brexit #VoteRemain
1281,1710743832,749319175064133633,2016-07-02 15:09,somewhere out of this world,0.0,0.0,      'Brexit' could trigger World War Three -  mirror.co. rexit-could-trigger-world-war-7928607 …,#WeAreThe48 #NotMyVote #Brexit #Bremain #iwantmyeuback
