,user_id,tweet_id,time,location,polarity,subjectivity,text, hashtags
1011,3235220435,776035400062304257,2016-09-14 08:30,United Kingdom,-0.1,0.2,EU chief Juncker regrets Brexit vote but says EU is not at risk     ,#Brexit #SingleMarket #UKIP #LeaveEU
1012,19441006,776035238732500993,2016-09-14 08:29,London/New York,0.0,0.55,Finally we can have BLUE PassPorts again!        … pic.twitter.,#Remain #stoparticle50 #EURef #Brexit #LeaveEU
1013,3235220435,776031716980953089,2016-09-14 08:15,United Kingdom,0.0,0.0,Farage reeks of desperation!     pic.twitter.,#Brexit #UKIP #LeaveEU
1014,716378272725078016,776028023971778560,2016-09-14 08:01,,0.0,0.0, and  :  Conference -  and Challenges of    ,#PrincetonUniversity #Europe #Brexit #VoteLeave #June23
1015,2798050831,776025236911390720,2016-09-14 07:50,Europe,0.0,0.0, : EU Parliament 'declaring war' on Brexit talks  bbc.co. cs-37360383 …   ,#NigelFarage #VoteLeave #LeaveEU #Brexit
1016,19441006,776020910352498688,2016-09-14 07:32,London/New York,0.0,0.0,  Parliament needs to decide on Article 50!     pic.twitter.,#Brexit #LeaveEU #Remain #StopArticle50 #EURef #BrexitJustice
1017,2502009804,776019449379950592,2016-09-14 07:27,Zorg in the Galaxy Andromeda,0.7,0.6000000000000001,A good response to  in  on  & the consequences we face as we have decided to  .,#PMQs #Brexit #VoteLeave
1018,351500954,776017647976779776,2016-09-14 07:19,London/ Naples ,0.4,0.45,Welcome to the world of restricted travel British people - thank you      theguardian.  …,#Brexit #BrexitBritain #Brexiteers #LeaveEU
1019,716378272725078016,776012901811417088,2016-09-14 07:01,,0.4,1.0,Queen Backs  Her Majesty Confirmed By Royal Biographer Backing Leave  dailysquib.co. een-backs-brexit-majesty-confirmed-royal-biographer-backing-leave-eu.html …   pic.twitter.,#Brexit #euref #leaveEU
1020,760127604649259008,776007347164553216,2016-09-14 06:39,"Budapest, Hungary",-0.16666666666666666,0.5,This worked for  where your typical   immigrant voted to     …,#Brexit #BritishEmpire #CommonWealth #LeaveEU #KickDownwards
1021,1060264448,776007147150794752,2016-09-14 06:38,"Brussels, Belgium",0.0,0.0, 's release about the task Force led by Michel  for negotiations with the    ,#EuCommission #Barnier #UK #Brexit #VoteLeave
1022,19644086,775998393831350272,2016-09-14 06:03,North London,0.0,0.0,EURONEWS reports EU facing crises of migration and security.     . ,#Brexit #BorisJohnson #VoteLeave
1023,3235220435,775998210984869889,2016-09-14 06:02,United Kingdom,0.05000000000000001,0.19166666666666665,Take back control? It’s now clear the  have no clue on     ,#Brexiteers #immigration #Brexit #UKIP #LeaveEU
1024,379851447,775997398392901632,2016-09-14 05:59,London UK,0.0,0.0,75m Turks     brexit FB page:  pic.twitter.,#EU #brexit #referendum #voteleave
1025,379851447,775996893704949760,2016-09-14 05:57,London UK,0.0,0.0,Is that what you want?     brexit FB page:  pic.twitter.,#EU #brexit #referendum #voteleave
1026,379851447,775995374020460545,2016-09-14 05:51,London UK,-0.5,0.9,UK will be powerless in face of 'United States of Europe' without Brexit     ,#EU #brexit #referendum #voteleave
1027,3235220435,775994447540674560,2016-09-14 05:47,United Kingdom,0.0,0.0,Farage declares War on the European Union - what a Dick!     ,#Brexit #UKIP #LeaveEU #Farage1956
1028,19441006,775985798780973056,2016-09-14 05:13,London/New York,0.0,0.0,  Intentional Misrepresentation - Evidence!     pic.twitter.,#Brexit #LeaveEU #Remain #StopArticle50 #EURef #BrexitJustice
1029,716378272725078016,775983220030668801,2016-09-14 05:03,,0.05333333333333334,0.68,Cameron's Pro-EU Gov. is Most Certainly Guilty of High Treason Against the Crown.     ,#VOTELEAVE #euref #Remain #Brexit
1030,77821953,775981039630028800,2016-09-14 04:54,"Scotland, Europe",0.0,0.0,   t-is-it-the-fat-cats-like-about-the-eu-asks-boris-johnson… What do fat cats like abt EU asks    pic.twitter.,#Brexit #VoteLeave
1031,345131103,775979618004267008,2016-09-14 04:48,London and Los Angeles,0.0,0.0,Hurry up with  and give back our work visa waivers with Australia instead of Poland   pic.twitter.,#Brexit #SOTEU #VoteLeave
1032,2798050831,775974694013001728,2016-09-14 04:29,Europe,0.25,0.3125,Juncker says EU facing existential crisis  theguardian. … And his response? More of the same!   ,#Brexit #LeaveEU #EUref
1033,919131332,775969170416668672,2016-09-14 04:07,Taipei / Hong Kong,0.0,0.0,  in fairness it wasn't his job to have a plan if UK voted to leave that job was Cameron.  ,#Brexit #VoteLeave
1034,3233242655,775966541330288640,2016-09-14 03:56,"Leeds, England",-0.8,0.9,Hate to say I told you so....     …,#voteleave #Brexit
1035,2985242001,775957846697451520,2016-09-14 03:22,South Devon,0.0,0.0,Next  warns of  conquest of   telegraph.co.  …       ,#Pope #Islamic #Europe #EU #migrantcrisis #Catholism #Brexit #Brixham #LeaveEU #Austria
1036,379851447,775957661099528193,2016-09-14 03:21,London UK,0.0,0.0,The Betrayal of Britain.     brexit FB page:  pic.twitter.,#EU #brexit #referendum #voteleave
1037,379851447,775957054481571841,2016-09-14 03:19,London UK,0.0,0.0,Brussels time bomb: EU burying power-grab laws until AFTER referendum     ,#EU #brexit #referendum #voteleave
1038,3235220435,775956035169169409,2016-09-14 03:15,United Kingdom,0.0,0.0,WATCH: Hillary Clinton demolishes    Nigel Farage in  speech     ,#Racist #Sexist #Reno #Brexit #UKIP #LeaveEU #FarRight
1039,379851447,775955986628554753,2016-09-14 03:14,London UK,0.0,0.0,John Bingley: The British Constitution -part 4 of 7  youtube. CN0sQ …    ,#EU #brexit #referendum #voteleave
1040,3235220435,775948475527606275,2016-09-14 02:45,United Kingdom,0.1,1.0,Lets hope  is stopped before it goes too far...     pic.twitter.,#Brexit #UKIP #LeaveEU #BrexitCentral #ChangeBritain
1041,3235220435,775944684677902338,2016-09-14 02:30,United Kingdom,-0.05,0.1,This is how the Tory Brexit Secretary REALLY spent his Big Trade Deal Day     ,#Brexit #BrexitBritain #UKIP #LeaveEU
1042,1380308922,775937475248173057,2016-09-14 02:01,Europe,-0.29999999999999993,0.4666666666666667,Poor old  that £350m-a-week promise YOUR  camp made about the  follows you round like a bad smell ,#voteleave #brexit
1043,2299361382,775934510357622785,2016-09-14 01:49,#LiberationTheology,0.0,0.0,"""Take back control""  said. ""We have no idea what we're doing with it""  now say…    theguardian.  …",#Leave #VoteLeave #Brexit #DavidDavis
1044,720098948736790528,775911584883412992,2016-09-14 00:18,"Norwich, England",0.0,0.0,Then a tariff based system it is .. what's the problem ?  tain-eu-verhofstadt-idUKKCN11J13D …     pic.twitter.,#Brexit #LeaveEU #VoteLeave #leave
1045,720098948736790528,775906955747594241,2016-09-14 00:00,"Norwich, England",0.0,0.08333333333333334,AT LAST THEY ARE STARTING TO GET IT !  telegraph.co.  …     pic.twitter.,#Brexit #LeaveEU #VoteLeave #BritainMeansBritain
1046,762515679190712320,775902339827892224,2016-09-13 23:41,,0.0,0.0,Richard Lobo’s wife donated $3.5 Million of Europe interview     ,#EU #brexit #referendum #voteleave
1047,720098948736790528,775902284354117638,2016-09-13 23:41,"Norwich, England",0.0,0.0,JAME DYSON ... SPEAKS OF UK ECONOMY LIBERATION.  bbc.co. 37352312 …     pic.twitter.,#Brexit #LeaveEU #Article50 #EUtariffs
1048,34166460,775901838176612352,2016-09-13 23:39,,0.0,0.03333333333333333,Suck it  ! You lost! The public was not misinformed or misled. No 2nd  .     …,#remainiacs #referendum #Brexit #LeaveEU
1049,716378272725078016,775892081973850115,2016-09-13 23:01,,0.0,0.06666666666666668, faces time bomb of growing public debt  dailysquib.co. -the-eurozone-risks-intensifying-its-demise-why-britain-must-leave.html …       ,#Eurozone #brexit #voteleave #euref #remain #go #britainout #leaveeu
1050,3000550486,775888224904474625,2016-09-13 22:45,Tameside,0.0,0.0,The time is NOW       pic.twitter.,#Brexit #Grexit #Italexit #FreeEurope #LoveEurope #LeaveEU
1051,379851447,775854576679419904,2016-09-13 20:32,London UK,0.0,0.0,Roger Arthur FaceBook post for brexit     ,#EU #brexit #referendum #voteleave
1052,379851447,775854071936851969,2016-09-13 20:30,London UK,0.0,0.0,Daniel Hannan in FaceBook video:     ,#EU #brexit #referendum #voteleave
1053,3235220435,775850311625928705,2016-09-13 20:15,United Kingdom,-0.05,0.325,Soft Brexit-hard Brexit: where should green business stand?     ,#Brexit #SingleMarket #UKIP #LeaveEU
1054,716378272725078016,775847014936539136,2016-09-13 20:01,,0.0625,0.5,Frontex Report Shows Major Flaws in EU Security        ,#VoteLeave #go #euref #EUreferendum #Brexit #Remain #StrongerIn
1055,716378272725078016,775831732952109056,2016-09-13 19:01,,-0.25,0.8,  the Shit!  dailysquib.co. -referendum-im-in-the.html …        pic.twitter.,#Remain #IN #Brexit #VoteLeave #Remain #StrongerIN #GO #LeaveEU #EUref
1056,3235220435,775831474394296320,2016-09-13 19:00,United Kingdom,0.0,0.06666666666666668,Britain's last EU commissioner 'will act in EU's interest' via     ,#Brexit #UKIP #LeaveEU
1057,15748766,775827258707697664,2016-09-13 18:43,"Beaconsfield, England",0.0,0.0,Bloomberg - Italy Said Presses for EU Defense Incentives in Wake of Brexit   ,#VoteLeave #Brexit
1058,3235220435,775820118806949889,2016-09-13 18:15,United Kingdom,0.0,0.0,Britons may need visas to visit EU after Brexit     ,#Brexit #SingleMarket #UKIP #LeaveEU
1059,716378272725078016,775816802962210817,2016-09-13 18:01,,0.0,0.0, the movie - Must Watch!  dailysquib.co. exit-the-movie-uncovers-the-belly-of-the-eu-beast-a-must-watch.html …       pic.twitter.,#Brexit #euref #eureferendum #voteleave #remain #britainout #go
1060,3429568685,775812489246191616,2016-09-13 17:44,,-0.075,0.725, 50 Are these unelected morons brave enough to put there names to this letter or at least dribble on it  ,#Article #Brexit #VoteLeave
1061,3429568685,775811590092234754,2016-09-13 17:41,,0.0,0.0, Why bother to reduce MP's by 50 to save money when you could and save a fortune by abolishing the  ,#Brexit #HouseofLords #VoteLeave
1062,45992113,775808463473479680,2016-09-13 17:28,,0.0,0.0,  promises in any way close to what  government will deliever now?  voteleavetakecontrol. ,#VoteLeave #Brexit #May #Article50
1063,554748904,775801660698402817,2016-09-13 17:01,London,-0.5000000000000001,0.6,Don't let the  campaigners forget the false promises they made during the  !    open-britain.co. ers_try_to_drop_their_false_promises …,#VoteLeave #EUref #Brexit
1064,262761577,775797199854772225,2016-09-13 16:44,,0.0,0.0,Asylum seekers taking HOLIDAYS in the countries they are 'fleeing'  .  .  .,#Brexit #leaveEU
1065,710130376388321281,775796346204938240,2016-09-13 16:40,"Liverpool, England",0.75,1.0,I  for the   vote with  & unlocked my own Flag Profile pic! What will you vote?    …,#VoteOut #Brexit #EURef #ivoted
1066,3235220435,775795739691802624,2016-09-13 16:38,United Kingdom,0.0,0.125,Zero chance EU citizens in UK will keep same rights post-Brexit says expert     ,#Brexit #UKIP #LeaveEU
1067,379851447,775795641926680576,2016-09-13 16:37,London UK,0.0,0.0,Nigel Farage     brexit FB page:  pic.twitter.,#EU #brexit #referendum #voteleave
1068,19441006,775794446109728768,2016-09-13 16:33,London/New York,0.0,0.0,  Intentional Misrepresentation - Evidence!     pic.twitter.,#Brexit #LeaveEU #Remain #StopArticle50 #EURef
1069,379851447,775794122691141632,2016-09-13 16:31,London UK,0.0,0.125,Norway was told the same lies.     pic.twitter.,#EU #brexit #referendum #voteleave
1070,3235220435,775793750618546176,2016-09-13 16:30,United Kingdom,-0.5,0.5,The risk of remaining vague on Brexit via     ,#Brexit #UKIP #LeaveEU
1071,379851447,775793615117414400,2016-09-13 16:29,London UK,0.1,0.1,France declares 'state of economic emergency' Germany faces financial ruin     ,#EU #brexit #referendum #voteleave
1072,3235220435,775793169325813760,2016-09-13 16:27,United Kingdom,-0.1555555555555556,0.2888888888888889,David Cameron steps down as MP via     ,#Brexit #UKIP #LeaveEU
1073,382679468,775791047733604352,2016-09-13 16:19,London,0.0,0.0,I blame Brexit for the impeachment of the President of     ,#Brazil #VoteLeave #impeachment #dilmaRousseff #Brexit
1074,15748766,775783665993412612,2016-09-13 15:50,"Beaconsfield, England",0.0,0.0,Unelected peers insist PM MUST ask their permission for Brexit  via   ,#VoteLeave #Brexit
1075,751658395766235136,775782340983418880,2016-09-13 15:44,England,0.0,0.0,Britons planning Irish retirement may have to prove ‘close connection’  irishtimes. britons-planning-irish-retirement-may-have-to-prove-close-connection-1.2790074 …    ,#irishpassport #brexit #voteleave #ireland
1076,19644086,775780580386607104,2016-09-13 15:37,North London,-0.8,0.9, -hannan-reports-that-that-is-no-increase-in-hate-crime-prosecutions… Dan Hannan says number of hate crime prosecutions has NOT risen.    ,#Brexit #borisjohnson #VoteLeave
1077,116876382,775773542629642240,2016-09-13 15:10,GAB Twitter ≠ Free Speech,0.0,0.0,It's working     …,#Brexit #VoteLeave
1078,719171158000726016,775769486507044864,2016-09-13 14:53,,0.0,0.0,What a load of tosh!!     …,#LeaveEU #Brexit
1079,19644086,775765998746136580,2016-09-13 14:40,North London,0.3125,0.2, express.co.  … Nothing to fear in  outcome Says  Thanks cos we do fear! We do!  ,#Brexit #VoteLeave
1080,379851447,775765053324816384,2016-09-13 14:36,London UK,0.0,0.0,HELP OUR FISHERMEN  facebook.  …    ,#EU #brexit #referendum #voteleave
1081,379851447,775764548485873664,2016-09-13 14:34,London UK,0.0,0.0,5 Presidents Report (pdf file)   …   ,#EU #brexit #voteleave
1082,379851447,775764295485386752,2016-09-13 14:33,London UK,0.0,0.0,Invite Nigel Farage to join Vote Leave events     ,#EU #brexit #referendum #voteleave
1083,2984403982,775759285666082817,2016-09-13 14:13,South Devon,0.0,0.0,Perhaps our  negotiators could learn a lesson here!  mirror.co. =sharebar_twitter …     ,#EU #ICID #Brexit #Voteleave #LeaveEU #EUref #Article50
1084,2798050831,775756924910534657,2016-09-13 14:03,Europe,0.16666666666666666,0.8333333333333334,The  is incapable of meaningful reform  is only the beginning of the inevitable.     …,#EU #Brexit #LeaveEU #VoteLeave
1085,3235220435,775756162415357952,2016-09-13 14:00,United Kingdom,0.0,0.0,Academics and NGOs questioned on UK-EU police co-operation post-Brexit    ,#Brexit #UKIP #LeaveEU
1086,191193738,775751261924777985,2016-09-13 13:41,Own World,0.0,0.0,Think everyone knows this! apart from    &  followers    …,#VoteLeave #BREXIT
1087,262761577,775750404646768640,2016-09-13 13:38,,0.0,0.0,Bulgarians re-enforce their border.  .    …,#Brexit #LeaveEU
1088,51854911,775749235841138689,2016-09-13 13:33,Planet Earth,0.03333333333333333,0.16666666666666666,It's the  standard response they've really no understanding of how a real democracy works.   …,#VoteLeave #Brexit
1089,3235220435,775744605446864896,2016-09-13 13:15,United Kingdom,0.0,0.0,Labour members will choose candidate for Jo Cox's seat within a fortnight    ,#Brexit #UKIP #LeaveEU
1090,3235220435,775741093249974272,2016-09-13 13:01,United Kingdom,0.0,0.0,Expel Hungary from EU for hostility to refugees says Luxembourg via     ,#Brexit #UKIP #LeaveEU
1091,16973333,775736020696461312,2016-09-13 12:40,London,0.0,0.0, Let's not forget the wording of the government's pre-election promise to the people!   pic.twitter.,#Brexit #LeaveEU
1092,3297922053,775730424345726980,2016-09-13 12:18,"England, United Kingdom",0.25,0.3125, : Zero chance   in  will keep same  post-   says  More news at  Tune1st.com ,#BREAKING #EU #citizens #UK #rights #Brexit #expert #LeaveEU
1093,3297922053,775726883891769344,2016-09-13 12:04,"England, United Kingdom",0.5,0.5, :   urges   before 2019  . More news at  Tune1st.com   ,#BREAKING #EU #negotiator #Brexit #deal #elections #immigration #LeaveEU #refugees
1094,716378272725078016,775726464864030720,2016-09-13 12:02,,0.0,0.0,Plague of Locusts Will Descend on Britain After Brexit Say EU  dailysquib.co. ague-of-locusts-will-descend-on-britain-after-brexit-say-eu-leaders.html …     ,#VOTELEAVE #remain #euref #brexit #eureferendum
1095,3235220435,775726360627118080,2016-09-13 12:02,United Kingdom,-0.2,0.8,Boundary reform may be necessary but please don't make the situation worse    ,#Brexit #UKIP #LeaveEU
1096,3235220435,775726052790403073,2016-09-13 12:01,United Kingdom,-0.30000000000000004,0.2,Never mind   could EU rules be changed to facilitate forced expulsions?    ,#Article50 #Brexit #UKIP #LeaveEU
1097,379851447,775725841728860161,2016-09-13 12:00,London UK,0.0,0.0,VOTE LEAVE.     brexit FB page:  pic.twitter.,#EU #brexit #referendum #voteleave
1098,3235220435,775725593342115840,2016-09-13 11:59,United Kingdom,-0.07142857142857142,0.21428571428571427,Draghi calls for protection of EU single market     ,#Brexit #SingleMarket #UKIP #LeaveEU
1099,379851447,775725588615135234,2016-09-13 11:59,London UK,0.0,0.0,Get us the hell out of EU.     brexit FB page:  pic.twitter.,#EU #brexit #referendum #voteleave
1100,2798050831,775716980582191104,2016-09-13 11:25,Europe,-0.004761904761904754,0.1523809523809524,In plain English: Unelected House Of Lords Committee wants democratic  vote to be overturned.    …,#Brexit #LeaveEU
1101,720098948736790528,775715243200802817,2016-09-13 11:18,"Norwich, England",0.5,0.8,EVERY DAY YOU REMIND ME WHY I LOVE YOU GUYS & GIRLS ... COME ON TEAM BREXIT :-)     pic.twitter.,#Brexit #EUref #LeaveEU #TeamBrexit
1102,720098948736790528,775713791547838464,2016-09-13 11:12,"Norwich, England",0.5,1.0,For Regained Pride in Our Nation :-) That's Why ...      pic.twitter.,#Brexit #BritainMeansBritain #Britain #VoteLeave #LeaveEu
1103,19441006,775697943617601536,2016-09-13 10:09,London/New York,0.0,0.0,  Intentional Misrepresentation - Evidence!     pic.twitter.,#Brexit #LeaveEU #Remain #StopArticle50 #EURef #BrexitJustice
1104,716378272725078016,775696395319771136,2016-09-13 10:03,,0.3,0.8,Do not fucking apologise for wanting democracy.  dailysquib.co. itons-shouldnt-have-to-apologise-for-wanting-democracy.html …        ,#EUREF #REMAIN #STRONGERIN #VOTELEAVE #BREXIT #JUNE23 #GO #LEAVEEU
1105,716378272725078016,775680827841732608,2016-09-13 09:01,,0.0,0.0,Healthcare Workers Say We Should Vote Leave to Save the       ,#NHS #brexit #voteleave #euref #remain #go
1106,746364088247324673,775655912920973312,2016-09-13 07:22,"London, England",0.2272727272727273,0.5454545454545454,Whether you were  or  the reality is that  's being viewed as positive for the UK economy   …,#VoteLeave #VoteRemain #Brexit
1107,379851447,775655818960265216,2016-09-13 07:22,London UK,0.0,0.0,The EU is on life support!!  youtube. sAwN0 …    ,#EU #brexit #referendum #voteleave
1108,379851447,775655565817180160,2016-09-13 07:21,London UK,0.0,0.0,I'm voting to LEAVE THE EU.     brexit FB page:  pic.twitter.,#EU #brexit #referendum #voteleave
1109,379851447,775653793660825600,2016-09-13 07:14,London UK,-0.2,0.0,Cut ties with Brussels or risk being trapped in Turkish-dominated EU     ,#EU #brexit #referendum #voteleave
1110,19441006,775651627768381440,2016-09-13 07:05,London/New York,0.0,0.0,   of the Electorate is NOT the People!     pic.twitter.,#Brexit #LeaveEU #Remain #StopArticle50 #EURef #BrexitJustice
1111,716378272725078016,775650578886164480,2016-09-13 07:01,,0.0,0.0,Moody's Refutes CBI Scaremongering THE FACTS        ,#EUreferendum #LeaveEU #Remain #Brexit #EUref #strongerin #voteleave
1112,3235220435,775650420748324866,2016-09-13 07:00,United Kingdom,0.0,0.0,National newspapers deride David Cameron for quitting via     ,#Brexit #UKIP #LeaveEU
1113,701866563268378626,775647351293747200,2016-09-13 06:48,United Kingdom,0.0,0.1,     Visualisation from actual data  pic.twitter.,#Brexit #No2EU #Freemovement
1114,3235220435,775646455478575104,2016-09-13 06:45,United Kingdom,0.4,0.9,Post-Brexit Britain Gripped by Xenophobia Unbecoming of 'Civilized People'     ,#Brexit #BrexitBritain #UKIP #LeaveEU
1115,3235220435,775641123918344192,2016-09-13 06:23,United Kingdom,0.35,0.55,Corbyn supporters just a tinfoil hat away from going 'full UKIP'    ,#Brexit #UKIP #LeaveEU
1116,19644086,775626094900813824,2016-09-13 05:24,North London,0.0,0.0, m-action-at-last-boris-demands-a-raft-of-changes-on-the-eu… Two years ago  proposed raft of changes or we shud leave EU.   pic.twitter.,#Brexit #VoteLeave
1117,716378272725078016,775620854969434112,2016-09-13 05:03,,0.0,0.0,Britain Stronger in EU Works Around Clock to Prepare For Kim Jong Cam’s EUSSR     ,#euref #brexit #Remain #VOTELEAVE
1118,19644086,775619636993855488,2016-09-13 04:58,North London,0.0,0.0, ssels-must-hand-power-back-to-the-peasants-revolt-says-boris…  predicted the rise of People Power!    pic.twitter.,#Brexit #borisjohnson #VoteLeave
1119,19441006,775610291258269696,2016-09-13 04:21,London/New York,0.0,0.0,  Intentional Misrepresentation - Evidence!     pic.twitter.,#Brexit #LeaveEU #Remain #StopArticle50 #EURef #BrexitJustice
1120,51854911,775607050864828417,2016-09-13 04:08,Planet Earth,0.0,0.0,We must stop speculating says  whilst attempting to  without a clue?   …,#VoteLeave #Brexit
1121,51854911,775605858302558209,2016-09-13 04:03,Planet Earth,0.5,0.75,I am pleased to announce that after many requests  have provided the  plan. See below.   …,#VoteLeave #Brexit
1122,733635804539539456,775594894689726464,2016-09-13 03:20,"Islington North, London",0.0,0.0,Parliament will debate invoking  17th October. Well done everyone who signed the petition.   pic.twitter.,#Art50 #Brexit #LeaveEU
1123,19441006,775592884066279424,2016-09-13 03:12,London/New York,0.0,0.0,  Intentional Misrepresentation - Evidence!     pic.twitter.,#Brexit #LeaveEU #Remain #StopArticle50 #EURef #BrexitJustice
1124,379851447,775590875506376704,2016-09-13 03:04,London UK,0.0,0.0,Here lies the United Kingdom     brexit FB page:  pic.twitter.,#EU #brexit #referendum #voteleave
1125,716378272725078016,775590290740670464,2016-09-13 03:01,,0.0,0.0,US Congress has acknowledged that EU is a threat to NATO  dailysquib.co. te-leave-facts-yvette-cooper-caught-lying-on-the-eu-and-security.html …      ,#NATO #EUREF #EUREFERENDUM #REMAIN #VOTELEAVE #BREXIT
1126,3235220435,775578513323810816,2016-09-13 02:15,United Kingdom,0.0,0.0,Brexit blows £200m hole in Primark's pension fund via     ,#Brexit #UKIP #LeaveEU
1127,716378272725078016,775575047914328064,2016-09-13 02:01,,0.0,0.0,After We  We will repeal European Communities Act 1972  pic.twitter.    ,#VoteLeave #brexit #euref #june23 #go
1128,710393886888300544,775574937377476608,2016-09-13 02:00,"Birmingham, England",0.0,0.0,From our archives Should I Stay or Should I Go Now?        ,#EU #Referend #brexit #remain #voteleave #britain #davidcameron
1129,3235220435,775574856809275392,2016-09-13 02:00,United Kingdom,0.0,0.0,Juncker asks EU ethics panel to investigate Barroso's Goldman Sachs job via     ,#Brexit #UKIP #LeaveEU
1130,716378272725078016,775560004191518722,2016-09-13 01:01,,0.0,0.0,EU legislation costs British businesses £33.3 billion per year over £600   dailysquib.co. lse-claims-in-9-million-taxpayer-funded-gov-leaflet-uncovered.html …   ,#brexit #voteleave #remain
1131,720098948736790528,775549361682051073,2016-09-13 00:19,"Norwich, England",0.5,0.5,This looks like it's going to be an interesting debate        …,#Brexit #LeaveEU #VoteLeave #BrexitBritain #BrexitMeansBrexit
1132,720098948736790528,775546623829110788,2016-09-13 00:08,"Norwich, England",0.0,0.0,QUESTION: IS BREXIT JUST ABOUT IMMIGRATION TO YOU ?     ,#Brexit #LeaveEU #VoteLeave #BrexitBritain #BrexitMeansBrexit
1133,720098948736790528,775544942672355329,2016-09-13 00:01,"Norwich, England",0.0,0.0,IT'S TIME FOR EUROPE TO TIGHTEN IT'S REIN ON THE EU ...        pic.twitter.,#Brexit #LeaveEU #VoteLeave #EUref #Frexit #Spexit #Dexit
1134,3235220435,775529459239837696,2016-09-12 23:00,United Kingdom,0.7,0.9,Fair competition and a level playing field     ,#Brexit #SingleMarket #UKIP #LeaveEU
1135,9707572,775499564279336962,2016-09-12 21:01,All major cities worldwide,0.0,1.0,John Redwood the Only Vanguard Brexiteer?  dailysquib.co. hn-redwood-vanguard-brexiteer.html …       pic.twitter.,#brexit #voteleave #euref #remain #go #britainout
1136,3235220435,775499252462215168,2016-09-12 21:00,United Kingdom,0.0,0.0,Immigration Policy for a Post-Brexit Britain    ,#Brexit #UKIP #LeaveEU
1137,379851447,775498707974455297,2016-09-12 20:57,London UK,0.0,0.0,The Battle for Britain     brexit FB page:  pic.twitter.,#EU #brexit #referendum #voteleave
1138,379851447,775498454382546944,2016-09-12 20:56,London UK,0.0,0.0,UNELECTED bureaucrats govern us.    brexit FB page:  pic.twitter.,#EU #brexit #voteleave
1139,379851447,775497949774221316,2016-09-12 20:54,London UK,0.0,0.0,WHAT HAS BRITAIN BECOME? PT1 - WHO WE ARE  youtube. ZkDQw …    ,#EU #brexit #referendum #voteleave
1140,3235220435,775495462963015684,2016-09-12 20:45,United Kingdom,-0.14583333333333334,0.7708333333333333,Is a hard Brexit looking increasingly likely?    ,#Brexit #UKIP #LeaveEU
1141,3235220435,775487931003858944,2016-09-12 20:15,United Kingdom,0.0,0.0,'Workers Must Not Pay Price Of Brexit' - TUC Boss    ,#Brexit #UKIP #LeaveEU
1142,752606010901204992,775470755123499008,2016-09-12 19:06,"London, England",0.0,0.0,Try match up  's campaign promises and  plan.  open-britain.co. ers_try_to_drop_their_false_promises …  changebritain. rexit… pic.twitter.,#VoteLeave #Brexit
1143,716378272725078016,775439093761208322,2016-09-12 17:01,,0.05,0.6,Protection of Women’s Rights not contingent on EU membership  dailysquib.co. sela-stuart-best-way-ensure-workers-womens-rights-parliament-directly-accountable-people.html …      ,#euref #womensrights #eu #voteleave #remain #brexit
1144,4822094443,775430651424059392,2016-09-12 16:27,,0.0,0.0,Really...Think about that for a minute...       …,#StandStongBritons #Brexit #No2EU #No2UN
