,user_id,tweet_id,time,location,polarity,subjectivity,text, hashtags
493,35054369,779075239581999105,2016-09-22 17:49,"Oldham, England",-0.14583333333333334,0.2708333333333333,There should be no second referendum. The people decided to  We need a hard   ,#VoteLeave #Brexit #Conservatives #bbcqt
494,457668882,779075118047911936,2016-09-22 17:49,,0.0,0.0,  Nonsense from   There is no plan we need a vote on terms of   et al get it,#bbcqt #Brexit #VoteLeave #Article50
495,19441006,779066043520151553,2016-09-22 17:13,London/New York,0.0,0.0,  We are 62.5% of the people      … pic.twitter.,#Brexit #LeaveEU #Remain #StopArticle50 #EURef
496,359575604,779060064401391616,2016-09-22 16:49,Axarquía and British Isles,0.0,0.0,Would you vote  or  in a second  erendum?  . What do you think?  itv. … ,#remain #Leaveeu #euref #Brexit #StopTheRotters
497,91812903,779059185078206464,2016-09-22 16:45,London,0.0,0.0, a very British coup the man who bankrolled the  campaign made £220m from us voting out but out was all about Britain..,#brexit #VoteLeave
498,3559675660,779057321070788613,2016-09-22 16:38,London UK,0.0,0.0,I had the bollocks to   ,#VoteLeave #Brexit #AVeryBritishCoup
499,19644086,779053977883279368,2016-09-22 16:25,North London,-0.5,0.9, n-duncans-attack-on-boris-johnson-contradicts-the-facts… Facts show  completely wrong about     johnson  pic.twitter.,#Brexit #borisjohnson #boris #VoteLeave
500,19644086,779052722058387457,2016-09-22 16:20,North London,0.0,0.0, facebook. ar …  said we could B out of EU by 2018!     johnson  pic.twitter.,#borisjohnson #Brexit #VoteLeave #boris #changebritain
501,44034144,779050244055052288,2016-09-22 16:10,"Westminster, Colorado",0.2,0.1, wants  to take  jungle migrants    ,#Sarkozy #UK #Calais #Brexit #VoteLeave #UKIP
502,372805464,779050045345767425,2016-09-22 16:09,"My Garden, The EU",0.0,0.0,Who knew  stole UKIP's  Policy? ... EVERYONE  ,#VoteLeave #Immigration #Brexit #AVeryBritishCoup
503,3235220435,779045047790632960,2016-09-22 15:49,United Kingdom,0.0,0.0,‘Immigration points system will not work’    ,#Brexit #UKIP #LeaveEU
504,3235220435,779043854825746432,2016-09-22 15:45,United Kingdom,0.0,0.0,Queen's academic: No Brexit benefits     newsletter.co. cademic-no-brexit-benefits-1-7591410 … pic.twitter.,#Brexit #UKIP #LeaveEU
505,19644086,779043824891035648,2016-09-22 15:44,North London,0.1,0.4, n-duncans-attack-on-boris-johnson-contradicts-the-facts…  's attack on  completely contradicted by the facts.    pic.twitter.,#borisjohnson #Brexit #VoteLeave
506,3235220435,779040100013441024,2016-09-22 15:30,United Kingdom,-0.6458333333333334,0.7708333333333333,Martin Wolf: UK faces grim but unavoidable hard Brexit      irishtimes.  … pic.twitter.,#Brexit #SingleMarket #UKIP #LeaveEU
507,3429568685,779038123913338881,2016-09-22 15:22,,0.2,0.2, are part of  . After contract ends ask them how much you have to pay to leave...beware      …,#PlusNet #BT #Brexit #VoteLeave #ripoff
508,19644086,779024982097661952,2016-09-22 14:30,North London,0.0,0.0, the beautifullest of them all. Remain can't deal with that!    johnson   pic.twitter.,#borisjohnson #Brexit #boris #VoteLeave #ChangeBritain
509,19644086,779018582458036224,2016-09-22 14:04,North London,-0.13333333333333333,0.3666666666666667, n-duncans-attack-on-boris-johnson-contradicts-the-facts… Evidence proves  wrong.  sore losers.    pic.twitter.,#borisjohnson #Brexit #VoteLeave
510,14957181,779009477378969601,2016-09-22 13:28,UK (EU),0.0,0.0,  No need to worry it'll be replaced by all those exports to Australia! It's a  promise. Isn't it? ,#VoteLeave #Brexit
511,2223052483,778984826145832960,2016-09-22 11:50,"Panama City,  Panama",1.0,0.3,The Simplest Solutions are Invariably the Best   …     ,#Britain #England #LeaveEU #EU #Brexit
512,720098948736790528,778984387325075456,2016-09-22 11:48,"Norwich, England",0.0,0.0,ARE YOU PREPARED TO VOTE  TO DEFEAT A GOVERNMENT THAT WOULD TRY TO SCREW YOUR DEMOCRATIC DECISION TO  .  ,#UKIP #Brexit #LeaveEU
513,3235220435,778979980499976192,2016-09-22 11:31,United Kingdom,0.2,0.30000000000000004,The 'real reason'  are pushing the unsuitable Australian-style  points system   pic.twitter.,#UKIP #immigration #Brexit #LeaveEU
514,751658395766235136,778978638196867073,2016-09-22 11:25,England,0.0,0.0,75% of UK businesses eye  as post  home  irishtimes.  …  ,#Ireland #Brexit #thegreatescape #voteleave
515,3235220435,778978379991252992,2016-09-22 11:24,United Kingdom,0.19285714285714284,0.7678571428571428,Far Right Nationalist Stickers Found in Stockport via via      onalist-stickers-found-stockport … pic.twitter.,#Brexit #UKIP #LeaveEU
516,3235220435,778975944849711104,2016-09-22 11:15,United Kingdom,0.14015151515151514,0.5265151515151515,UKIP AMs divided due to being 'a bit excited' says new leader - you couldn't make it up!     bbc.co. politics-37439051 …,#Brexit #UKIP #LeaveEU
517,260791063,778964438711930880,2016-09-22 10:29,,-0.15625,0.375,Trip to Germany with 12 other Brexiters!   ,#VoteLeave #DawkosStagDo #Brexit
518,19644086,778957727003467776,2016-09-22 10:02,North London,-0.1875,0.55,A Remain stunt. Put 4 figures together Major Blair Brown & Cam to promote  . Not a good idea! ,#Brexit #VoteLeave
519,720098948736790528,778947601106366468,2016-09-22 09:22,"Norwich, England",-0.09999999999999998,0.875,"EVERY DAY WE GET ""IT'S TERRIBLE"" MESSAGES ... THEN WE GET ""IT'S GREAT"" ... JUST GET ON WITH  &   bbc.co. 37427031 …",#BREXIT #LEAVEEU
520,19441006,778944720387108866,2016-09-22 09:11,London/New York,0.0,0.0,  Parliament needs to decide on advisory result!     pic.twitter.,#Brexit #LeaveEU #Remain #StopArticle50 #EURef #BrexitJustice
521,4914890427,778944487808704512,2016-09-22 09:10,"North West, England",0.0,0.0,Agreed!             …,#InvokeArticle50Now #LeaveEU #Brexit #Nexit #Daxit #Swexit #Spexit #Italexit #Bavexit #Frexit
522,289484541,778942337716195328,2016-09-22 09:01,"Kent, UK",-0.275,0.7,A long sorry characteristically mendacious list of     pic.twitter.,#VoteLeave #lies #Brexit #EURef
523,19644086,778941957427036160,2016-09-22 09:00,North London,0.0,0.0,LEAVERS LISTEN UP.  Editor a Gover pal NOT TO BE TRUSTED on      johnson pic.twitter.,#Brexit #borisjohnson #VoteLeave #boris
524,1125937411,778939553201713152,2016-09-22 08:50,Southampton/ Isle of Wight,0.0,0.0, In two words...Hell Yes...    ,#Brexit #No2EU #No2UN #No2Migrants
525,4914890427,778939505101377536,2016-09-22 08:50,"North West, England",0.2833333333333333,0.6166666666666666,A heavy price to pay for sweet FA however if nothing ever gets built regarding HS2 I'll be delighted        …,#LeaveEU #Brexit #Nexit #Daxit #Swexit
526,19644086,778938889650180097,2016-09-22 08:47,North London,0.0625,0.5, n-duncans-attack-on-boris-johnson-contradicts-the-facts… Alan Duncan's major boo boo. Did no research oh deary dear.     pic.twitter.,#Borisjohnson #Brexit #VoteLeave
527,4914890427,778938467699023872,2016-09-22 08:46,"North West, England",0.0,0.0,Ahahahaha stick that in your pipe & smoke it Mr Junker            …,#InvokeArticle50Now #Brexit #LeaveEU #Nexit #Daxit #Swexit #Spexit #Italexit #Frexit
528,19441006,778917649086578689,2016-09-22 07:23,London/New York,0.0,0.0, Let’s re-evaluate this result >> Parliament needs to debate!     pic.twitter.,#Brexit #REMAIN #StopArticle50 #EURef #LeaveEU
529,3235220435,778915494984310784,2016-09-22 07:15,United Kingdom,-0.3888888888888889,0.8333333333333334,BoE warns UK banks of tough capital rules after Brexit vote     ft. af-2c26-3d78-bc35-4463b4749f9e …,#Brexit #UKIP #LeaveEU
530,19644086,778911989192163328,2016-09-22 07:01,North London,0.0,0.0,FYI Info since 1989  invented word Eurosceptic.   n-duncans-attack-on-boris-johnson-contradicts-the-facts…    pic.twitter.,#borisjohnson #Brexit #VoteLeave
531,3235220435,778911821805789184,2016-09-22 07:00,United Kingdom,-0.6,1.0,Boris never even wanted  . These cynical leavers must be held to account     independent.co.  …,#Brexit #Brexit #UKIP #LeaveEU
532,3235220435,778907955211145216,2016-09-22 06:45,United Kingdom,0.0,0.0,Newly-elected AfD Berlin MP glorifies Nazis via      neweurope. elected-afd-berlin-mp-glorifies-nazis … pic.twitter.,#Brexit #UKIP #LeaveEU
533,197974228,778907294432129024,2016-09-22 06:42,"Animal Farm, England. GB",0.1,0.1, : Never before in the field of international trading has Britain stood to gain so much. ,#brexit #leaveeu
534,720098948736790528,778902319941419008,2016-09-22 06:22,"Norwich, England",0.0,0.0,DOWNLOAD ARTICLE 50 ... YOUR STUDY INSIGHTS MAY SAVE OUR COUNTRY.  europarl.europa. …      pic.twitter.,#Brexit #LeaveEU #VoteLeave #leave #Article50
535,1125937411,778899196292333568,2016-09-22 06:10,Southampton/ Isle of Wight,0.0,0.0,  And all you remainers thought we were being lied too  ,#brexit #VoteLeave
536,19644086,778883985338433536,2016-09-22 05:09,North London,0.0,0.0, is-is-a-world-class-salesman-says-standard-journalist-pippa-crerar…  world class salesman says    johnson    pic.twitter.,#PippaCrerar #Borisjohnson #boris #Brexit #VoteLeave #changebritain
537,19644086,778879649657057280,2016-09-22 04:52,North London,0.75,0.5875,Outstanding salesman for UK call him number one  doing what he does best.    johnson    …,#borisjohnson #Brexit #boris #VoteLeave
538,3000550486,778877982177976321,2016-09-22 04:45,Tameside,0.0,0.0,The time is NOW       pic.twitter.,#Brexit #Grexit #Italexit #FreeEurope #LoveEurope #LeaveEU
539,19441006,778872787012386816,2016-09-22 04:25,London/New York,0.0,0.0, Let’s re-evaluate this result >> Parliament needs to debate!     pic.twitter.,#Brexit #REMAIN #StopArticle50 #EURef #LeaveEU
540,2482753710,778869899301101568,2016-09-22 04:13,"Cambridge, England",0.0,0.0,Have we left the EU yet? No. But we were told the doom would start immediately after the vote.   ,#brexit #voteleave
541,701389580365381637,778860487941427200,2016-09-22 03:36,UK EUROPE LEADERS FOLLOWBACK,0.0,0.0625, BEEN   CAMPAIGNERS DONE -  TO  NEXT YEARS STILL DIE-HARD   ALWAYS REMAINS IN FUTURE pic.twitter.,#BRESU #BREXIT #BRITAIN #LEAVEEU #WAFEF #BREXITEERS
542,751658395766235136,778848753864376320,2016-09-22 02:49,England,0.0,0.0, Bulletin: Executives give up on Britain's clearing role  via   ,#Brexit #finance #voteleave
543,3135565264,778847825312514048,2016-09-22 02:46,GREAT Britain,0.2,0.2,How much longer is the UK government going to pay the  £350M a week ?      pic.twitter.,#EU #BrexitBritain #LeaveEU #ChangeBritain #OpenBritain #Brexit
544,751658395766235136,778847131939565568,2016-09-22 02:43,England,0.0,0.0, hospitals struggling to fill  posts after   hinckleytimes. =sharebar_twitter …   ,#Leicester #nursing #Brexit #ICID #nhs #voteleave #healthcare
545,722933111537983488,778845798977200128,2016-09-22 02:38,,0.0,0.0,theordinaryman2: This is not my Flag &amp; never will be Re-tweet if u agree      http…,#EUreferendum #LeaveEU #StrongerIn #Brexit #VoteLeave
546,751658395766235136,778838745919488000,2016-09-22 02:10,England,-0.4,0.7,Every city in the North is behind Europe on  ahead of      ,#productivity #Brexit #voteleave #brexitcon #manchester #leeds
547,160831009,778836541644955648,2016-09-22 02:01,London,0.375,0.2,Have some fun stick it to the  !     …,#Leftards #Brexit #VoteLeave
548,3235220435,778836386615025664,2016-09-22 02:00,United Kingdom,0.0,0.0,Brexit chief tells UK: You can't have your cake and eat it     standard.co. brexit-chief-tells-uk-you-cant-have-your-cake-and-eat-it-a3350296.html …,#Brexit #UKIP #LeaveEU
549,3235220435,778832448935297024,2016-09-22 01:45,United Kingdom,0.0,0.0625,But we can’t do it alone: the future of British universities post-Brexit via      …,#Brexit #UKIP #LeaveEU
550,3235220435,778824904925929472,2016-09-22 01:15,United Kingdom,0.1,0.1,The May doctrine: Britain is still a global player (really) via      politico. y-doctrine-britain-is-still-a-global-player-really …,#Brexit #UKIP #LeaveEU
551,720098948736790528,778806328366014465,2016-09-22 00:01,"Norwich, England",0.6875,0.55,LANSLEY CALLS FOR $5bn  BONUS FOR THE  . I SAY £50bn WOULD BE BETTER BUT £5bn IS A GOOD START !  bbc.co. cs-37435648 …  pic.twitter.,#BREXIT #NHS #LeaveEU
552,111770531,778790760468639744,2016-09-21 22:59,熊本県,0.0,0.0,Vote Leave EUVote Leave NWO.      ,#VoteLeave #NoEU #Brexit
553,745935711195566080,778715593688035328,2016-09-21 18:00,London Init,0.375,0.875,‘Significant’ Brexit risk for 8008 EU companies using passporting to sell to UK      …,#Brexit #UKIP #LeaveEU
554,747555637517770752,778694586579365889,2016-09-21 16:37,,-0.05,0.4,  if the country had a referendum on MP's pay rises I wonder how long it would take before it would be actioned.,#VoteLeave #Brexit
555,2985242001,778687483013832705,2016-09-21 16:08,South Devon,0.625,0.8888888888888888,Surely a case of the pot & the kettle!  standard.co. ngarian-government-leaflet-brands-london-nogo-zone-because-it-has-too-many-immigrants-a3350931.html …         ,#Brexit #EUref #migrantcrisis #Article50 #LeaveEU #EU #Hungary #Brixham #BBC
556,18671601,778686708321619973,2016-09-21 16:05,"West Midlands, UK",0.0,0.0,  I've followed you with interest but asking  to make their minds up? You're taking the piss? ,#VoteLeave #Brexit
557,2339238427,778685350071767040,2016-09-21 16:00,"London, UK",-0.3,0.4,  we didn't vote for a 'deal'! We voted to leave the European fucking Union   ,#brexit #VoteLeave #EUref
558,3235220435,778681486362849280,2016-09-21 15:45,United Kingdom,0.15625,0.375,BREXIT: 'No sign of a major collapse' — that's exactly what the Leave crowd want to hear     -of-a-major-collapse-leave-2016-9?r=US&IR=T … pic.twitter.,#Brexit #UKIP #LeaveEU
559,3235220435,778679686289174528,2016-09-21 15:37,United Kingdom,0.0,0.09583333333333333,Remember Brexiteers the  is talking about the last two months or so - not the future - not after      634946479030272 …,#Article50 #Brexit #UKIP #LeaveEU
560,3235220435,778677805353619456,2016-09-21 15:30,United Kingdom,0.0,0.0,The Brexit the British people want is the Brexit they will probably never get     -50-european-union-theresa-may-2016-9 … pic.twitter.,#Brexit #UKIP #LeaveEU
561,133776482,778675890846826496,2016-09-21 15:22,London and International,1.0,0.3,   That's the best  delusion I've heard to date. The EU don't need or even want us now. ,#VoteLeave #Brexit
562,3158274637,778652578313867264,2016-09-21 13:50,"Downing Street, London",0.0,0.0,UK economy NOT affected by Brexit. Apology Remain camp?  independent.co.  …       pic.twitter.,#RemainLies #LeaveEU #Brexit #Lexit #Remoaners #PositiveUK
563,19644086,778651565175472130,2016-09-21 13:46,North London,-0.5,1.0, express.co.  … PEOPLES REVOLT 15000 march in Brussels against unfair EU Trade deals     pic.twitter.,#borisjohnson #Brexit #VoteLeave
564,1560762882,778651221821419520,2016-09-21 13:44,,0.16666666666666666,0.16666666666666666,    classic I rest my case.  Bye. pic.twitter.,#VoteLeave #Brexit
565,19644086,778649710752063488,2016-09-21 13:38,North London,0.9,1.0,Journos say  doing brilliantly in UN.  re-is-no-international-issue-more-important-than-syria-says-boris-johnson…     johnson pic.twitter.,#borisjohnson #VoteLeave #Brexit #boris
566,19441006,778646125645590529,2016-09-21 13:24,London/New York,0.4,0.8,“The EU referendum does not express ‘the will of the people.’” precisely -         …,#BREXIT #REMAIN #EURef #LeaveEU #StopArticle50 #ExitBrexit
567,51854911,778644332161228800,2016-09-21 13:17,Planet Earth,0.5,0.35000000000000003,Another  argument thought I'd share because I do like a good laugh.    …,#VoteLeave #Brexit
568,19441006,778644123481939968,2016-09-21 13:16,London/New York,0.0,0.0,  These companies smell of  ! —-    pic.twitter.,#LeaveEU #Brexit #Brexshit #Remain #StopArticle50 #BrexitJustice
569,4914890427,778640643602124800,2016-09-21 13:02,"North West, England",0.7,0.9,Wise words yet again from              …,#InvokeArticle50Now #LeaveEU #Brexit #Nexit #Daxit #Swexit #Spexit #Italexit #Bavexit #Frexit
570,768864975351930880,778631297531015168,2016-09-21 12:25,An independent UK,0.0,0.0,"""Project Fear"" turned out to be just ""Project Lies""     bbc.co. 37428764?ns_mchannel=social&ns_campaign=bbc_politics&ns_source=twitter&ns_linkname=news_central …",#Brexit #Article50 #VoteLeave
571,19441006,778621081229950978,2016-09-21 11:45,London/New York,0.0,0.0, Let’s re-evaluate this result >> Parliament needs to debate!     pic.twitter.,#Brexit #REMAIN #StopArticle50 #EURef #LeaveEU
572,116876382,778609220782526465,2016-09-21 10:57,GAB Twitter ≠ Free Speech,0.5,0.5,Interesting.    757195976344014848 …,#Brexit #VoteLeave
573,3000550486,778606370472005632,2016-09-21 10:46,Tameside,0.0,0.0,The time is NOW       pic.twitter.,#Brexit #Grexit #Italexit #FreeEurope #LoveEurope #LeaveEU
574,3235220435,778605775178596352,2016-09-21 10:44,United Kingdom,0.0,0.0,Bank of England sees Brexit impact on jobs and investment via      tain-eu-boe-idUKKCN11R0RX?feedType=RSS&feedName=domesticNews … pic.twitter.,#Brexit #UKIP #LeaveEU
575,3235220435,778595658102104064,2016-09-21 10:04,United Kingdom,0.25,0.5,‘Australian-Style’ Points System Leads to Higher  Than in UK    ,#Immigration #Brexit #UKIP #LeaveEU
576,998074273,778592310279929856,2016-09-21 09:50,"rosie, sarah, sophie , Tracy❤️",-0.3125,0.6875, “What does Brexit mean to you?”  52802914304000 … ,#VOTELEAVE #brexit
577,3235220435,778583357722652672,2016-09-21 09:15,United Kingdom,0.0,0.25,Brexit means central London house prices will not grow until 2019     tain-eu-property-idUKKCN11Q2YM … pic.twitter.,#Brexit #UKIP #LeaveEU
578,334310658,778578294694436864,2016-09-21 08:55,UK,0.0,0.0,Did you  in the  We are looking for your thoughts on  and  for our next piece SWARM. DM for details,#voteleave #EUreferendum #migration #Brexit
579,19441006,778568030976634880,2016-09-21 08:14,London/New York,0.0,0.0,  These companies smell of  ! —-    pic.twitter.,#LeaveEU #Brexit #Brexshit #Remain #StopArticle50 #BrexitJustice
580,2226722576,778566976130076673,2016-09-21 08:10,NJ USA,-0.125,0.375,"    ...plus every other ""exit"".... while there is still time    …",#brexit #frexit #dexit #italexit #LeaveEU
581,174631667,778563363806834688,2016-09-21 07:55,In the driving seat,0.625,0.5,Top of the  list!     …,#Wankerati #Brexit #LeaveEU
582,19644086,778561459819257857,2016-09-21 07:48,North London,0.4000000000000001,0.9,HUGE 15000 demo fury that EU trade deals benefit fat cats NOT EU ppl     pic.twitter.,#Brexit #VoteLeave #borisjohnson
583,746364088247324673,778559709230014465,2016-09-21 07:41,"London, England",-0.45,0.5833333333333333,Join the queue. Backtracking on projections that a  decision to  would be bad for  is getting so predictable.   …,#Brexit #VoteLeave #GreatBritain
584,720098948736790528,778558515615006720,2016-09-21 07:36,"Norwich, England",0.0,0.075,DID THE LIKES OF RICHARD BRANSON ACTUALLY CAUSE THE INITIAL SHOCK & INSECURITY POST  ?  independent.  …   pic.twitter.,#BREXIT #EUref #LeaveEU
585,720098948736790528,778554714401234945,2016-09-21 07:21,"Norwich, England",0.5,0.5,HOW MANY REASONS TO REMAIN HAVE BEEN DEBUNKED SINCE THE REFERENDUM ?        pic.twitter.,#Brexit #LeaveEU #VoteLeave #EUref #Referendum #BrexitBritain #leave
586,19644086,778554479931195392,2016-09-21 07:20,North London,0.0,0.0, -our-biased-british-media-is-exerting-blackouts… Why our biased Br. media is censoring the news.     pic.twitter.,#borisjohnson #Brexit #VoteLeave
587,720098948736790528,778542985847996416,2016-09-21 06:34,"Norwich, England",0.0,0.0,No sign of  collapse as dumbfounded OECD in Brexit u-turn: revises UK growth upwards this year.  telegraph.co.  …  pic.twitter.,#Brexit #LeaveEU
588,458264478,778542586353025024,2016-09-21 06:33,,0.175,0.825, won  Time 4 EVERYONE wanting a successful Britain 2 get behind  Join Us - Change Britain  changebritain.,#VoteLeave #EUref #Brexit
589,720098948736790528,778460901741473792,2016-09-21 01:08,"Norwich, England",0.6,1.0,Nice speech Theresa May ...     pic.twitter.,#Brexit #LeaveEU #VoteLeave #leave
590,3235220435,778458835816058880,2016-09-21 01:00,United Kingdom,-0.2916666666666667,0.5416666666666666,May limbers up for a hard Brexit via      ft.  …,#Brexit #UKIP #LeaveEU
591,3235220435,778443720546881537,2016-09-21 00:00,United Kingdom,0.0,0.0,After  - no one will hear you scream...      pic.twitter.,#Brexit #UKIP #LeaveEU #UKIPLeadership #BrexitCentral #ChangeBritain
592,3235220435,778439865566322692,2016-09-20 23:45,United Kingdom,-0.2,0.2,Will this Brexit offer get the Lib Dems back in the game? | Rafael Behr via      theguardian.  …,#Brexit #UKIP #LeaveEU
593,88811690,778404394551377920,2016-09-20 21:24,London,0.0,0.0,Spitting image!          pic.twitter.,#Juncker #Stalin #AskJuncker #EUpresident #EUcrisis #Brexit #Grexit #Frexit #LeaveEU
594,3235220435,778402153782280192,2016-09-20 21:15,United Kingdom,0.02500000000000001,0.25,Paddy Ashdown: General election could be held in May next year via      independent.co.  …,#Brexit #UKIP #LeaveEU
595,3235220435,778394578483314688,2016-09-20 20:45,United Kingdom,0.3555555555555556,0.5777777777777778,Older generations would be happy to see house prices fall if it helped young     independent.co.  …,#Brexit #UKIP #LeaveEU
596,3235220435,778387026156609536,2016-09-20 20:15,United Kingdom,0.0,0.0,Theresa May courts NY banks and businesses to quell Brexit uncertainty      digitallook. onal- …,#Brexit #BrexitBritain #UKIP #LeaveEU
597,3235220435,778383361412825088,2016-09-20 20:00,United Kingdom,0.0,0.0,What Brexit Means for Europe's Trade Deals     eans-europes-trade-deals …,#Brexit #UKIP #LeaveEU
598,3235220435,778379474836619264,2016-09-20 19:45,United Kingdom,0.0,0.0,Theresa May insists EU countries will sign a trade deal with the UK via      independent.co.  …,#Brexit #UKIP #LeaveEU
599,1378144416,778376733946998788,2016-09-20 19:34,"Nuneaton, England",-0.16666666666666666,0.13333333333333333,If  was about the chance to leave a failed political and superstate than yes because I + millions want our country back.    …,#Brexit #VoteLeave
600,295860858,778372550191640577,2016-09-20 19:17,N 51°32' 0'' o th/ E 0°39' 0'',0.0,0.0,Must read for    voters....   …,#Brexit #VoteLeave
601,3235220435,778368174043566080,2016-09-20 19:00,United Kingdom,0.0,0.0,Brussels keen to seal Canada trade deal via      ft. fe-7f50-11e6-bc52-0c7211ef3198.html?ftcamp= …,#Brexit #UKIP #LeaveEU
602,3235220435,778363004786212865,2016-09-20 18:39,United Kingdom,0.3770833333333333,0.5354166666666667,“  : I laughed so hard I nearly p*ssed myself :-D     pic.twitter. ” Sir Nigel of Brussels,#PMSL #Brexit #UKIP #LeaveEU
603,19441006,778360159877881856,2016-09-20 18:28,London/New York,0.0,0.0,  ALL THIS because of 0.3% of the Population   pic.twitter.,#Brexit #LeaveEU #Remain #StopArticle50
604,51854911,778351223787417600,2016-09-20 17:52,Planet Earth,-0.5,1.0,Sorry you'll have to ask a want want want  snowflake sorry I can't help.   …,#VoteLeave #Brexit
605,19441006,778349044754161668,2016-09-20 17:44,London/New York,0.0,0.0,  Parliament needs to decide on advisory result!     pic.twitter.,#Brexit #LeaveEU #Remain #StopArticle50 #EURef #BrexitJustice
606,2529370994,778347874736275457,2016-09-20 17:39,,-0.03571428571428571,0.10714285714285714,QUIT the EU single market and hold world trade talks former diplomat urges UK    ,#brexit #leaveeu #ukip
607,3000550486,778334444197388288,2016-09-20 16:46,Tameside,0.0,0.0,The time is NOW       pic.twitter.,#Brexit #Grexit #Italexit #FreeEurope #LoveEurope #LeaveEU
608,3235220435,778333817631281153,2016-09-20 16:43,United Kingdom,0.5,1.0, Pricesless! Glad you have deployed your incontinence padl    ,#Brexit #UKIP #LeaveEU
609,3429568685,778319678968045573,2016-09-20 15:47,,0.35,0.65, says he's not going anywhere how true  ,#OwenSmith #Brexit #VoteLeave
610,22812734,778317404845858816,2016-09-20 15:38,London(head) Manchester(heart),0.0,0.0, The  conundrum cannot be solved the  camp have no agreed objectives & the vaunted bespoke deal doesn't exist.,#Brexit #VoteLeave
611,733635804539539456,778293915778711552,2016-09-20 14:05,"Islington North, London",0.0,0.0,My European Dream.      pic.twitter.,#EURefMedia #Brexit #BrexitBritain #EUref #VoteLeave
612,716378272725078016,778292924874358784,2016-09-20 14:01,,0.05333333333333334,0.68,Cameron's Pro-EU Gov. is Most Certainly Guilty of High Treason Against the Crown.     ,#VOTELEAVE #euref #Remain #Brexit
613,262761577,778292564927602689,2016-09-20 13:59,,0.0,0.0,'You never asked what WE want!' Villagers demand  after migrants housed nearby.  .  . ,#REFERENDUM #Brexit #LeaveEU
614,3235220435,778288927543296000,2016-09-20 13:45,United Kingdom,-0.15,0.35,Brexit will sap Britain’s economic dynamism and aggravate startling regional disparities     cer.org.  …,#Brexit #UKIP #LeaveEU
615,19441006,778286538127990784,2016-09-20 13:35,London/New York,0.0,0.0,  We are 62.5% of the people      … pic.twitter.,#Brexit #LeaveEU #Remain #StopArticle50 #EURef
616,3235220435,778285146810228737,2016-09-20 13:30,United Kingdom,0.025,0.05,Threat to financial services laid bare as 5476 firms rely on 'passporting'      mirror.co. el-farage-crudely-confirms-didnt-8876046 …,#Brexit #SingleMarket #UKIP #LeaveEU
617,15748766,778281963404787713,2016-09-20 13:17,"Beaconsfield, England",0.06818181818181818,0.25,Nicolas Sarkozy demands migrants 'live like the French'  via    ,#VoteLeave #Brexit #Frexit
618,3235220435,778281321726615552,2016-09-20 13:15,United Kingdom,0.1238095238095238,0.2476190476190476,Exclusive - Fears for social entrepreneurs in Britain as Brexit looms large via      repreneurs-poll-governments-idUKKCN11Q1UG?feedType=RSS&feedName=domesticNews …,#Brexit #UKIP #LeaveEU
619,720098948736790528,778254727406612480,2016-09-20 11:29,"Norwich, England",0.0,0.0,WOULD YOU EVER TRUST THE LIB DEMS IN A COALITION GOVERNMENT AGAIN ?     ,#politics #brexit #LeaveEU #VoteLeave #leave
