,user_id,tweet_id,time,location,polarity,subjectivity,text, hashtags
1693,716378272725078016,773219456193527808,2016-09-06 14:00,,0.0,0.0,DON'T LET Your Kids Be Conscripted in Juncker's       pic.twitter.,#EUarmy #euref #VoteLeave #brexit #Remain
1694,250391179,773218080029863936,2016-09-06 13:55,Birmingham,0.0,0.0,This. This. This.     …,#Brexit #VoteLeave #VoteRemain
1695,3429568685,773214890182008838,2016-09-06 13:42,,0.0,0.0,Invasion of London Airport by  . How come the police took 6 hours to organise bolt cutters and a Paddy Wagon.  ,#BLM #Brexit #VoteLeave
1696,22619485,773208897565917185,2016-09-06 13:19,"Exeter, England",0.0,0.0,David Davis Minister For  Speech In Parliament....  ,#Brexit #LeaveEU
1697,19644086,773208001473830913,2016-09-06 13:15,North London,0.2497159090909091,0.5761363636363637,New born baby  had a full head of hair haha that's funny!    pic.twitter.,#BorisJohnson #Brexit #VoteLeave
1698,379851447,773207988140146688,2016-09-06 13:15,London UK,0.0,0.125,Norway was told the same lies.     pic.twitter.,#EU #brexit #referendum #voteleave
1699,3235220435,773207932603404288,2016-09-06 13:15,United Kingdom,0.0,0.0,Brexit: The phoney war    ,#Brexit #UKIP #LeaveEU
1700,379851447,773206978315313152,2016-09-06 13:11,London UK,0.1,0.1,France declares 'state of economic emergency' Germany faces financial ruin     ,#EU #brexit #referendum #voteleave
1701,379851447,773206473375645700,2016-09-06 13:09,London UK,0.0,0.0,Brussels chief warns EU will punish Britain if we vote to leave     ,#EU #brexit #referendum #voteleave
1702,3235220435,773204358804692993,2016-09-06 13:00,United Kingdom,-0.8,0.9,Reported hate crimes increase by 60% since Brexit     ,#Brexit #HateCrime #UKIP #LeaveEU
1703,4914890427,773202635193217024,2016-09-06 12:54,"North West, England",0.425,0.6666666666666666,   you should be ashamed! Look after your own first     …,#Brexit #Art50 #LeaveEU
1704,3055998605,773202394050093056,2016-09-06 12:53,,0.0,0.0, was never a party manifesto 'cos  was not a party.  …,#VoteLeave #Brexit
1705,4893606551,773202384822624256,2016-09-06 12:53,"Montreux, Switzerland",0.0,0.0, is it science fiction or neither? Pls vote & RT Tnx        772659004120133632 …,#psychiatry #VoteLeave #VoteTrump #Brexit #DJT #HRC #polls
1706,3235220435,773201006754684928,2016-09-06 12:47,United Kingdom,0.0,0.0,Poland concerned for its citizens post-'Brexit'     ,#Brexit #BrexitBritain #UKIP #LeaveEU
1707,4914890427,773197764796747776,2016-09-06 12:34,"North West, England",0.0,0.0, Cameron promised  by Sept  thats not being honoured      …,#Art50 #CloseOurBorders #LeaveEU #Brexit
1708,262761577,773195777762070528,2016-09-06 12:26,,0.0,0.0,Lets hope these changes are made as speedy as poss for everyones sake.  .    …,#Brexit #LeaveEU
1709,1253618394,773190072225107968,2016-09-06 12:04,,0.0,0.0,C'mon. One vote off 100.     …,#Brexit #VoteLeave
1710,720098948736790528,773178442292588548,2016-09-06 11:18,"Norwich, England",0.08333333333333333,0.43333333333333335,HEY YOU TROUBLE MAKERS ... THE EU WANTS YOU TO HURRY UP ;-)  bbc.co. cs-37270599 …     pic.twitter.,#Brexit #LeaveEU #EUref #leave
1711,720098948736790528,773176425369272320,2016-09-06 11:09,"Norwich, England",1.0,0.3,IN YOUR OPINION: WHO WOULD HAVE BEEN THE BEST PRIME MINISTER ?     ,#Brexit #LeaveEU #EUref #VoteLeave
1712,720098948736790528,773174517485166592,2016-09-06 11:02,"Norwich, England",0.0,0.0,Come on Corbyn !  bbc.co. cs-37279761 …         pic.twitter.,#LabourLeadership #Labour #Union #Brexit #EUref #LeaveEU #VoteLeave #leave
1713,3000550486,773170581441314817,2016-09-06 10:46,Tameside,0.0,0.0,The time is NOW       pic.twitter.,#Brexit #Grexit #Italexit #FreeEurope #LoveEurope #LeaveEU
1714,379851447,773170328600190976,2016-09-06 10:45,London UK,0.175,0.325,How our politicians have lied about true purpose of the European behemoth     ,#EU #brexit #referendum #voteleave
1715,379851447,773169319308058624,2016-09-06 10:41,London UK,-0.2,0.0,Leak from Brussels reveals NHS will be 'KILLED OFF' if Britain remains in EU     ,#EU #brexit #referendum #voteleave
1716,379851447,773169065154191360,2016-09-06 10:40,London UK,0.6,1.0,Britain's own fisheries     brexit FB page:  pic.twitter.,#EU #brexit #referendum #voteleave
1717,51865464,773156185180700673,2016-09-06 09:49,,0.0,0.0,Yep well put     …,#Brexit #LeaveEU
1718,3235220435,773155049056919552,2016-09-06 09:45,United Kingdom,-0.4833333333333333,0.5333333333333333,Five steps to end the ‘social evil’ of poverty for Brexit children    ,#Brexit #UKIP #LeaveEU
1719,3235220435,773153101943541760,2016-09-06 09:37,United Kingdom,0.0,0.0,Juncker-May discord around post-Brexit commercial agreements     ,#Brexit #BrexitBritain #UKIP #LeaveEU
1720,3235220435,773153017113829376,2016-09-06 09:36,United Kingdom,0.0,0.0,Theresa May relegated to second rung in humiliating G20 leaders — BREXIT     ,#Brexit #BrexitBritain #UKIP #LeaveEU
1721,4914890427,773149290562748417,2016-09-06 09:22,"North West, England",0.0,0.0,Seize any assets gained whilst in the UK & force repayment of any benefits too      …,#LeaveEU #Brexit #InvokeArticle50NOW
1722,1005541,773146741453557760,2016-09-06 09:12,"Belvedere, Greater London",0.25,0.15000000000000002,Worth a read for  fans crowing about short-term economic stability and  people alike.    …,#Brexit #Remain #LeaveEU
1723,716378272725078016,773144150594256896,2016-09-06 09:01,,0.1,0.1,What Churchill Really Thought of the European Union  dailysquib.co. at-churchill-really-thought-of-the-european-union.html …       ,#eureferendum #euref #brexit #Remain #strongerin #VoteLeave #GO
1724,221247281,773133470222708736,2016-09-06 08:19,איירגאנס (EL PASO - JUAREZ),0.16666666666666666,0.3083333333333333,Why do nearly all journalists regardless of language country or media sound like they were cloned from the same egg?   ,#Brexit #LeaveEU #AP
1725,2751594014,773132323638407168,2016-09-06 08:14,"Helsinki, Finland",0.0,0.0,By time  happens Remain might be a majority overturning    pic.twitter.,#Brexit #VoteLeave
1726,716378272725078016,773128994476683264,2016-09-06 08:01,,-0.1,0.1,Experts: Britain Would Be Stronger Militarily Out of the EU  dailysquib.co. perts-britain-stronger-militarily-eu.html …      ,#eureferendum #euref #brexit #Remain #voteleave #june23
1727,1005541,773113787884994560,2016-09-06 07:01,"Belvedere, Greater London",0.8,1.0, and proud    …,#remoaner #Brexit #LeaveEU
1728,701078951184220160,773113323122520064,2016-09-06 06:59,,0.0,0.0,UN Report Slams hateful “Divisive” & “Xenophobic”  far-right  Campaign at any cost |  ,#VoteLeave #Brexit #StopBrexit
1729,2529370994,773112005611880448,2016-09-06 06:54,,0.0,0.0,'The UK can b***** off' Furious European conference delegate urges Britain to leave EU  express.co. /DLD-conference-delegate-Brexit-debate …   ,#brexit #LeaveEU #UKIP
1730,379851447,773111672051494912,2016-09-06 06:52,London UK,0.0,0.0,Brexit is NOT biggest risk to the global economy and it WON'T be fatal     ,#EU #brexit #referendum #voteleave
1731,379851447,773111419021717505,2016-09-06 06:51,London UK,0.0,0.0,Eurozone is 'flying with one engine' Disaster looms for EU     ,#EU #brexit #referendum #voteleave
1732,379851447,773110914144956417,2016-09-06 06:49,London UK,0.0,0.05,UK exit would cause 'BIG problems' for GERMAN banks watchdog warns     ,#EU #brexit #referendum #voteleave
1733,2751594014,773102898460889088,2016-09-06 06:17,"Helsinki, Finland",0.16666666666666666,0.3333333333333333, was driven by the preferences of older voters  politico. ns-youth-voted-remain-leave-eu-brexit-referendum-stats… ,#VoteLeave #Brexit
1734,3235220435,773098774944215040,2016-09-06 06:01,United Kingdom,-0.1,0.1,Trump Farage Use Daesh-Like Propaganda Tools - UNHR Commissioner    ,#Brexit #UKIP #LeaveEU
1735,3235220435,773098208994156544,2016-09-06 05:59,United Kingdom,0.0,0.0,Steve Bell on Theresa May Brexit pledges and G20 – cartoon    ,#Brexit #UKIP #LeaveEU
1736,3235220435,773098080103124992,2016-09-06 05:58,United Kingdom,0.0,0.05,UN human rights chief condemns Western 'demagogues'    ,#Brexit #UKIP #LeaveEU
1737,458264478,773096505142079488,2016-09-06 05:52,,0.0,0.0,   The majority of electorate who voted support   must happen! pic.twitter.,#VoteLeave #Brexit
1738,23588644,773095961300172800,2016-09-06 05:50,,0.2272727272727273,0.5454545454545454,"Yet another ""positive  effect"" on the UK's economy the  campaign was talking about.   …",#Brexit #LeaveEU
1739,19210198,773085738107867136,2016-09-06 05:09,Wales/ Cymru,0.0,0.0,  German socialists sceptical about Arriva flotation after Brexit vote  -socialists-sceptical-about.html …,#brexit #voteleave
1740,716378272725078016,773084084453212160,2016-09-06 05:03,,0.0,0.0,Historians: In 1939 UK Faced Nazi Threat In 2016 UK Faces Soviet Threat  dailysquib.co. storians-1939-uk-faced-nazi-threat-2016-uk-faces-soviet-threat.html …    ,#eureferendum #remain #brexit #voteleave
1741,483320571,773077808096608256,2016-09-06 04:38,Snapewood,0.0,0.0,Christopher Howarth’s  Guide to  : Article 50 Try and make sense of this.     conservativehome.  …,#Idiots #Brexit #EU #voteleave #politics
1742,19644086,773077431959912448,2016-09-06 04:36,North London,0.21103896103896105,0.4951298701298701, … NEW POLL.  of voters inc. 30% Remain say we R on right course with   pic.twitter.,#Brexit #VoteLeave
1743,4866215235,773075124933320704,2016-09-06 04:27,,0.35,0.4,Seems Remainers love the EU so much they'll vandalise trains to show it   pic.twitter.,#Brexit #LeaveEU
1744,716378272725078016,773068578497191936,2016-09-06 04:01,,0.0,0.0,  debt liability alone is €355 Billion  dailysquib.co. -the-eurozone-risks-intensifying-its-demise-why-britain-must-leave.html …     ,#Greece #eu #brexit #voteleave #euref #remain #go
1745,19644086,773060808146321408,2016-09-06 03:30,North London,0.14285714285714285,0.26785714285714285, thesun.co. ritains-services-sector-enjoys-a-soaring-summer-with-a-surge-in-exports-and-tourism-and-dashes-fears-of-post-brexit-recession… SERVES EU RIGHT Britain bounces back surge in exports & tourism.    ,#Brexit #VoteLeave #borisjohnson
1746,2751594014,773057008425635840,2016-09-06 03:15,"Helsinki, Finland",-0.2916666666666667,0.5416666666666666,Choices after  : Hard  ahead    pic.twitter.,#VoteLeave #Brexit
1747,4914890427,773053508971012096,2016-09-06 03:01,"North West, England",0.0,0.0,Well said Piers Morgan            …,#InvokeArticle50NOW #LeaveEU #CloseOurBorders #Brexit #Nexit #Daxit #Swexit #Frexit #Italexit
1748,379851447,773052017807921152,2016-09-06 02:55,London UK,0.5,0.5,Taxpayers to stump up MORE cash for eurozone bailouts without Brexit     ,#EU #brexit #referendum #voteleave
1749,379851447,773051510443900928,2016-09-06 02:53,London UK,0.0,0.0,Labour MP John Mann backs Brexit to quit 'imploding' EU     ,#EU #brexit #referendum #voteleave
1750,379851447,773051256541736960,2016-09-06 02:52,London UK,-0.0625,0.10096153846153846,We CAN'T stop EU army as Brussels regularly overrules UK on foreign policy     ,#EU #brexit #referendum #voteleave
1751,3235220435,773049746462244864,2016-09-06 02:46,United Kingdom,0.0,0.0,'Waffle' Taunts As Davis Outlines Brexit Plans    ,#Brexit #UKIP #LeaveEU
1752,3235220435,773049690375987201,2016-09-06 02:46,United Kingdom,0.0,0.0,So Brexit means Brexit means Brexit. Is that it?    ,#Brexit #UKIP #LeaveEU
1753,3297922053,773044455196725248,2016-09-06 02:25,"England, United Kingdom",0.5,0.5, :  says  to become  in   despite  . More news at  Tune1st.com  ,#BREAKING #TheresaMay #UK #leader #free #trade #Brexit #LeaveEU #G20summit
1754,3235220435,773041810797162496,2016-09-06 02:15,United Kingdom,0.0,0.0,Government rules out points-based immigration system after Brexit    ,#Brexit #UKIP #LeaveEU
1755,3297922053,773041436006707200,2016-09-06 02:13,"England, United Kingdom",0.5,0.5, :   fall in   amid  concerns. More  at  Tune1st.com  ,#BREAKING #UK #universities #world #rankings #Brexit #news #education #LeaveEU
1756,345131103,773039687128743937,2016-09-06 02:06,London and Los Angeles,0.0,0.0,BLACKOUT: Media Ignores Pro  Demo but HUNDREDS Of Articles Published On Pro-EU Protest  ,#Brexit #VoteLeave
1757,716378272725078016,773038349862985729,2016-09-06 02:01,,0.05,0.6,Protection of Women’s Rights not contingent on EU membership  dailysquib.co. sela-stuart-best-way-ensure-workers-womens-rights-parliament-directly-accountable-people.html …      ,#euref #womensrights #eu #voteleave #remain #brexit
1758,884302994,773037898342039552,2016-09-06 01:59,"London, England",0.0,0.0,Nigel your job is not finished!   ,#brexit #VoteLeave
1759,884302994,773037602299645953,2016-09-06 01:58,"London, England",-0.03571428571428571,0.16964285714285715,We can expect the same on trade single market laws...  ,#brexit #VoteLeave
1760,716378272725078016,773023240436477952,2016-09-06 01:01,,0.0,0.0,Which  Will You Vote For?  dailysquib.co. u-referendum-video-which-nhs-will-you-vote-for.html …       pic.twitter.,#NHS #VoteLeave #EUref #Brexit #SaveOurNHS #remain #EUreferendum
1761,716378272725078016,773009386201550848,2016-09-06 00:06,,-0.1555555555555556,0.2888888888888889, Talking  Down Again Scare Tactics         ,#IMF #Britain #brexit #no2eu #notoeu #voteout #britainout #voteleave #Remain #go
1762,549226241,772980321226674176,2016-09-05 22:10,,0.05,0.35,Apparently thoughts strap bombs to themselves and blow people up. Yup these are SJW's in 2016     …,#Brexit #LeaveEU
1763,379851447,772978879493447681,2016-09-05 22:05,London UK,0.0,0.0,Lord Tebbit: Britain Must be Rescued from the EU:     ,#EU #brexit #referendum #voteleave
1764,379851447,772978626438557696,2016-09-05 22:04,London UK,0.0,0.0,Steven Woolfe: Establishment Will Try To Reverse Referendum  youtube. Jy2Yg …    ,#EU #brexit #referendum #voteleave
1765,379851447,772978373526188032,2016-09-05 22:03,London UK,0.0,0.0,European SUPERSTATE to be unveiled     ,#EU #brexit #referendum #voteleave
1766,9707572,772977861510725632,2016-09-05 22:00,All major cities worldwide,0.0,1.0,John Redwood the Only Vanguard Brexiteer?  dailysquib.co. hn-redwood-vanguard-brexiteer.html …       pic.twitter.,#brexit #voteleave #euref #remain #go #britainout
1767,3235220435,772977716102586370,2016-09-05 22:00,United Kingdom,0.0,0.0,Japan warns U.K.: Companies could leave over Brexit    ,#Brexit #UKIP #LeaveEU
1768,3235220435,772966322628067328,2016-09-05 21:15,United Kingdom,0.21666666666666665,0.36666666666666653,Australian PM Pushes For a 'Strong' Post-Brexit Trade Deal with the UK    ,#Brexit #UKIP #LeaveEU
1769,138042160,772951594254082048,2016-09-05 20:16,"London, England",0.3037878787878788,0.6681818181818183, exposed elite. World turning on Clinton. She for rich elite & new world order.  break free vote  ,#Brexit #america #voteleave
1770,1005541,772923477519134720,2016-09-05 18:24,"Belvedere, Greater London",0.5,0.5,So again the places with *most^ immigration voted  : why are they talking about immigration?   pic.twitter.,#Remain #Brexit #LeaveEU
1771,3135565264,772906934206861312,2016-09-05 17:19,GREAT Britain,0.0,0.14166666666666666,this is not on & will keep wages low for  workersthe same British people who voted to     …,#British #LeaveEU #Brexit
1772,203500053,772899486117007360,2016-09-05 16:49,"Guildford, England",-0.16666666666666669,0.5833333333333334,Just embarrassing from David Davis sad to see. No ideas no facts brainless rhetoric: Classic    theguardian.  …,#Brexit #voteLeave
1773,1005541,772897839118770176,2016-09-05 16:42,"Belvedere, Greater London",0.0,0.0,national consensus my arse  ,#Brexit #LeaveEU
1774,2784280027,772891814458224644,2016-09-05 16:19,"Cardiff, Wales UK",0.0,0.0,Backsliding  don't even think about it!  ,#Brexit #VoteLeave
1775,252062789,772887101520117761,2016-09-05 16:00,Havant Constituency,0.0,0.0,Backtracking on   immigration controls will please  MP who supports remaining in the   …,#Brexit #voteleave #Havant #EU
1776,262761577,772880636306743297,2016-09-05 15:34,,0.0,0.0,Worrying stats..Where have the 40% gone.    772875276564910080 …,#Brexit #LeaveEU
1777,224183827,772879202580361217,2016-09-05 15:28,"london, uk",0.5,0.9,  -thirds-of-voters-believe-britain-on-right-course-re-brexit… Latest poll of over 8K.  of voters want   inc. 30% Remain  pic.twitter.,#Brexit #VoteLeave
1778,3135565264,772876621657305088,2016-09-05 15:18,GREAT Britain,0.0,0.0, Minister for  speech in Parliament      ,#DavidDavis #Brexit #BrexitBritain #LeaveEU #OpenBritain #VoteLeave #No2EU
1779,3429568685,772876518590734337,2016-09-05 15:18,,0.2,0.4, EU membership.  puts the deadline for visa free travel back to December this year that's telling them  ,#Turkey #Juncker #Brexit #VoteLeave
1780,379851447,772874988043075585,2016-09-05 15:12,London UK,0.0,0.0,German Minister drops gaffe which shows why we need a Brexit     ,#EU #brexit #referendum #voteleave
1781,379851447,772874483287883778,2016-09-05 15:10,London UK,0.0,0.0,Winston Churchill.     brexit FB page:  pic.twitter.,#EU #brexit #referendum #voteleave
1782,3235220435,772874332464906241,2016-09-05 15:09,United Kingdom,0.3125,0.625, - you are totally discredited and the most toxic politician known Bugger off!    ,#Farage #Brexit #UKIP #LeaveEU
1783,3235220435,772873639553339393,2016-09-05 15:06,United Kingdom,0.0,0.06666666666666668,Japan goes public with Brexit demands says data flow deals must be protected    ,#Brexit #UKIP #LeaveEU
1784,3235220435,772873157212504064,2016-09-05 15:04,United Kingdom,0.0,0.0,David Davis vows to build national consensus on Brexit    ,#Brexit #UKIP #LeaveEU
1785,379851447,772872959996354560,2016-09-05 15:04,London UK,0.0,0.0,Ex-Australian PM: Get out of EU you have LOST your sovereignty     ,#EU #brexit #referendum #voteleave
1786,3055998605,772871933943767050,2016-09-05 15:00,,0.0,0.0, not a party  up to government now.  …,#Voteleave #Brexit
1787,3135565264,772867912596066304,2016-09-05 14:44,GREAT Britain,0.11363636363636365,0.2727272727272727,this is a historic & positive moment for our nation      pic.twitter.,#DavidDavis #Brexit #BrexitBritain #OpenBritain #voteLeave
1788,722933111537983488,772862372147040256,2016-09-05 14:22,,0.0,0.5,"damocrat:  : ""Everyone said   so I voted leave"" There are not enough characters for the swear words in my head https://…",#Brexit #VoteLeave
1789,262761577,772854300678709248,2016-09-05 13:49,,0.0,0.0,Armed officers set to patrol French train system amid terror crackdown!  .  .   …,#Brexit #LeaveEU
1790,751658395766235136,772851707416088577,2016-09-05 13:39,England,0.0,0.0, is threatening to sink  's  market (via  )  businessinsider.com. ce-warning-brexit-could-drive-market-out-of-london-2016-9 … ,#Brexit #London #insurance #voteleave
1791,751658395766235136,772851358219247616,2016-09-05 13:38,England,0.0,0.0, : Japanese government sows doubts about  ’s  HQ  via  ,#Brexit #Nissan #Sunderland #voteleave
1792,379851447,772850666071060485,2016-09-05 13:35,London UK,0.0,0.0,All you'll have to do is vote.    brexit FB page:  pic.twitter.,#EU #brexit #voteleave
1793,379851447,772850412856762368,2016-09-05 13:34,London UK,0.175,0.325,How our politicians have lied about true purpose of the European behemoth     ,#EU #brexit #referendum #voteleave
1794,379851447,772849906759467008,2016-09-05 13:32,London UK,-0.2,0.0,Leak from Brussels reveals NHS will be 'KILLED OFF' if Britain remains in EU     ,#EU #brexit #referendum #voteleave
1795,3235220435,772849419746152448,2016-09-05 13:30,United Kingdom,0.0,0.1,Poland to make urgent UK visit following post-Brexit attacks     ,#Brexit #HateCrime #UKIP #LeaveEU
1796,3235220435,772841745176489984,2016-09-05 13:00,United Kingdom,0.0,0.0,The death wish of western politics    ,#Brexit #UKIP #LeaveEU
1797,131192086,772839911045160960,2016-09-05 12:52,Originally from Nottingham UK,0.14069264069264067,0.3634199134199134,Two thirds believe  is on the right track following  vote new poll shows -  -  ,#Britain #Brexit #Betteroffout #EU
1798,1099461360,772838532297658368,2016-09-05 12:47,"East Midlands, England",0.08522727272727272,0.4285714285714286,When I think   types are simple it's because of the people live on air now!  ,#voteleave #brexit
1799,2529370994,772836081066713088,2016-09-05 12:37,,0.0,0.0,NIGEL FARAGE: Theresa May is 'backsliding' on Brexit and will face 'electoral consequences'  heresa-may-brexit-eu-referendum-article-50-2016-9??r=US&IR=T …   ,#brexit #leaveeu #ukip
1800,565196759,772834362018656256,2016-09-05 12:30,itmattersnothowstraightthegate,0.26666666666666666,0.4, =  =  =  =  if you can't grasp such a premiss go back to watching ya soaps lol,#Brexit #Article50 #GamesTheory #theartofnegotiation #LeaveEU
1801,3235220435,772834178077458432,2016-09-05 12:30,United Kingdom,0.0,0.0,Japan's issued 18 demands for Brexit or businesses could leave for EU    ,#Brexit #UKIP #LeaveEU
1802,262761577,772830144956362753,2016-09-05 12:13,,0.0,0.0,Merkel resists pressure to change refugee policy.  .    …,#Brexit #LeaveEU
1803,44034144,772830037733093377,2016-09-05 12:13,"Westminster, Colorado",0.17045454545454544,0.4545454545454545, The new  already refusing to listen to citizens. Throw her out!    772828004435230720 …,#PMTheresaMay #VoteLeave #Brexit
1804,296254237,772829713698021376,2016-09-05 12:12,London,0.0,0.0,  - Well 52%ers no £350m a week to  and no points based immigration. Getting the feeling you've been had over?,#Brexit #VoteLeave #NHS
1805,262761577,772828716670001154,2016-09-05 12:08,,-0.5,0.5,"This is what the hauliers face on a daily basis to earn their living ""Terrifying""  .    …",#Brexit #LeaveEU
1806,19644086,772825761371852801,2016-09-05 11:56,North London,0.5333333333333333,0.5833333333333334,Will European Communities Act B repealed says Sir Bill Cash. A great day for him so happy for him.  .  . ,#Brexit #voteleave
1807,379851447,772825381858582530,2016-09-05 11:55,London UK,0.0,0.0,100 leading City names sign letter backing Brexit     ,#EU #brexit #referendum #voteleave
1808,23625401,772824509200097280,2016-09-05 11:51,"Liverpool, England",0.4833333333333333,0.75,Effectively wiping the slate clean of the promises of  during  . ,#VoteLeave #EURef #Brexit
1809,44034144,772823614684958720,2016-09-05 11:48,"Westminster, Colorado",0.0,0.0,  Time for  to appoint  to  !  ,#HMQEII #HouseOfLords #VoteLeave #Brexit
1810,379851447,772822598162022401,2016-09-05 11:44,London UK,0.0,0.0,Euro-court outlaws criticism of EU | via      ,#EU #brexit #referendum #voteleave
1811,379851447,772822091280384000,2016-09-05 11:41,London UK,0.0,0.0,This is Switzerland.     brexit FB page:  pic.twitter.,#EU #brexit #referendum #voteleave
1812,19644086,772819168655802368,2016-09-05 11:30,North London,-0.15625,0.125,Speaker comments on Foreign Secretary's 'beaming countenance!       …,#Brexit #VoteLeave
1813,3235220435,772819105858588672,2016-09-05 11:30,United Kingdom,0.13636363636363635,0.4545454545454545,Britain's May seeks out new trading relations post-Brexit    ,#Brexit #UKIP #LeaveEU
1814,19644086,772817869658873857,2016-09-05 11:25,North London,0.0,0.0,Sovereignty & supremacy will be beyond doubt! HOORAY!    ,#Borisjohnson #Brexit #VoteLeave
1815,19644086,772817101782413314,2016-09-05 11:22,North London,0.5136363636363637,0.6477272727272727,David Davis statement on   great to hear a positive optimistic statement after gloomadons.   beside him.,#Brexit #voteleave
1816,4749971242,772815422815084544,2016-09-05 11:15,United Kingdom,0.0,0.0,Their hubris blinds them as folks wake up and the truth gains momentum      …,#KnowThyselfAndThineEnemy #brexit #leaveEU
1817,3235220435,772815366120767488,2016-09-05 11:15,United Kingdom,0.0,0.0,Brexit: EU's growing impatience over UK's lack of clarity     ,#Brexit #SingleMarket #UKIP #LeaveEU
1818,3399023392,772813596510281729,2016-09-05 11:08,Leeds,-0.30000000000000004,0.9,This is an absolute disgrace; it's shameful Well done  and  supporters for legitimising hate  …,#VoteLeave #Brexit
1819,769307515872014337,772811835242385408,2016-09-05 11:01,United Kingdom,0.55,0.65,Selling Britain Off On the Cheap is Good Says   dailysquib.co. -referendum-selling-britain-off-on-the-cheap-is-good-says-eu.html …     pic.twitter.,#EU #eureferendum #euref #brexit #VOTELEAVE
1820,3235220435,772811566597169152,2016-09-05 11:00,United Kingdom,0.0,0.0,US Britain downplay trade concerns after Brexit    ,#Brexit #UKIP #LeaveEU
1821,262761577,772803066957537280,2016-09-05 10:26,,0.3,0.45,500 Migrant rescued again off cost of Libya. Mostly all young males..What have you done Merkel.  .   772798781117067264 …,#Brexit #LeaveEU
1822,308174015,772802179685945344,2016-09-05 10:22,,0.0,0.0,Theresa May is Anti-Britain and Pro-Islam Migration to UK         …,#Brexit #BritainOut #VoteLeave #England #London #UKIP
1823,308174015,772801638721400833,2016-09-05 10:20,,0.0,0.0,Theresa May Must be Ousted          …,#Brexit #VoteLeave #England #London #BritainOut #UKIP #BritainOut
1824,262761577,772801526880436225,2016-09-05 10:20,,0.0,0.0,6 Afghan and Iraqi migrants arrested after 8 women assaulted at  festival.   .   …,#Austrian #Brexit #LeaveEU
1825,379851447,772800594021089280,2016-09-05 10:16,London UK,0.0,0.0,Britain's song is not yet sung  youtube. _5Vm8 …    ,#EU #brexit #referendum #voteleave
1826,3235220435,772800239875096576,2016-09-05 10:15,United Kingdom,0.0,0.0,Brexit protest: March for Europe rallies held across UK     ,#Brexit #BrexitBritain #UKIP #LeaveEU
1827,379851447,772800085658927104,2016-09-05 10:14,London UK,0.1,0.4,Toby Young: Brexit: Facts Not Fear  youtube. r4Ra8 …    ,#EU #brexit #referendum #voteleave
1828,262761577,772799613103464448,2016-09-05 10:12,,0.13636363636363635,0.5,Live ...MPs discuss about refugees at House of Commons now...    …,#Brexit #LeaveEU
1829,379851447,772799580811497472,2016-09-05 10:12,London UK,0.0,0.0,Chancellor plotting 'punishment' Budget with threat to hike income tax     ,#EU #brexit #referendum #voteleave
