,tweet_id,user_id,time,geo,location,text,hashtags
1148,709654773398638592,2684862253,2016-03-15 04:17,,East Hampshire,"Brexit This is nonsense. NATO has nothing to do with EU BBC News: Out vote 'could weaken Nato', says top US general  bbc.co. cs-eu-referendum-35808955 …",#Brexit
1149,709650486614474752,89202487,2016-03-15 04:00,"Cardiff, Wales",Wales,Wonder who Brexit will roll out to front their campaign on the eve of the Budget? Beware the IDS of March. IdesOfMarch,#Brexit #IdesOfMarch
1150,709645465168580608,394525610,2016-03-15 03:40,,,"EU referendum: Out vote 'could weaken Nato', says top US general -  bbc.co. cs-eu-referendum-35808955 … bugger off it's got nowt to do with u. Brexit",#Brexit
1151,709641796251418624,35346943,2016-03-15 03:26,,"Taiwan(Sanchong,Taipei)",Mandelson claims Britain will pay ‘more for less’ in post- Brexit deal with EU | UK | News | Daily Express:  express.co. /Lord-Mandelson-Business-Secretary-Brexit-EU-Britain-Deal-Canadian-Economy?utm_source=feedburner&utm_medium=feed&utm_campaign=Feed%3A+daily-express-news-showbiz+%28Daily+Express+%3A%3A+News+%2F+Showbiz+Feed%29 …,
1152,709637769937588224,2969760609,2016-03-15 03:10,,Brussels,In Playbook: BREXIT — KAMALL FACES THE SYED-LINES — Story:  pic.twitter.,#BREXIT
1153,709635795930451968,246196874,2016-03-15 03:02,,Blog:,British EPP compares Brexit ballot paper to Hitler’s rigged voting slips –   by ,
1154,709630163265429504,4873535621,2016-03-15 02:39,,The West Country,Brexit ahead ( strongerin less motivated to vote (surprise!) and GE15 guru Crosby breaks cover VoteLeave  telegraph.co.  …,#Brexit #strongerin #GE15 #Crosby #VoteLeave
1155,709624303025836032,1062642788,2016-03-15 02:16,,,Unfollowing  wasn't easy. His pro EU column was though an enormous disappointment to many. Brexit LeaveEU,#Brexit #LeaveEU
1156,709619689224323072,2380466677,2016-03-15 01:58,,"Manchester, England","CBI says vote remain...mmm more quality advice from the people who gave us ""join the euro without delay"" brexit leaveEU",#brexit #leaveEU
1157,709605038293950464,304768023,2016-03-15 00:59,,"Los Angeles, Ca",Business Services | UK environment e-briefing – Brexit and UK Environmental law - Eversheds… ,
1158,709600785814786049,1019470508,2016-03-15 00:43,,,White House jabs London mayor over Brexit outburst ,
1159,709596403811528704,3184569685,2016-03-15 00:25,,"New York, USA",Brexit 'could weaken Nato' - US general: If Britain votes to leave the European Union it could have a negative... ,
1160,709594672532951041,612473,2016-03-15 00:18,"Hillingdon, London",London, Brexit could weaken US dominance of NATO by removing UK poodle from EU - US running own operation fear of Russia -US bigger threat,#Brexit
1161,709583911244984321,1944466748,2016-03-14 23:36,,london, I am tempted to have 50 quid on a double Brexit and Trump2016 for President,#Brexit #Trump2016
1162,709578350272995328,935566897,2016-03-14 23:13,,,Lynton Crosby on Brexit : currently likely as leavers more likely to vote.  telegraph.co.  …,
1163,709576155557330945,16492455,2016-03-14 23:05,,Worldwide,Reuters: Brexit camp can't count on family ties to bind for trade ,
1164,709549918222999553,633151142,2016-03-14 21:20,,Destroying Blame Culture,Meanwhile those that brought Ireland Bankrupt are backing Stay In. Keep trying Brexit  …,#Brexit
1165,709536942057250817,150224923,2016-03-14 20:29,,Washington DC,"Mandelson weighs in on impact of ' Brexit ' on Ireland, north & south, via     …",
1166,709526234976247808,526280942,2016-03-14 19:46,,Australia,"Because choudray islamisviolent have declared hatred, death & hell on police to cause collapse of our laws Brexit   …",#islamisviolent #Brexit
1167,709518622557921280,310643025,2016-03-14 19:16,,Yorkshire,Brexit League Table: How much do our European neighbours love us (or hate us)?  express.co.  … pic.twitter.,
1168,709517786389860353,581325349,2016-03-14 19:13,,," catching up with pod, Obama refused to comment on Scot ind as was none of his business, why comment on brexit then?",
1169,709510331777880068,415308582,2016-03-14 18:43,,,When you realize Brexit will affect you MUBXL  …,#MUBXL
1170,709503172218376192,4883631935,2016-03-14 18:15,,, Brexit is chance to ‘heal a rift’ with Commonwealth  BREXIT GO pic.twitter.,#BREXIT #GO
1171,709498591254093824,62074058,2016-03-14 17:57,,,Look at this  . You are responsible. You did this to us.  telegraph.co. … Brexit,#Brexit
1172,709495885755863040,2799108808,2016-03-14 17:46,,South Carolina,Diageo and Chivas sign letter against ‘ Brexit ’...  Chivas,#Chivas
1173,709483899940900864,95687597,2016-03-14 16:58,,New York and Washington D.C.,Brexit and Britain: what would it mean for UK trade? ,
1174,709479367995424768,124313779,2016-03-14 16:40,,"Cambridge, UK ",     Yes very well researched conspiracy by very intelligent people! Brexit,#Brexit
1175,709476442585899011,77776648,2016-03-14 16:29,,Italy,Jeremy Clarkson supping on the Amazon EU teat?  via  Brexit LeaveEU .  . ,#Brexit #LeaveEU
1176,709472663803203585,538078599,2016-03-14 16:13,,Aberdeenshire, I enjoyed this one! Looking forward to Brexit ones too.,
1177,709468620687073281,380688481,2016-03-14 15:57,,"LA, CA",'Failing' Grayling saves Michael Gove's blushes in Queen Brexit row ,
1178,709464182572261377,47636400,2016-03-14 15:40,,London,'Failing' Grayling saves Michael Gove's blushes in Queen Brexit row ,
1179,709459664421912578,4143395536,2016-03-14 15:22,,United Kingdom,"Yes, its all there in its putrid façade & in direct opposition to learned peoples. Brexit   …",
1180,709454268214976512,69080476,2016-03-14 15:00,,London,"  however after a short time, ~about 6 months the days will get longer again so Brexit better in the long run",#Brexit
1181,709452564211879936,3018816923,2016-03-14 14:54,,Global,On Consented TV we discussed what Brexit would look like for PoC  cc   ,#Brexit
1182,709447069098971136,1665457951,2016-03-14 14:32,,Amsterdam,'Anti- Brexit houding Obama is hypocriet'  powned.  … Nieuws Nederland,#Nieuws #Nederland
1183,709444957199798275,801040298,2016-03-14 14:23,,,Rapturous applause as  finishes his speech on the EU and takes the Hot Seat. ItHS LeaveEU Brexit,#ItHS #LeaveEU #Brexit
1184,709440420741300225,257531308,2016-03-14 14:05,,uk," ""It (Commission) shall execute the budget and manage programmes"". Accounts not signed off by auditors for 15 years! Brexit",#Brexit
1185,709439127079354368,182502269,2016-03-14 14:00,,,Ted Cruz: Obama anti- Brexit campaign will see ‘England pull out of EU’: Barack Obama’s reportedly impending vi... ,
1186,709432621823102976,480660323,2016-03-14 13:34,,, Have a browse of this  caef.org. 1b.jpg … Brexit,#Brexit
1187,709430736902864896,51048217,2016-03-14 13:27,,"Winchester, United Kingdom",‘What Brexit might mean for UK Travel’ -  …,
1188,709423417368432641,294793168,2016-03-14 12:58,,Gibraltar,Poll: Scots would vote for independence if UK votes for Brexit  scotsman. poll-scots-would-vote-for-independence-if-uk-votes-for-brexit-1-4066136 …,
1189,709421544393588736,4120967009,2016-03-14 12:50,,"England, United Kingdom","Where willUKtrade if Brexit wins?Can't count onEUcos trade agreements takelong time,orUSAcos weR tinywith no natural resources&China'sbroke",
1190,709420018799419394,121855199,2016-03-14 12:44,,Great Britain,brexit for better! britishlivesmatter ukreferendum grassrootsout voteleave  …,#brexit #britishlivesmatter #ukreferendum #grassrootsout #voteleave
1191,709416458661400580,778976910,2016-03-14 12:30,,,EU Referendum: Tech firms believe Brexit would be bad for business  friendlydb. u-referendum-tech-firms-believe-brexit-would-be-bad-for-business …,
1192,709412769917968384,68659351,2016-03-14 12:15,,Where in the world am I?,UK politicians worry about Brexit while Rome (and most other places) burn ,
1193,709408756937916416,49143716,2016-03-14 12:00,,Brussels,London's financial sector isn't afraid of Brexit : lay of the land set out by    via ,#Brexit
1194,709407022199017472,18550319,2016-03-14 11:53,,London,A bit of a plug for our Brexit report from   ; the report itself is here ,#Brexit
1195,709404024517300224,130857294,2016-03-14 11:41,,,"N Somerset MP  claims Labour UQ abt Queen's views on brexit ""is playing the man, not the ball"". Man??",#brexit
1196,709399665670823936,1272747948,2016-03-14 11:23,,University of York,Tom Watson granted urgent question covering Gove & Queen Brexit leak - Politics live ,
1197,709397124383842304,4838520568,2016-03-14 11:13,,"Arcachon, France","Is Brexit a good idea for Britain? Global Risk Insights As the June 23 referendum on a Brexit approaches, ..  brexit",#brexit
1198,709390498570571776,555370896,2016-03-14 10:47,,England,Shock as East Midlands MEP backs Brexit | Hinkley Times  hinckleytimes.  …,
1199,709386189585960960,178779512,2016-03-14 10:30,,"Beirut, Lebanon",London mayor Johnson blasts Obama over Brexit ,
1200,709382918314041344,87818409,2016-03-14 10:17,,London," Libtards receive a bloody nose, Brexit !",
1201,709380028077907969,3380661135,2016-03-14 10:05,,"Knoxville, TN"," OK, Lee 's Kid - just for you 'cos you appear not to have checked & seen all my Tweets, I'm 100% FOR Brexit Leave EU",#Lee
1202,709375148193923072,770545,2016-03-14 09:46,,"Maybe UK, don't bet on it",The Brexit is causing us many issues with working out what to do with currency for  . Wish there was more stability.,
1203,709370661114912768,33347590,2016-03-14 09:28,"Guildford, England",United Kingdom,"Brexit or not, businesses want more workers to fill skills gaps  -and-migration… pic.twitter.",
1204,709368540772507649,162006549,2016-03-14 09:20,,Shanghai,Guardian: Tom Watson granted urgent question covering Gove & Queen Brexit leak - Politics live: Rolling covera... ,
1205,709366013599481856,47916714,2016-03-14 09:10,,London,"Ukip accuses Vote Leave of playing ""fast and loose"" with their support figures  Brexit pic.twitter.",#Brexit
1206,709362752284979200,606168400,2016-03-14 08:57,,"Brussels, Belgium", : Deadlock on refugee crisis will fuel Brexit vote   euractiv.  … pic.twitter.,
1207,709359245746184196,2482103506,2016-03-14 08:43,,London,Russia scolds Hammond for saying the Kremlin dreams of Brexit - not a particularly clever comment from UK ,
1208,709357424361250816,257221975,2016-03-14 08:36,,Location: Right Behind You !,"Brexit would prompt 'regulationfest' of replacing EU bureaucracy, lawyers warn  independent.co.  …",
1209,709351709873709056,17968258,2016-03-14 08:13,,"Non, je ne regrette rien","Boris Johnson, London's mayor, blasts President Obama's undiplomatic intervention into UK 's EUreferendum :  telegraph.co.  … Brexit",#UK #EUreferendum #Brexit
1210,709349898542563328,2357300184,2016-03-14 08:06,,"South West, England",The only hypocrite is the ridiculous  pretending he wants Brexit because he wants to be PM.  709348868182380544 …,#Brexit
1211,709346539819438081,29170793,2016-03-14 07:52,,USA,Boris v Barack: London mayor accuses Obama of Brexit 'hypocrisy' ,
1212,709342869560147968,102325185,2016-03-14 07:38,,,Brexit and Britain - what would it mean for UK trade?  4-traders. d-Britain-what-would-it-mean-for-UK-trade--22009080…,#Brexit
1213,709339055427874816,3131144855,2016-03-14 07:23,"Bath, England",London," Indeed,who was it again who said F*** the eu when refering to the Ukraine I think was it  ? brexit euxit",#eu #Ukraine #brexit #euxit
1214,709331834161778688,21183938,2016-03-14 06:54,,Re-Tweet does not mean I agree,UK budget set to be tempered by Brexit concerns | CMC Market News  cmcmarkets. -.VuaYXBzWXIs.twitter …,#
1215,709329709293834240,54882415,2016-03-14 06:45,,,Boris accuses Obama of ‘blatant hypocrisy’ over Brexit  via  Failed OBama has not say.,
1216,709325649882779649,759593438,2016-03-14 06:29,,London,Thanks to  for inviting me to participate in this:  lawgazette.co. ble-brexit-legal- … Brexit longread,#Brexit #longread
1217,709321928704532480,295542114,2016-03-14 06:15,,Basingstoke,EU data protection rules still apply whether we're in or out - more here Brexit  ukngroup. -eu-data-protection-rules-brexit… pic.twitter.,#Brexit
1218,709319530250682369,22905872,2016-03-14 06:05,,London,"With brexit the UK will have monetary , tourism , prostitution , marmite , jerk chicken, leg-breaking, marmalade & morris dancing crisis.",#brexit #UK #monetary #tourism #prostitution #marmite #marmalade
1219,709316717269405696,2574511933,2016-03-14 05:54,,London and Washington DC,"Monday: What Brexit means for payments, Russia ponders jail for Bitcoin traders & warnings sound on regtech costs ",#Brexit #Bitcoin #regtech
1220,709311172839874560,2791948853,2016-03-14 05:32,,,"A reason why Brexit could be a disaster for all Europeans - Ireland ""regulating"" more Financial Services   …",
1221,709308503068975104,21244849,2016-03-14 05:21,,"London, England",The logic of brexit supporters is faultless...   …,#brexit
1222,709303200109748225,19101110,2016-03-14 05:00,,Singapore,Potential Impact of ' Brexit ' on tech start ups in London -  businesstimes.com. xit-nerves-already-cost-this-london-tech-startup-%C2%A3100000?xtor=CS3-27 …,
1223,709300246313091072,454779231,2016-03-14 04:48,,Oxford,Life after Brexit ? UK will not be part of 27 EU negotiations on withdrawal deal.   … INtogether StrongerIn,#INtogether #StrongerIn
1224,709295889945378816,388798786,2016-03-14 04:31,,Buckinghamshire,This slavish Brexit propaganda would make Pravda proud | Alastair Campbell | Opinion | The Guardian  theguardian.  …,
1225,709294449411682304,463749076,2016-03-14 04:25,,Lancashire,"Toxic Tony Blier, Prince of Darkness Mandleson, Kenneth 'I hate the UK' Clarke. The remain crowd are a pretty untrustworthy lot! BREXIT",#remain #BREXIT
1226,709288928130547712,350518196,2016-03-14 04:03,,Round the corner to the left,Funny how people want Brexit but don't mind other countries owning our infrastructure and screwing us over.   …,
1227,709286902675939329,56670976,2016-03-14 03:55,"Wetherby, England","Yorkshire, England",So latest bullshit is EU countries will not want our tourists if Brexit ! Desperation taking over!   …,#EU #Brexit
1228,709282973464526848,3600539122,2016-03-14 03:40,,"Mississippi, USA",   exactly got in because he was black but actually he holds allah as more important than his voters.,
1229,709278588558839809,267976688,2016-03-14 03:22,,,"Remember how team Brexit said Merkel would ensure UK got free trade deal, well it would seem Mrs Merkel may not be around. r4today",#Brexit #r4today
1230,709268076420866048,6531902,2016-03-14 02:41,,," Wow, that looks hot. Perhaps when Brexit crowd have taken us out of EU ( most deny climate change) they will take us out of Earth",
1231,709267371106639872,3228178671,2016-03-14 02:38,,,Ask yourself: when did you last have a decent pay rise. Ask yourself: why? Brexit  via ,#Brexit
1232,709256599198629888,51131135,2016-03-14 01:55,"Minster On Sea, England",kent,    Love it when our Nigel gets to speak on TV put the case for Brexit :),
1233,709220523641679872,915729792,2016-03-13 23:32,,,Just when you thought he couldn't get worse: Obama’s Plan To Visit London To Lobby Against Brexit ,
1234,709198289074163712,162854063,2016-03-13 22:03,,,Ella Henderson and Pixie Lott are lined up for Brexit music festival BpopLive ,
1235,709177979159576576,386626636,2016-03-13 20:43,,Stopsley,XYZ! Study suggests UK environment would be 'vulnerable' after Brexit - BBC News  via hng pic.twitter.,#hng
1236,709177598321041408,362147239,2016-03-13 20:41,,"Bury, England",   Wish EU court would block vile Tory attacks on the Disabled in Britain ECHR ESAcuts Brexit,#ECHR #ESAcuts #Brexit
1237,709169004598980609,14857525,2016-03-13 20:07,,"Boston, MA",Queen on Brexit : I'd rather not take sides   pic.twitter.,
1238,709153616939126785,3064317746,2016-03-13 19:06,,,"Brexit Could Be Costly For EU And Britain Alike, German Think Tank Warns.. Related Articles: ",
1239,709149165767385088,2490937729,2016-03-13 18:48,,"Melbourne, Australia","""What might a ' Brexit ' mean for the Anglosphere – and Australia?"" asks Monash's Ben Wellings  rexit-mean-for-the-anglosphere-and-australia-55139 … via ",
1240,709141966617968640,2891922856,2016-03-13 18:19,,"Powys, Wales",'He should stay out' Barack Obama warned against interfering in Brexit debate  express.co.  …,#Brexit
1241,709136274700050442,22270954,2016-03-13 17:57,,"Manchester, England",What argument can be made to convince them? It's all been discussed. The only time soon to revisit the issue is if Brexit happens.,
1242,709130289474355200,3135565264,2016-03-13 17:33,,GREAT Britain,Do you want to be in a EU with Turkey ? LeaveEU remain EUref StayinEU Brexit StrongerIn VoteLeave  …,#EU #Turkey #LeaveEU #remain #EUref #StayinEU #Brexit #StrongerIn #VoteLeave
1243,709124281565843457,36974428,2016-03-13 17:09,,London 07929045857,"Watching Britain's EURef ? Latest thoughts on the polls, Boris, Corbyn and the campaign ->  ae542eeba8dd1f&id=a0156d7e3f&e=[UNIQID … Brexit EU StrongerIn",#EURef #Brexit #EU #StrongerIn
1244,709122306753359873,16002002,2016-03-13 17:01,,"iPhone: 51.470411,-0.489449",We are being asked to cast a significant vote for either Brexit or UKinEU based on inconclusive facts subjective opinions & fear! GREAT!,#Brexit #UKinEU
1245,709113790491529216,966771775,2016-03-13 16:27,,,Brexit explain from a European point of view  youtube. fR8v8 …,#Brexit
1246,709108108908486656,3003173050,2016-03-13 16:05,,"North West, England",Turkey joining the EU...we must NEVER LET THIS HAPPEN!! 97% of Turkey is in Asia?!!! VoteLeave Brexit LeaveEU GO   …,#VoteLeave #Brexit #LeaveEU #GO
1247,709100974158323712,1664318234,2016-03-13 15:37,,London (the one in England),[ Brexit Dave? Or you next!] Merkel set to lose support in Germany's 'Super Sunday' state elections  via ,
1248,709096652930457604,4353901287,2016-03-13 15:19,,Germany,Ireland prepares for Brexit fund influx: Irish central bank believes investment managers w.. business news RT ,#business #news #RT
1249,709092853922832385,249075947,2016-03-13 15:04,,Cornwall,"Lawson: Don’t fret, Your Majesty: the Scots can’t afford to jump ship if we vote for Brexit  thesundaytimes.co.  … pic.twitter.",#Brexit
1250,709083147787440128,3294097949,2016-03-13 14:26,,"Southport, England",On the EUreferendum we need to be clear that the status quo is not on the ballot. It's the new deal or leave. Vote Remain. Brexit,#EUreferendum #Brexit
1251,709078547474870274,4881021155,2016-03-13 14:07,,, Utter rubbish. NATO not EU maintains what little Peace exists these days. Brexit before the EU implodes.,#Brexit
1252,709072176914104320,2942029428,2016-03-13 13:42,,,Video: GeorgeOsborne : Boris playing 'political games' by backing Brexit  telegraph.co.  … ZippedNews  zippednews.,#GeorgeOsborne #ZippedNews
1253,709066567586357248,3295732359,2016-03-13 13:20,,"Havant, Hampshire, England",What Cameron Really Thinks Of His Brexit Rivals by David Laws  via ,
1254,709060993771438086,359652561,2016-03-13 12:58,,World,Tom Watson urges Gove to end speculation over 'Queen backs Brexit ': Labour deputy leader calls on justice…  guardian,#guardian
1255,709057824664461312,183998445,2016-03-13 12:45,,United Kingdom,"Perfect setup. Mark Stone of  asks a German ""AS WE DISCUSSED BEFORE"" what do you think about Brexit ? Clue in capital ( EUref",#Brexit #EUref
1256,709055896878501888,90350594,2016-03-13 12:37,,UK,"If a BREXIT has such dire national security consequences, why offer a referendum",
1257,709053170090176512,700721937215979520,2016-03-13 12:27,,European Union,Brexit hysteria....   …,#Brexit
1258,709048831179145217,2495875008,2016-03-13 12:09,,"London, Frankfurt, Zurich",UK : The new face of the Brexit campaign  via  pic.twitter.,#UK #Brexit
1259,709037182175088640,3194761695,2016-03-13 11:23,,United Kingdom,"In Austria, Over Half Of All 'Asylum Seekers' Commit Crimes  Brexit LeaveEU",#Brexit #LeaveEU
1260,709033431427129344,17019081,2016-03-13 11:08,,"Co Tyrone, N Ireland, UK",EU referendum: Stephen Hawking and 150 Royal Society fellows warn Brexit would be 'disaster for UK science'  .aspx?regionid=4&articleid=59739555&source=janetterpro …,
1261,709027831225962497,131192086,2016-03-13 10:46,,Originally from Nottingham UK,Brexit would not be a disaster for UK fund managers -  - Betteroffout EU,#Brexit #UK #Betteroffout #EU
1262,709023552138256384,76062469,2016-03-13 10:29,,"Stockport, UK",  Brexit I'm not complaining.,#Brexit
1263,709015874615820288,466146768,2016-03-13 09:58,"Bogotá, D.C., Colombia",Colombia / UK,So what will he do after Brexit when most of his bar staff have to go back to Poland ? Fool.  709013233076715520 …,#Brexit
1264,709011007306211329,369786451,2016-03-13 09:39,,,"Popescu Report - Gold , US Election, Brexit and Switzerland  pic.twitter.",#Gold
1265,709009789863469056,123979525,2016-03-13 09:34,,London,  what even more than our current government have already done. Not that I am a brexit person.,
1266,709004423889080321,16558943,2016-03-13 09:13,,"Westminster, London","It would be ""disastrous"" if David Cameron quit as PM after Brexit , one of the Leave Cabinet ministers has said: ",
1267,709001240550764544,426657313,2016-03-13 09:00,,"Chippenham, Wiltshire, UK",‘ Brexit ’: state of the union  via  pic.twitter.,
1268,708994762221686784,2445944246,2016-03-13 08:34,,Edinburgh. Scotland," I will tell you what I want. What I really, really want. I really, really, really, really, really want to Zig-A-Zig- Brexit .",
1269,708992445518909440,15216818,2016-03-13 08:25,,"Klein-Welsden, Limburg",Brexit Ther Germans are taking the piss out of the Brits and they are spot on  apart from the bit about women ;-),#Brexit
1270,708989413515272192,24692487,2016-03-13 08:13,,London,EUin should just print an put up posters of usual Brexit suspects around town. EURef bbcsp bbcdp   …,#EUin #Brexit #EURef #bbcsp #bbcdp
1271,708986352520568832,47411746,2016-03-13 08:01,,"53.354466,-6.25198",UK rush for Irish passports ‘brought on by Brexit fears’  irishtimes. uk-rush-for-irish-passports-brought-on-by-brexit-fears-1.2560740.VuVWkVD0VgY.twitter … via ,#
1272,708981591809396736,437684919,2016-03-13 07:42,,uk,The whole point is not to talk to tories when they have brexit problems and can't keep election promises   …,#brexit
1273,708977473950769153,16423336,2016-03-13 07:26,,"London, England",.  clarifies his position on Brexit . The answer may surprise you.  dailymail.co.  …,#Brexit
1274,708974175063379968,133760563,2016-03-13 07:13,,,This slavish Brexit propaganda would make Pravda proud | Alastair Campbell ,
1275,708969130846724098,229823197,2016-03-13 06:53,,,Gove 'did not brief' Sun's 'Queen backs Brexit ' story  bbc.co. cs-eu-referendum-35793773 …,
1276,708965152327147521,794610662,2016-03-13 06:37,,,When the establishment appear to be losing the argument they resort to shock tactics falseflag 911  so stay strong Brexit VoteLeave,#falseflag #911 # #Brexit #VoteLeave
1277,708960818117943297,4350436221,2016-03-13 06:20,,"London, England","First it was the Queen, now Mr Toad has been snared in Brexit | Victoria Coren Mitchell | Opinion | The Guardian  theguardian.  …",
1278,708956006072639488,19644086,2016-03-13 06:00,,North London, … How Osbo protege Andrea Leadsom cut him down to size over Brexit .  pic.twitter.,#Osbo #Brexit
1279,708955565192515584,2867262735,2016-03-13 05:59,,Shropshire,"Brexit misinformation from BSE? The guaranteed UK veto preventing mismatched nations joining is alive and well - Romania, Bulgaria, Turkey?",#Brexit
1280,708951758320574465,1911832471,2016-03-13 05:44,,,Only a third? BluehandEU Bluehand Brexit   …,#BluehandEU #Bluehand #Brexit
1281,708950637178916864,506486097,2016-03-13 05:39,,Sunlit meadows,"""I crave a United States of Europe"": probably not a surprise Clarkson is against Brexit , since he wrote this in 2014 pic.twitter.",
1282,708947534371299328,1125937411,2016-03-13 05:27,,Southampton/ Isle of Wight,The EU is on a suicide mission. Do we want to be a part of it? Hell no vote for Brexit  spectator.co. s-folly-has-made-it-a-civilisation-under-siege…,
1283,708944131230449664,734501281,2016-03-13 05:13,,??,I'm already sick of hearing the word ' Brexit '. It conjures the image of being force fed some sort of own brand breakfast cereal.,
1284,708939476463177728,4100571640,2016-03-13 04:55,,,Obama is for corporate interests scared UK will avoid TTIP. Wants help to destroy our NHS. brexit  independent.co.  …,#brexit
1285,708935756329443328,54193895,2016-03-13 04:40,"Barking, London",,AlistairCampbell complains about dishonest Brexit propaganda but don't worry someone will nuke him in 45 minutes  are_AndroidApp_Tweet …,#AlistairCampbell #Brexit
1286,708931539871125504,833070439,2016-03-13 04:23,,,Cameron phones a friend for the 50:50..... brexit  independent.co.  …,#brexit
1287,708926106225741825,1477930411,2016-03-13 04:02,,Brighton UK,  This goat  couldn't demand anything from Brits Since being POTUS He's constantly trashed UK Brexit,#Brexit
1288,708924600424521728,219731547,2016-03-13 03:56,,"Holy Island, Northumberland","First it was the Queen, now Mr Toad has been snared in Brexit  are_AndroidApp_Tweet …",
1289,708916822230302720,3058651301,2016-03-13 03:25,,Gone fishing,Brexit cannot resolve issues with immigration. Insightful article from  ,#Brexit
1290,708911344045658113,134433078,2016-03-13 03:03,"West Burton, England",North Yorkshire,This slavish Brexit propaganda would make Pravda proud | Alastair Campbell ,
1291,708900044548624384,86241025,2016-03-13 01:18,,"Nakhon Si Thammarat, Thailand",Telegraph Barack Obama 'will urge British voters to remain in EU during April visit': Brexit camapaigners cri... ,#Telegraph
1292,708869824601047040,16027848,2016-03-12 23:18,,"Essex, England","Cabinet Euro rebel Gove on the brink over Royal Brexit storm  What? No Justice, Arsehole? CrawlBackUnderYourRock",#CrawlBackUnderYourRock
