,tweet_id,user_id,time,geo,location,text,hashtags
577,712680579825840128,849038192,2016-03-23 12:41,,"London, England",Hi novaramedia! 3rd year  student want a critical talk ( 6 PM) on Brexit ! Get in touch ASAP if interested please.,
578,712673515829329920,7349062,2016-03-23 12:13,,South Bucks - England," I dont care atm, after we secure a brexit ukip can sort it out.  ",
579,712669835843526657,28138931,2016-03-23 11:58,,"London, England",Boris Johnson dismisses Brexit warnings in an appearance before a parliamentary committee  pic.twitter.,
580,712668870662815744,197944710,2016-03-23 11:54,,U.S.A,WACAmerica: Our World News Update is out! This week: Brexit ; Brussels; Russia in Syria; Obama in Cuba; Refugee dea… ,
581,712665209635209216,28964775,2016-03-23 11:40,,London,Sir Martin Sorrell being worried about Brexit gives me hope GdnCMS,#Brexit #GdnCMS
582,712659577750171648,791866070,2016-03-23 11:17,,"London, UK.",Pound Sterling to Canadian Dollar ( Exchange Rate Forecast: Brexit Worries Continue ...  fx forex money,#fx #forex #money
583,712656441669263360,23990068,2016-03-23 11:05,,"Victoria, London",UK holidaymakers more likely to oppose Brexit : People planning an overseas holiday this year are more likely to vo… ,
584,712652926079143936,79737242,2016-03-23 10:51,"East, England",no locstion,Would offer of UK referendum on Turkey joining EU reduce Brexit vote? Asks  Doubt it,
585,712646360319676416,20840441,2016-03-23 10:25,,"Brussels, Belgium",Support for Brexit is in the lead ,
586,712645108525637632,3026507855,2016-03-23 10:20,,Milton Keynes,Motor industry bosses say staying in the EU is 'best for business'  EUreferendum Brexit,#EU #EUreferendum #Brexit
587,712637799976067072,2984403982,2016-03-23 09:51,,South Devon,If EU accepts Muslim terror as normal we can't stay  Merkel EU accept no culpability Brexit LeaveEU VoteLeave,#EU #Merkel #EU #Brexit #LeaveEU #VoteLeave
588,712635522829709312,1579079004,2016-03-23 09:42,,,Only ' Brexit ' Can Save Britain From This Scourge Of Political Islam Waging War In Europe  via ,
589,712628079785598976,77767757,2016-03-23 09:12,,"London, United Kingdom",KCL Polling Club's hardwork. Some really interesting insights here. Do check! Brexit UKPolitics Queen Monarchy   …,#Brexit #UKPolitics #Queen #Monarchy
590,712625732434968576,117050365,2016-03-23 09:03,,"Southport, Merseyside, UK","Can someone tell me how Conservative failure affects Brexit poll, they've been failing people for years.   …",#Brexit
591,712619409353871360,255639704,2016-03-23 08:38,,"Beautiful Brecon, Wales. ","Douglas Carswell asks whether EU would 'act vindicatively' in Brexit . Unknown MP in earshot: ""Yeah. To you, mate."" pmqs",#Brexit #pmqs
592,712615987577819137,22370581,2016-03-23 08:24,,,Wake up — Britain is heading for Brexit :  FT,#FT
593,712613587735420928,2538600419,2016-03-23 08:14,,"West Midlands, England",    Churchill and Thatcher would be turning in their graves right now. BREXIT,#BREXIT
594,712610598035578880,48663164,2016-03-23 08:03,,"London, Tunis, Washington, D.C","Shameless attempts by Brexit campaigners,Turks & Russians to use Brussels attacks as a weapon against EU  via ",#Brexit
595,712606692798758913,957412446,2016-03-23 07:47,"London, England","Black Notley, Braintree, Essex",Why won't media report abuse of constituency e-mails by Priti Patel? Advertising Brexit via tax payer funded means! pic.twitter.,
596,712604329740537856,257654076,2016-03-23 07:38,,Toronto,RPT-UPDATE 1-Cost of hedging pound soars to near 6-year highs on Brexit worries  trading forex,#trading #forex
597,712601217004924928,71280219,2016-03-23 07:25,,London,Ed Miliband warns voters that Brexit will lead to a ‘free market experiment’  theguardian.  … via ,
598,712597559248875520,4159208128,2016-03-23 07:11,,"London, England",Barclays investor survey on Brexit .. have u changed behavior already given Brexit potential pic.twitter.,#Brexit
599,712594998080966657,3072357143,2016-03-23 07:01,,"London, UK",Exclusive: London's rising financial star  may abandon Britain if Brexit happens  pic.twitter.,#Brexit
600,712591394276319233,161243998,2016-03-23 06:46,,"London, UK",Read → Today's EuropeWatch: Brussels: A boon for Brexit ? EUref UKinEU Brexit Brussels  britishinfluence. n_for_brexit … pic.twitter.,#EUref #UKinEU #Brexit #Brussels
601,712586859453542400,976047235,2016-03-23 06:28,,House of Commons,Now  asks Minister  whether Brexit would affect PSNI cooperation with An Garda Siochana pic.twitter.,#Brexit
602,712581359156535296,3130659484,2016-03-23 06:06,,United Kingdom,Hit banks hardest? Do Goldman Sachs want people to support a Brexit ? ,
603,712577810565619712,585102426,2016-03-23 05:52,,"London, UK",A message to the elite [why so many will vote for Brexit and Trump even though they don't want to] - Richard Murphy  sage-to-the-elite/.VvJlRkDzC50.twitter …,#
604,712573973687615488,1008462276,2016-03-23 05:37,,"London, UK",` Brexit ' Fretting at Bank of England May Be About to Intensify - ,
605,712572681489620992,454779231,2016-03-23 05:32,,Oxford,Redwood wrong on Brexit savings and trade damage   brexit-savings-trade-damage…,
606,712570036242751488,56978179,2016-03-23 05:21,,Greater Manchester,Paranoid TRUMP-items Paranoid UKIPPERS Paranoid Brexit Paranoid Torygraph writer  Bomb Bomb Bomb pic.twitter.,#Brexit
607,712565853527666688,274201880,2016-03-23 05:05,,England,UK economy would shrink by 2% over next couple of yrs & by 10% over a decade according to 28leading economists polled by  Brexit,#Brexit
608,712564775859929088,77776648,2016-03-23 05:00,,Italy,A terrorist attack happened in Europe. Let the standard response begin  orist-attack-has-happened-in-europe-let-the-standard-response-begin… LeaveEU .  Brexit r4today,#LeaveEU #Brexit #r4today
609,712562167581687810,17834349,2016-03-23 04:50,,London,I have faith that the British people are sensible enough not to buy this sustained bit of pro- Brexit ProjectTerror  …,#ProjectTerror
610,712556387914686464,375181238,2016-03-23 04:27,,England,"wrong on so many levels, a catastrophe for europe,we must get out before turkey get in brexit   …",#brexit
611,712551615807533056,150340480,2016-03-23 04:08,,Adviser  to the grandchildren,PM: Brexit Could Batter Britain's Booze Trade..At last a positive reason to leave by the Prime Minister  pm-brexit-could-batter-britains-booze-trade …,
612,712550245369004032,891059384,2016-03-23 04:03,,,Je Suis Sick Of This Shit. So: CloseBorders and drive the enemy out. Merkel Brexit Nexit pic.twitter.,#CloseBorders #Merkel #Brexit #Nexit
613,712542489903763457,478679663,2016-03-23 03:32,,North West England,We will never have affordable housing in the UK unless we Brexit I argue in today's  pic.twitter.,#Brexit
614,712541304677404672,34713362,2016-03-23 03:27,,New York and the World,Why the Bank of England's Brexit concerns may be about to intensify  pic.twitter.,#Brexit
615,712535613145280512,109635673,2016-03-23 03:05,"Sevenoaks, South East",The Holy City of Sevenoaks,British wasn't alone in the 1940s it was with the Commonwealth and the USA saving A failed Europe Brexit VoteLeave   …,#Brexit #VoteLeave
616,712521673585639424,891059384,2016-03-23 02:09,,,"Let's end these dark ages of EU , Banksters & Merkel . Better future for all the peoples of Europe Brexit Nexit pic.twitter.",#EU #Banksters #Merkel #Brexit #Nexit
617,712514544434880512,704972651945730048,2016-03-23 01:41,,"South West, England",Those tempted by the argument for Lexit should wise up about the sinister political coalition behind Brexit  …,#Lexit #Brexit
618,712482724687126528,33178673,2016-03-22 23:34,,Ireland,Ireland feeling the first Brexit chills as exporters pounded by slump in sterling: Ireland's largest companies... ,
619,712462390701334529,587436299,2016-03-22 22:14,,Sweden," Brexit woes for the pound continue - FXStreet: Valeria Bednarik, chief analyst at FXStreet explained ... ",
620,712441745045323777,220771742,2016-03-22 20:52,,Wellington, Even the 'Stralians want brexit   …,#brexit
621,712440561110753280,12991842,2016-03-22 20:47,"City of London, London","London, UK",I see Theresa May couldn't wait until the bodies were cold before using the BrusselsAttacks to scare people into voting against Brexit .,#BrusselsAttacks #Brexit
622,712425461394046976,2816884699,2016-03-22 19:47,,Scotland,Labour claims Brexit could lead to WELSH independence  -claims-brexit-could-lead-to-welsh-independence.html … pic.twitter.,
623,712418756459278338,21926700,2016-03-22 19:20,,UK,"` Brexit ' Would Cause Significant Damage, Oxford Economics Says ",
624,712411886332026881,891059384,2016-03-22 18:53,,,Mad Merkel is content. She will use zaventem to claim power over the whole continent. Brexit Nexit pic.twitter.,#Merkel #zaventem #Brexit #Nexit
625,712404270319063040,2776646422,2016-03-22 18:23,,,FREE EU MOVEMENT poses a security risk for UK by criminals BREXIT to control UK borders providing ability to decide person entering UK,#FREE
626,712398592108060674,501415207,2016-03-22 18:00,,United States,NEW ATV20 with  : Brussels terrorist attack may bolster Brexit campaign as british pound falls pic.twitter.,#ATV20 #Brussels #Brexit #british
627,712396019573628928,704735173619810304,2016-03-22 17:50,,"Chicago, IL",Farage criticised for using Brussels attack to argue for Brexit Brussels pic.twitter.  euro $ fxe $ uup,#Farage #Brussels #Brexit #Brussels #euro
628,712391067694440448,40450756,2016-03-22 17:30,,United Kingdom,"the rickety ship Brexit - captained by the ego-maniacal, foolhardy Boris - sailing to God knows where. [Norrah Sheep, West Scotland].",
629,712382809982300160,189870199,2016-03-22 16:57,,London,PWC Brexit analysis shows economic arguments for Remain collapsing. ,
630,712380706853359617,104784086,2016-03-22 16:49,,"Fareham, Hampshire, U.K ",Graham+Cawte  starnow.co. casting via StarNow yacht sailing Brexit,#casting #yacht #sailing #Brexit
631,712374698500296704,471150546,2016-03-22 16:25,,,"TVR to build new factory near Circuit of Wales  7X?ocid=st … quality British company backing Britain, BREXIT no issue! Cameron!!!",
632,712369326288998400,498920469,2016-03-22 16:04,,UK,A third of marketers back the Brexit but more than half have never even heard of the digital single market ,
633,712367275119124481,317936494,2016-03-22 15:56,,Wales,Going to need some of these bottles if Brexit comes to pass :-pic.twitter.,#Brexit
634,712364191328370688,2383233337,2016-03-22 15:43,,"Wallingford, England"," ensure ""Remain"" Brexit campaigns be clear EU vs Europe. Vote is on Political Union, not geography",#Brexit
635,712359037657063425,288909699,2016-03-22 15:23,,, This is really nothing at all to do with the Brexit debate. You should take this down and apologise. This is indecent.,
636,712353989736714240,63203769,2016-03-22 15:03,,"Cape Town, South Africa",Brussels attacks: callous Brexit tweeters will lose the battle for hearts and minds ,
637,712350183623942145,3662898252,2016-03-22 14:48,,,The government may have an extra £8 billion after Brexit . Reality Check: Could Brexit lead to an end to austerity? -  bbc.co. cs-eu-referendum-35862623 …,
638,712347518168928256,175894852,2016-03-22 14:37,,,Nigel Farage attacked for using deadly Brussels attack to argue for Brexit ,
639,712344728386273280,388992603,2016-03-22 14:26,,Northamptonshire.,   for a hack to make it about Brexit when smoke still in the air isn't on imho Muriel.There's a time.,
640,712338979983630336,780073794,2016-03-22 14:03,,,"The people of Brussels suffer because of the EU, as we all will:  youtube. G2fZc … Brexit bordercontrol immigrationreform",#Brussels #Brexit #bordercontrol #immigrationreform
641,712337082065272832,1003681236,2016-03-22 13:56,,North Herts Country Boy,"Quite right - after Paris, the French borders were closed : UKIP Uses Brussels Attacks To Make Brexit Case   …",
642,712332502212419584,375541409,2016-03-22 13:37,,,"For Brussels - for us all... Even those who have used today's events to argue for "" Brexit "". Unbelievable... pic.twitter.",
643,712328135203799040,225022310,2016-03-22 13:20,,"London, UK",Sign up to our Special EU Referendum Seminar Series. More speakers have been confirmed Brexit  ucl.ac.  … ,#Brexit
644,712325402845388800,279064933,2016-03-22 13:09,,G x,"ah yes, use terrorist attacks as brexit propaganda, how respectful  …",
645,712322403674750978,3208482538,2016-03-22 12:57,,,The economic case against Brexit is collapsing. PWC confirms common sense view of faster growth OUTSIDE EU  cityam. -has-admitted-defeat-and-the-economic-case-against-brexit-is-collapsing …,#Brexit #PWC
646,712318077497712642,2793882489,2016-03-22 12:40,,"England, United Kingdom",The Brussels attack will boost the Brexit campaign! Which city will be next? Brexit LeaveEU VoteLeave UKIP Labour Conservatives,#Brussels #Brexit #Brexit #LeaveEU #VoteLeave #UKIP #Labour #Conservatives
647,712313233424551937,2785187253,2016-03-22 12:21,,,    Sorry guys - the rabbit is right. This is about survival now. Only Brexit is safe.,#Brexit
648,712308774854369280,3309139420,2016-03-22 12:03,,"London, England",Tragic brusselsattack already impacting EUreferendum odds. Bookies nt waiting around increasing Brexit probability pic.twitter.,#brusselsattack #EUreferendum
649,712307340414996481,473131319,2016-03-22 11:57,,"Oslo, Norge",Expect these percentage to grow significantly if a Brexit indeed materializes.   …,#Brexit
650,712304626742202368,604533372,2016-03-22 11:47,,"أبوظبي, الامارات العربية المتح",Brussels attacks: Terrorism could break the EU and lead to Brexit - via   telegraph.co. …,
651,712300870621331456,27868139,2016-03-22 11:32,,Balmy subtropics of Hampshire, Today's atrocity foreseable under EU policy. Trust UK security services to protect UK citizens. Brexit,
652,712297366536249344,2441954014,2016-03-22 11:18,,Leicestershire,UKIP Uses Brussels Attacks To Make Brexit Case !!! Doh!! Freedom of movement was to blame Brexit scaremongering  ukip-uses-brussels-attacks-to-make-brexit-case …,#Brexit #scaremongering
653,712295935246729216,29468782,2016-03-22 11:12,,"Roma/Taranto, Italy",Are we seriously using this moment of chaos and grief to root for or against Brexit ? SERIOUSLY?   …,
654,712290820418887683,1191054960,2016-03-22 10:52,,"Washington, D.C.",FactCheckNI launching April 7 in Belfast. Good timing with Brexit vote in June and usual NI politics.  markholan. via .,
655,712288173943037953,2840378924,2016-03-22 10:41,,U.K.,Could Brexit lead to an end to austerity?. ,
656,712287230316978176,21707501,2016-03-22 10:38,,U.K.,The question is not ‘if’ but ‘how much’ Brexit would cost the UK     ,
657,712282243096584192,331632622,2016-03-22 10:18,,The Dirty,Britain is so much more than a star on a corrupt failing political union flag VoteLeave Brexit Patriot pic.twitter.,#VoteLeave #Brexit #Patriot
658,712279137247952896,310392003,2016-03-22 10:05,,.,"What bollox.Richard Branson is risk averse now, does not think enough of his country to go it alone.Shameful Brexit  …",#Brexit
659,712277459627073536,15838648,2016-03-22 09:59,,Cornwall/Manchester/Dundee,Are you voting in the UK EU referendum in June? We have a good selection of badges for that. brexit pic.twitter.,#brexit
660,712276422232899585,4806808293,2016-03-22 09:55,,"London, England",How the star players on rival Brexit teams line up  22-ef80-11e5-aff5-19b4e253664a …,#Brexit
661,712274013742080000,7587032,2016-03-22 09:45,,"London, UK", Losing control of the STAY in narrative are we? TruthHurts Brexit WhoreMedia,#TruthHurts #Brexit #WhoreMedia
662,712270317448724480,20192702,2016-03-22 09:30,,It's not a big college town,I remane really suprised all the time by brexit suporters and they're incredibly shit command of english. did they all go to the saim skool,#brexit
663,712268313347411969,436702610,2016-03-22 09:22,,"Manchester, UK",  Yup lets reject them all the way back to wherever they've crawled out of. Brussels Brexit closetheborders,#Brussels #Brexit #closetheborders
664,712264001225408512,73280623,2016-03-22 09:05,,"valjevo,serbia","UKIP Uses Brussels Attacks To Make Brexit Case: Nigel Farage is called ""shameful"" for using… ",
665,712262852149649409,291621998,2016-03-22 09:01,,cambridgeshire,The economic case against Brexit is collapsing  … via ,
666,712260424398454785,3677302402,2016-03-22 08:51,,If you guessed Chicago .. !,"CB on the Zone: Brexit Camp Is Putting Politics Above Economy, Mandelson Says   …  mtbnews",#Brexit #mtbnews
667,712257629263962112,67397583,2016-03-22 08:40,,London,Brexit Values Battle “Only an optimistic success-oriented alternative likely to make a difference” -  ,#Brexit
668,712255270492229632,352211899,2016-03-22 08:31,,"Here, there, and everywhere","Let's leave the EU & abolish the Human Rights Act. They manage OK without one in N. Korea, China & S. Arabia don't they? Brexit",#EU #Brexit
669,712254449557901313,1024489124,2016-03-22 08:27,"Dublin City, Ireland",Ireland,Useful Brexit pack from          …,#Brexit
670,712250256617037824,77776648,2016-03-22 08:11,,Italy,Will Ed say we are 'Safer In'? .....almost certainly! Brexit LeaveEU bbcdp   …,#Brexit #LeaveEU #bbcdp
671,712247502485983233,265981373,2016-03-22 08:00,,"London, UK",Brexit : Positioning for uncertainty  investmenteurope. -positioning-for-uncertainty…,
672,712246991846301696,159074179,2016-03-22 07:58,,London ,"unusual (and all the more welcome for it).   on the Conservative Party, IDS, Brexit , and stuff style  conservativehome.  …",#style
673,712243289349627904,19904041,2016-03-22 07:43,,"52.829524,-2.161251","This piece is great on Brexit , the stakes & Labours absence:   …",#Brexit
674,712241554346258433,2301106249,2016-03-22 07:36,,Farringdon,"Deflation, Brexit & Valuations the biggest stockmarket threats, insight from   pic.twitter.",#Brexit #stockmarket
675,712240397024628736,258933423,2016-03-22 07:31,,"Leicestershire, Englandshire","Seeing what is happening in Europe currently, I can see the pro Brexit campaigners using this as evidence. But leaving is not the way....",#Brexit
676,712237728033873920,19624497,2016-03-22 07:21,,Europe,Absolutely disgusting yet entirely predictable to see the Brussels attack being used to promote brexit . Ho hum.,#brexit
677,712234981259677696,215935252,2016-03-22 07:10,,london,Brexit would lead to a less fair society in the UK says Miliband pic.twitter.,
678,712232831251050496,21439144,2016-03-22 07:01,,,How can you separate the human from the political. Merkel - and her ilk- blew up Brussels. brexit,#brexit
679,712230373057536000,101598139,2016-03-22 06:52,,Land of Hope and Glory,   No- you &  just see opportunity for more fear - just think of the famiies not Brexit,
680,712229603943776256,21719488,2016-03-22 06:49,,Ireland,A reminder about  's panel discussion this evening on Brexit . All welcome pic.twitter.,
681,712227539016687616,802381212,2016-03-22 06:40,,England, Brexit LeaveEU and we all know how good he was in government lol,#Brexit #LeaveEU
682,712224459835510785,555370896,2016-03-22 06:28,,England,Excellent article by Richard Tice in City A.M. The economic case against Brexit is collapsing  cityam. -has-admitted-defeat-and-the-economic-case-against-brexit-is-collapsing …,
683,712221002772647936,988698553,2016-03-22 06:14,,"Cardiff, Wales",Interesting polling today from our  Centre. Especially given yesterday's CBI report on Brexit   …,#Brexit
684,712218706722607104,52034653,2016-03-22 06:05,,"All views my own, etc.",This came through the door. Unusually strong political statement from Domino's... EU Brexit pic.twitter.,#EU #Brexit
685,712216583117086725,3235220435,2016-03-22 05:57,,United Kingdom,"Labour MEPs back strong EU gender equality strategy, UKIP voted against StrongerIN the EU IWD2016 Brexit EUref ",#UKIP #StrongerIN #IWD2016 #Brexit #EUref
686,712215752544280576,703201070554558468,2016-03-22 05:54,,,Those in the Brexit camp wishing to exploit this terrible tragedy for their own agenda are beyond despicable  …,
687,712213336310546436,12912542,2016-03-22 05:44,,ENGLAND ,Belgium blasts raise prospects Britain exit from EU explains why loss sterling LeaveEU  Brexit  712211806094303232 …,#Britain #EU #LeaveEU #Brexit
688,712212092749742080,3061993252,2016-03-22 05:39,,"London, sometimes Stuttgart.",If you're using Brussels as political capital for Brexit I'm curious as to how you can live with yourself. pic.twitter.,#Brussels #Brexit
689,712210020868481025,395325770,2016-03-22 05:31,,London,"Will the older generation force the younger generation to live with a situation they never voted for, if Brexit goes ahead? WABrexitPanel",#WABrexitPanel
690,712207833593475072,19530289,2016-03-22 05:22,,"London, England"," Unfortunately they got their deadcat , though it's clear the Brexit crew will run with this as long as they can. Brussels",#deadcat #Brexit #Brussels
691,712205655176777728,2718964162,2016-03-22 05:13,,Wales Oxford Belgium,Terrorism appears to be the new Viagra for the Brexit -randy commentariat.  …,
692,712204686355521537,875530044,2016-03-22 05:10,,United Kingdom,"I'm still on the brexit fence, I've still got a lot of reading to do but scaremongering gives me a raging vote boner to turn the other way",
693,712202727779115008,1307870299,2016-03-22 05:02,,"London, England",Those using what's happened in Brussels to fit their political agenda on Brexit is disgusting!...at times like this we should unite with EU,
694,712201191237754880,18306628,2016-03-22 04:56,,Cambridgeshire,Ed Miliband warns voters against Brexit ‘free market experiment’ - Now he's a chap who knows how to win!  GhgmccLsw …,
695,712198799221989376,17673,2016-03-22 04:46,,UK,"Whereas the conversation should probably be about airport safety, passenger confidence etc. But no. Brexit . I despair.",
696,712198335998857216,93398232,2016-03-22 04:44,"Newry, Northern Ireland",,Brian on the hot topic Brexit ! VATImplications CrossBorder .Back to Treaty by Treaty considerations with EU Countries! PKFFPMIrishNews,#Brexit #VATImplications #CrossBorder #PKFFPMIrishNews
697,712196136170291202,129280647,2016-03-22 04:36,,,  no coincidence that the whole Brexit thing heats up and our toenails start falling off,
698,712194280002084865,130931982,2016-03-22 04:28,,"Westminster, London",Seen a few now for both sides. Shall we leave Brexit argument re Brussels until they've finished tending the wounded & making the area safe,
699,712191583219752960,3375549219,2016-03-22 04:17,"Nottingham, England","Derby, England",How anyone can use the explosions at Brussels to try and argue for Brexit is beyond me.,#Brexit
700,712189878776238080,133632020,2016-03-22 04:11,,Kennington Palace,The flag tells you everything you need to know about the loyalty of   brexit pic.twitter.,#brexit
701,712187716230840321,366749655,2016-03-22 04:02,,London,If you're thinking of tweeting about Brussels airport bombing and Brexit please stop. Have some humanity for God's sake.,
702,712185192715304961,21383965,2016-03-22 03:52,,"Amsterdam, The Netherlands","People are still injured, possibly dying, and you're using it to make political points about Brexit ?! stayclassy  …",#stayclassy
703,712182502031560704,3898637445,2016-03-22 03:41,,,"Brussels can't protect itself let alone us!!! See ya Brexit is the way forward,protect ourselves",
704,712178180912779264,1032861032,2016-03-22 03:24,"Merton, London","London, England",Brussels airport had two explosions this morning. Brexit -ers jump on this by lunch,
705,712176198730850304,111523226,2016-03-22 03:16,,UK,Reads like a reversal of the negative bias press UK benefits. British expats worry about Brexit in Costa Blanca  da-ef90-11e5-aff5-19b4e253664a … ,#Brexit
706,712171664193265664,577055614,2016-03-22 02:58,,,good man 'ignore top business men saying stay in EU because it may effect their cushy lifestyles' brexit   …,#brexit
707,712169115138592768,170282950,2016-03-22 02:48,,uk,Ireland's Biggest Companies Begin to Feel Chill Wind of ` Brexit '  via ,
708,712158377846181888,242235183,2016-03-22 02:06,,london,IDS quitting over Osborne cuts: Brexit stunt or peasants' revolt?  are_AndroidApp_Tweet …,
709,712140523167993856,92731878,2016-03-22 00:55,,"Nairobi, Kenya",Brexit could cost British economy £100 billion: study  pic.twitter.,#Brexit
710,712123941318299648,217188718,2016-03-21 23:49,,"Hanoi, Vietnam",Brexit could cost British economy £100 billion study: A so-called Brexit could cost Britain about ?100 billion... ,
711,712101327762018304,3380473804,2016-03-21 22:19,,Italy,Post- Brexit Britain would need to keep migration high to prevent economic fallout - ... -  attheborders. t-brexit-britain-would-need-to-keep-migration-high-to-prevent-economic-fallout-the-independent… pic.twitter.,
712,712088756761677825,1307298884,2016-03-21 21:29,, World news  أخبار العالم,EU-funded BBC documentary on Obama sparks allegations of anti- Brexit bias  rt. a-documentary-eu-brexit…,
713,712081323503001600,29267420,2016-03-21 20:59,,Portugal,"Top story: Donald Trump on Brexit : 'I believe Britain may leave the EU' - Teleg…  telegraph.co. /donald- … , see more ",
714,712075950976962560,1352841367,2016-03-21 20:38,,,Brexit could trigger credit downgrade for UK’s biggest firms - the guardian  gnIamXeSQ …,
715,712067517456519168,85386747,2016-03-21 20:05,,Countdown. 1 Cocktail to go ,PM & remain have realised ProjectFear has failed; so now moved into PanicMode 23rd June VoteLeaveEU BREXIT  711941300417904640 …,#remain #ProjectFear #PanicMode #VoteLeaveEU #BREXIT
716,712059804018196480,12991842,2016-03-21 19:34,"City of London, London","London, UK","The Left love to rail against ""the corporations"" until they come out against Brexit , at which point they become beloved voices of wisdom",#Brexit
717,712053221842358272,873333540,2016-03-21 19:08,,High Wycombe,TheAgenda EU is a sinking ship. JUMP WHILE YOU HAVE THE OPPORTUNITY brexit,#TheAgenda #brexit
