,tweet_id,user_id,time,geo,location,text,hashtags
1718,707135605164142592,202086557,2016-03-08 04:27,,"Wakefield, West Yorkshire",How will BREXIT affect local business? We weigh the pros and cons in our latest article  thewakefieldwire.co. w-will-it-affect-business …,
1719,707133070810464257,1300282147,2016-03-08 04:17,,London,"Want Brexit but dear  not Boris! Please, please not that!",#Brexit
1720,707130294722273280,386630251,2016-03-08 04:06,,," .Up. Boris reverses order to his staff to back Brexit , calls it 'cock-up'. He sure is. StrongerIn INtogether",#StrongerIn #INtogether
1721,707125378549215232,15750149,2016-03-08 03:46,,, news Bank of England announces contingency plan to prevent market chaos in case of Brexit vote…,#news
1722,707121914083463168,15249629,2016-03-08 03:32,,London,How Boris Johnson muzzled his own team on Brexit - by   thetimes.co.  …,
1723,707119957763563520,2288149338,2016-03-08 03:25,,London May 22-23 2017,Roger Bootle  says there is a serious chance of UK leaving EU brexit ,#brexit
1724,707116437689769984,627423111,2016-03-08 03:11,,,Cameron's aide berated anti-EU business chief by telephone Free speech as long as its not Brexit ,#Brexit
1725,707115682090115072,1606155493,2016-03-08 03:08,,Belfast,Wrightbus founder William Wright becomes first major business figure in NI to back brexit (in an interview with Ballymena Guardian),#brexit
1726,707110282573844480,229500113,2016-03-08 02:46,,Liverpool,"Hypocrite, moi? Boris Johnson's staff told to toe the line on Brexit ",
1727,707107481328029696,2385300655,2016-03-08 02:35,,,"breakingnews VIDEO: BCC boss resigns over ' Brexit ' row: British Chambers of Commerce boss, John Longworth, has… ",#breakingnews
1728,707104863075831808,43123470,2016-03-08 02:25,,"Stafford, Staffordshire, UK",Engineers warn brexit will damage industry ,
1729,707100951967092736,14883354,2016-03-08 02:09,,UK,So in June it's not just leave current EU its leave the EurasianUnion that's forming where UK will be an insignificant speck. Brexit,#leave #EU #EurasianUnion #UK #Brexit
1730,707096825736646656,18891281,2016-03-08 01:53,,"51.53103,-0.131837",Extraordinary ~> Boris Johnson's staff told to toe the line on Brexit •  •,
1731,707093060874731520,3412050041,2016-03-08 01:38,,,FTSE 100 Starts Week Flat While  Businesses Back A “ Brexit ”  s-week-flat-while-smallmedium-businesses-back-a-brexit… pic.twitter.,
1732,707088693748752385,295194367,2016-03-08 01:20,,Margate Kent,Proof arising Cameron put knife into commerce chief for positively expounding Brexit . Smashed down small businesses chief . Sacked,
1733,707051961607180288,2919901436,2016-03-07 22:54,,All over the place,"In conversation with Mark Blyth: Greece, Austerity, Brexit and Europe's other darlings  pic.twitter.",
1734,707029114868396034,2561597334,2016-03-07 21:24,,,BCC boss resigns over Brexit 'benefit'  pic.twitter.,#Brexit
1735,707002662949007361,3086723719,2016-03-07 19:39,,more than 1000 cities,"Women who campaign for a Brexit are like Suffragettes, Priti Patel says  men-who-campaign-for-a-brexit-are-like-suffragettes-priti-patel-says …",
1736,706994980619948032,123644787,2016-03-07 19:08,,Turkey,What happened to austerity and no money? Brexit  theguardian. …,#Brexit
1737,706988878801080320,214049826,2016-03-07 18:44,,From Stellenbosch to London,RT  :  of Commerce employees who support Brexit must leave due to its neutrality stance. Remain supporters do not.,
1738,706986899932618752,474307851,2016-03-07 18:36,,UK,It's funny how things turn out... eu Brexit pic.twitter.,#eu #Brexit
1739,706978832092372994,46756531,2016-03-07 18:04,,,Farage's face if the BCC had backed Brexit but the Director General said he wanted to stay. pic.twitter.,
1740,706973460074012672,2645471900,2016-03-07 17:43,,Cymru,"UKIP's slogan is ""Believe Wales"", a tad ironic. Definition of Believe: To accept that (something) is true, especially without proof. Brexit",#Brexit
1741,706970145537855489,966681366,2016-03-07 17:29,,"Manchester, UK",Further Blow For Cameron's Authority As Twice as Many Tory Chairmen Support Brexit than Remain  via ,
1742,706964383805673473,935648208,2016-03-07 17:06,,Pitcairn Islands,Brexit Where will that €6bn go? In a safe in Erdogan 's basement I expect. erdoganistan pic.twitter.,#Brexit #Erdogan #erdoganistan
1743,706960800162959360,1091457348,2016-03-07 16:52,,Brussels,   love this! Can I do some shameless promotion of this? Brexit consequences for pharma ,#Brexit
1744,706953229532270594,532617308,2016-03-07 16:22,,Wiltshire,"My British friends, you need to vote Brexit , or you have this coming over. Never mind trade or other arguments.  …",
1745,706950390923788288,10715902,2016-03-07 16:11,,"Brighton, England",British Chambers Of Commerce? If you are a member you'll have none of my business. Resign or be boycotted as a cunt. BRExit BCCScum,#BRExit #BCCScum
1746,706945927232274432,19346439,2016-03-07 15:53,,"No Bots Please, We're British","we had a veto, too,  , as YOU well know. And a rebate. What happened to both, exactly? Brexit   …",#Brexit
1747,706939645171523584,1268333359,2016-03-07 15:28,"West Midlands, England",,Brexit will mean the UK will be unshackled from the failed EU political union who bans the United Kingdom from striking our own trade deals,#Brexit
1748,706935748331773952,297286429,2016-03-07 15:13,,"Limousin Area, France",Vote.leave soc (suck?) account back on the brexit hashtag  …,#brexit
1749,706930793881292801,184627206,2016-03-07 14:53,,singapore,"David Cameron's ""Project Fear"" plan to scare the British people into accepting European rule (and denying Brexit )... ",
1750,706927478095290368,270569708,2016-03-07 14:40,,,EU plans over asylum applications play into the hands of Brexit campaigners says  ,
1751,706922319508344832,2365368334,2016-03-07 14:19,,NOT going away!  ,Oh dear he trolls my timeline looks like an idiot then calls me a troll Got to love these brexit bods   …,#brexit
1752,706917540606382080,18159198,2016-03-07 14:00,,London,Will Brexit be bad for farmers? Our 3rd Brexit briefing EURef  pic.twitter.,#Brexit #EURef
1753,706915264076619778,2282510514,2016-03-07 13:51,,North West England," vote at council of ministers, and outvoted 55 times. Brexit would mean being exempt from majority of EU law   …",
1754,706910886305394692,24715437,2016-03-07 13:34,,Tumblrland aka Sweden,"Sweden Democrats Leader Backs Trump and Brexit , Stating 'Nothing Negative' About Leaving The EU  Svpol migpol",#Svpol #migpol
1755,706905147293704192,18913503,2016-03-07 13:11,,United Kingdom,If this is true I think it will make brexit guaranteed - no free press in Turkey virtual dictatorship   …,#brexit
1756,706902311830945793,2345827628,2016-03-07 13:00,,,A Brexit vote would re-energise UK politics. Would be catalyst for things long ignored. Like  HoL...  …,
1757,706898762376089600,703639251863392261,2016-03-07 12:46,,,Democracy that’s more important than Party political deference’s Brexit   …,#Brexit
1758,706893851500236800,53038156,2016-03-07 12:26,,London,Fear not… Brexit won’t damage the property market like scaremongers threaten inspiredhomes inspiredassets ,#Brexit #inspiredhomes #inspiredassets
1759,706886459123441664,138418838,2016-03-07 11:57,,Americas | UK | Ireland,News | IE : He gave evidence to the Northern Ireland Affairs Committee of MPs about the impact of Brexit and said… ,
1760,706881063017177088,5967972,2016-03-07 11:35,,France ... but not French ! ," Just one dictatorship supporting another, Turkey cannot be trusted anymore than Brussels. Cameron will get a bill soon. Brexit",#Brexit
1761,706876746382049280,488546287,2016-03-07 11:18,,United Kingdom,BCC Arranged Critical Longworth Interview  via  BCC is a shambles brexit,#BCC #brexit
1762,706873113737297921,160831009,2016-03-07 11:04,,London,"We should be happy, INs recycling 1975 propaganda, saving the cost of thinking about it -  via  Brexit",#Brexit
1763,706872357265281024,26468254,2016-03-07 11:01,,UK (Manchester/London),great  piece on why brexit would leave Britain more isolated and probably poorer  nytimes.  … pic.twitter.,#brexit
1764,706868857047261184,602164129,2016-03-07 10:47,,Hillingdon,Steven Woolfe MEP in the US last week explaining the case for BREXIT LeaveEU ,#LeaveEU
1765,706867380966846464,28410012,2016-03-07 10:41,,"Portsmouth, England",Polish prime minister claims victory over David Cameron  via  >> WhatDeal Brexit EUref,#WhatDeal #Brexit #EUref
1766,706865007473123328,73500803,2016-03-07 10:32,,"Ottawa, Canada",How a possible ‘ Brexit ’ could change the game on the Canada-EU trade pact ,
1767,706863402166005760,1418315360,2016-03-07 10:25,,UK,"The "" Brexit "" debate gathers pace in building products - how will it affect your business? construction brexit ",#construction #brexit
1768,706858717157957633,18949452,2016-03-07 10:07,,London,What are the economic consequences of Brexit ?  pic.twitter.,
1769,706853921701109760,42627979,2016-03-07 09:48,,,Brexit Vote Prolongs Sales Shutdown for Riskiest UK Bank Bonds -  bank,#bank
1770,706849573797502976,55801465,2016-03-07 09:30,,Coventry UK,"Brexit anxiety stalks the Costa del Sol: ‘If we quit Europe, Brits won’t buy here’  n. …",
1771,706842867650732033,15778426,2016-03-07 09:04,,London,Former Bank of England governor Mervyn King suggests he could vote for Brexit -  theguardian. block-56dd8175e4b0a02aed2064e2 …,#block
1772,706840757324406785,260962827,2016-03-07 08:55,,"Crouch End, London, UK",SageDebateEU Brexit  the economic impact of leaving the EU is negligible...  disagrees,#SageDebateEU #Brexit
1773,706838705231765504,176115868,2016-03-07 08:47,,,"    Any doubts on Brexit firmly put to bed, when you see the way the EU is treating Greece.",#Brexit
1774,706835010909818881,1928492846,2016-03-07 08:32,,OUT OF THE EU ?????????????," indeed > seems they will try any crap to keep us in > but it will have the opposed effect, many undecided will vote for BREXIT",#BREXIT
1775,706832436706074624,74426965,2016-03-07 08:22,,Scotland,.  warns of the dangers for workers & trade union rights in a Brexit   ,#Brexit
1776,706828212731559937,36659880,2016-03-07 08:05,,,Standing room only at SageDebateEU - the room is buzzing. Send us your questions using SageDebateEU Brexit pic.twitter.,#SageDebateEU #SageDebateEU #Brexit
1777,706827369982648322,1390045662,2016-03-07 08:02,,,"And we speak to former Bank of England Governor Mervyn King about the state of the economy, banking & Brexit wato pic.twitter.",#wato
1778,706821437823254528,2975956985,2016-03-07 07:38,,Yorkshire,SPECIAL REPORT: Brexit – The Food Industry Implications -  GoogleAlerts,#GoogleAlerts
1779,706820538275078145,6312362,2016-03-07 07:35,,UKIP Gravesham Secretary,Farage's new best mate Galloway earns most of his income from RT and Putin is keen on Brexit . Ask yourself why  ,
1780,706816505388920833,25142046,2016-03-07 07:19,,Kent,The Brexit campaign has divided the nation’s plonkers – so now where do I stand? | Tim Jonze  Just so.,
1781,706813005586112512,268184606,2016-03-07 07:05,,#Berkshire #Hampshire ,Brexit and London house prices ,
1782,706808411770503168,302783025,2016-03-07 06:47,,Nottingham,There you have it. EU threats for brexit . Spanish warn: Leave EU and we'll take Gibraltar 'the very next day' ,
1783,706807021442613248,914239874,2016-03-07 06:41,,"The Hague, The Netherlands",' Brexit and EU- UK trade relations with third states' by   -and-eu-uk-trade-relations-with.html …,#Brexit #UK
1784,706803510638223360,27209619,2016-03-07 06:27,,London,Ghosn was going to pull Nissan out of UK if we didn't join the euro; we didn't and neither did he. Haha! EUref Brexit,#EUref #Brexit
1785,706798353808371712,138579043,2016-03-07 06:07,,Bristol,Our Euro-centric attitudes to trade hold us back  ro-centric-attitudes-to-trade.html … Brexit EUref pic.twitter.,#Brexit #EUref
1786,706796847478775812,3235220435,2016-03-07 06:01,,United Kingdom,Putin 's Strategic Mistake: Use of Syrian & Iraqi Refugees as a Weapon against NATO StrongerIN EU Brexit EUref ,#Putin #NATO #StrongerIN #EU #Brexit #EUref
1787,706793701641744385,4766994832,2016-03-07 05:48,,,1000 Vote Leave leaflet's have just arrived to my door! Time to do something for my country! Brexit pic.twitter.,#Brexit
1788,706790154447536129,1922846215,2016-03-07 05:34,,,"Twice as many Tory local chairmen back Brexit than staying in EU, BBC survey reveals  co. …",
1789,706786461870395392,37994036,2016-03-07 05:19,,,Downing Street Labelled 'Nasty' As Commerce Chief Who Backed Brexit Resigns  huffingtonpost.co. n-longworth-resigns-bcc-brexit_n_9396902.html … via ,
1790,706782617887178753,127560228,2016-03-07 05:04,,,"Be mindful all. Everything you read, everything you hear regarding Brexit will have a  agenda behind it. We have to -",#Brexit
1791,706779690636283905,9347322,2016-03-07 04:53,,Lichfield,Brexit are starting on the nonsense EU rules argument - I.e. moaning about rules that don't exist ,
1792,706778462757978112,120163618,2016-03-07 04:48,,London,"VIDEO: BCC boss resigns over ' Brexit ' row  : March 07, 2016 at 09:26AM via mikejulietbravo",
1793,706775530536869888,18196651,2016-03-07 04:36,,"Sheffield, UK","As I said Sunday, but funnier, noone is speaking to the not sures: Brexit campaign divides the nation’s plonkers ",
1794,706771516948619264,702200373172428800,2016-03-07 04:20,,United Kingdom, We have control of nothing as it stands it ought to make us feel ashamed BREXIT,
1795,706771035153108992,220632407,2016-03-07 04:18,,Manchester,Just another EU takeover being planned !! Brexit   …,
1796,706763074951372800,312967485,2016-03-07 03:47,,New York,This Brexit GIF (from an FT newsletter) is a bit intense pic.twitter.,
1797,706758631958650880,555370896,2016-03-07 03:29,,England,Downing Street labelled 'nasty' as commerce chielf who backed Brexit resigns | Huffington Post  huffingtonpost.co. n-longworth-resigns-bcc-brexit_n_9396902.html …,
1798,706756721243459585,2522525965,2016-03-07 03:21,,"Edinburgh, Scotland",Boris Johnson's car crash Brexit interview on The Andrew Marr Show  via ,#Brexit
1799,706754745600503808,245951193,2016-03-07 03:13,,"Grimsby, UK", suspension of BCC chief and Calais jungle is giving BREXIT voters a field day. A shift in the EU Referendum?,
1800,706753347148242944,2999846155,2016-03-07 03:08,,Alloa in Scotland,"Their choice to move there........ Brexit anxiety stalks the Costa del Sol: ‘If we quit Europe, Brits won’t buy here’ ",
1801,706750728447107072,4054643129,2016-03-07 02:57,,,Brexit debate unnerves continent’s service workers in UK -   location=http%3A%2F%2Fwww.ft.com%2Fcms%2Fs%2F0%2F5db877f2-d0a9-11e5-831d-09f7778e7377.html%3Fftcamp%3Dcrm%2Femail%2F%2Fnbe%2FUKMorningHeadlines%2Fproduct&referer=&classification=conditional_standard …,
1802,706748928641916928,537175623,2016-03-07 02:50,,"Paris, Ile-de-France",UK Brexit UkinEu | 'Remain' retakes the lead in referendum campaign - YouGov - ,#UK #Brexit #UkinEu
1803,706745372597731328,1670902892,2016-03-07 02:36,,,The Brexit campaign has divided the nation’s plonkers – so now where do I stand? | Tim Jonze ,
1804,706742954552074240,4806808293,2016-03-07 02:27,,"London, England",Exclusive: Former CBI boss says BCC boss wasn’t doing his job Brexit EUref ,#BCC #Brexit #EUref
1805,706738762865319940,15351331,2016-03-07 02:10,,Madrid ,Brexit : a case of how a country can go backwards in developing an innovation ecosystem  thenextsiliconvalley. 1-brexit-a-case-of-how-a-country-can-go-backwards-in-developing-an-innovation-ecosystem…,
1806,706735862126542848,19898035,2016-03-07 01:58,,,"BBC ""Top Stories"" BCC boss resigns over ' Brexit ' support: The director general of the British C...  Twitter News",#Twitter #News
1807,706731732402380802,1324028677,2016-03-07 01:42,,,Tech firms against Brexit  usinesses-support-remaining-in-eu…,
1808,706724045325254656,185840964,2016-03-07 01:11,,"Carysfort Ave, Blackrock",New blogpost The Uncertainty of the Brexit Option ,
1809,706721100638625792,27937612,2016-03-07 01:00,,UK,Brexit would damage EU & UK 'politically & economically' Italian & German finance ministers warn  brexit eu,#brexit #eu
1810,706710869695139842,3242130760,2016-03-07 00:19,,"Bremen, Germany","If UK ports ""Up anchor"" from EU will there be an impact?     Brexit  …",#Brexit
1811,706698766758318081,301309392,2016-03-06 23:31,,South Africa,Businessman's suspension over Brexit 'scandalous': Johnson  pic.twitter.,
1812,706683614138916865,787576596,2016-03-06 22:31,,,Business Leader In Brexit Controversy Resigns - John Longworth ,
1813,706669062605160448,113015281,2016-03-06 21:33,,Roma,"Top story in questo momento: BCC boss resigns over ' Brexit ' support - BBC News  bbc.co. 35741715 … , see more  ?s=tnp …",
1814,706656185089454080,36052124,2016-03-06 20:42,,UK,Proves he believes in what he says ... BREXIT  706608091454959616 …,#BREXIT
1815,706637323694436352,65423360,2016-03-06 19:27,"Kensington, London","London, UK",Brexit Tory sham wperformances between BoJo and DC. All want out. DC playing role to stay in. Whole show faked to smother “In.” ,#Brexit
1816,706631559479070720,123833376,2016-03-06 19:04,,Radnor PA,Head of business group resigns in Brexit row: The head of a major British business group resigned from his pos... ,
1817,706630350051504129,2927048097,2016-03-06 18:59,,europa,"news european Brexit would be poison for the UK, says Wolfgang Schäuble - Video Dailymotion: Brexit would be... ",#news #european
1818,706624739381526528,290603222,2016-03-06 18:37,,,BBC News - BCC boss resigns over ' Brexit ' support  bbc.co. 35741715 …,
1819,706619639837528064,14961903,2016-03-06 18:17,,"London, England", rekindles Irish terror to deter Brexit  kindles-irish-terror-to-counter-brexit…,
1820,706615060458807297,1045228272,2016-03-06 17:58,,ENGLAND,Longworth resigns as BCC chief over support for Brexit -  via  /,
1821,706614112688668672,2825082541,2016-03-06 17:55,,road and the miles to Dundee, if UK brexit we have 4 totally unchecked years of a govt by sociopaths would would do several TTIP type deals worldwide,#brexit
1822,706611216576352257,32452075,2016-03-06 17:43,,Stockholm,"BCC boss resigns over ' Brexit ' support  bbc. 35741715 … - Undecided about "" Brexit "" but EU incapability of reform is a strong argument",
1823,706610088119803905,481011796,2016-03-06 17:39,,UK.,An honest man 'knifed by No 10': Downing Street is accused of 'having a hand' in the ousting of pro- Brexit busines…  dailymail.co.  …,
1824,706607207488614401,54575030,2016-03-06 17:27,,,"There's no one Leave position, not even a single Leave campaign. Nobody can say what a post- Brexit negotiation would yield. ",
1825,706604746124226560,3400702817,2016-03-06 17:17,,"London, England","EU planning to assume central control of all asylum applications, and redistribute migrants as it decides. Brexit  …",#Brexit
1826,706604010007076864,3362016513,2016-03-06 17:14,,,John Longworth resigns from British Chamber of Commerce over Brexit support  LeaveEU,#Brexit #LeaveEU
1827,706602567304945664,357805905,2016-03-06 17:09,,Bassetlaw,  if our government can't sort trade deals and whatever else they're worried about after Brexit they should resign,#Brexit
1828,706601252529033216,3241808945,2016-03-06 17:04,,"London, England",No more 'easy money' for property investors as Brexit fears add to headwinds ,
1829,706599481559494656,115186649,2016-03-06 16:56,,Huddersfield,I've had lunch with this guy too. Think it's about time we got some honest opinions on Brexit   …,#Brexit
1830,706598514617413632,86291560,2016-03-06 16:53,,"Darlington, England",StarNEnews Business Leader In Brexit Controversy Resigns  starradionortheast.co.  …,#StarNEnews
1831,706592616725540866,2946784707,2016-03-06 16:29,,,Smoke and mirrors     Brexit,#Brexit
1832,706590561264914432,103844826,2016-03-06 16:21,,"Southwold, Norwich, Cambridge",EU chief provokes fury by telling Brexit backers to visit war graves  via  .,
1833,706583446349619200,1915001826,2016-03-06 15:53,,Earth,Brexit or bust  …,#Brexit
1834,706575844421070849,2738155487,2016-03-06 15:23,,"Inverness, Scotland",  Brexit is Camerons Hero moment for Britain and what does he do.. Bend Over!,
1835,706572938066206721,2724621665,2016-03-06 15:11,,London / Londres / Londra,How to measure your customer service via email and social media  linkedin. ure-your-customer-service-via-email-social … marketing digital performance content brexit,#marketing #digital #performance #content #brexit
1836,706568654532513792,230736536,2016-03-06 14:54,,ipswich,NHS England threatens to sue Brexit campaign group for using NHS logo  ,
1837,706565519126740992,3260322447,2016-03-06 14:42,,,"Brexit will simply NOT happen, mark my words!",#Brexit
1838,706559541828304896,75649456,2016-03-06 14:18,,"Scotland, United Kingdom",   And they accuse Remain of scaremongering? ! Serious dishonesty by Brexit .,
1839,706553885654036480,18654283,2016-03-06 13:55,,Washington DC,15 Boris Johnson slams crushing of Brexit supporter: London mayor Boris Johnson on Sunday accused supporters o... ,
1840,706553237705515008,127980721,2016-03-06 13:53,,nenagh, forget Brexit it's more like nffcexit,#Brexit #nffcexit
1841,706546853060419589,110268940,2016-03-06 13:27,,"Newbury, England",    Using an anti - Brexit peer to attack Farage isn't a great look IMHO. I'll keep working.,
1842,706544947755937797,438510365,2016-03-06 13:20,,,Brexit Nexit and the waiting lists are getting longer   …,#Brexit #Nexit
1843,706537123969703937,347210189,2016-03-06 12:49,,Sussex,EU referendum: Brexit could have a drastic impact on UK banking sector says Investec  via  Brexit,#Brexit
1844,706534742108332032,555088025,2016-03-06 12:39,,,Think this is the closest to a straight banana I've seen. Does it meet EU standards tho? EUref Brexit pic.twitter.,#EUref #Brexit
1845,706531813590700032,106786514,2016-03-06 12:28,,Ireland,"Just updated our old safeharbor ""get a contingency plan"" slides to refer to brexit . Contingency plan needed for datatransfers",#safeharbor #brexit #datatransfers
1846,706528960188960768,627423111,2016-03-06 12:16,,,The American's had to fight a war to gain their independence. We only have to vote for it BREXIT,#BREXIT
1847,706523098200170496,2228504462,2016-03-06 11:53,,"Dallas, Texas",Business boss suspended over Brexit says Brussels costs us billions  via ,
1848,706519093784875012,4885100086,2016-03-06 11:37,,"Moscow, Russia","Trump, Brexit and the art of the deal: BUILD a wall and get the Mexicans to pay for it—that is Donald Trump's ... ",
1849,706511191787462656,452915961,2016-03-06 11:06,,London,There is no progressive or left wing case for Brexit - by John Wight  -is-no-progressive-or-left-wing-case-for-brexit/.VtxRSNAZieA.twitter … ,#
1850,706507288895422464,181245414,2016-03-06 10:50,,UK,"Brexit would be “poison” for the UK, European and global economies that would last for years, the German finance minister says yes2eu",#Brexit #yes2eu
1851,706502641845727232,18938704,2016-03-06 10:32,,"Thirsk, North Yorkshire",timeshighered: Brexit and the 'raisin picking' problem  pic.twitter.,#and
1852,706497571116736512,1390332612,2016-03-06 10:12,,lancaster,A Brexit wedding !  …,
1853,706493586527932417,2359293380,2016-03-06 09:56,,,"Brexit would be poison for the UK, says Wolfgang Sch sch  63 …",#sch
1854,706488228199669760,2259111877,2016-03-06 09:34,,"Milton Keynes, England",If brexit . Channel tunnel becomes EU border. Passport checks in Dover for France entry & passport check in Calais for UK entry. No camps.,#brexit
1855,706485226210516994,312902384,2016-03-06 09:22,,"Oxfordshire, UK",Rush for Irish passports brought on by Brexit fears ,
1856,706483734455963648,1037152662,2016-03-06 09:17,,,"I , much to my surprise, for once agree totally with Schauble on risks of Brexit .Johnson so wrong!   …",
1857,706478354384494592,257531308,2016-03-06 08:55,,uk,Fear and chaos is the NWO currency for control:   … Democracy is the currency of self- Brexit,#Brexit
1858,706477146768850944,338959591,2016-03-06 08:50,,Miami,"UK carmakers benefit from Brexit jitters, but most urge staying in EU  benefit Brexit EU",#benefit #Brexit #EU
1859,706474663652757504,399916047,2016-03-06 08:41,,"Hempstead, Kent",Remainians selling Britain short with ProjectFear Brexit means freedom from socialist Europe being dragged down to 2nd world status.,#Remainians #ProjectFear #Brexit
1860,706468233054855169,4731521677,2016-03-06 08:15,,alaska.usa,Boris Johnson slams 'crushing' of Brexit supporter  pic.twitter.,
1861,706465611862450176,127503320,2016-03-06 08:05,,"Westminster, London",In campaign seizes on Boris Johnson’s Brexit jobs comments ,
1862,706460526000340993,332804528,2016-03-06 07:44,,Финляндия,"THIS is how we should control our borders, says Ukip leader Nigel Farage  thesun.co.  … Brexit brexit2016",#Ukip #Farage #Brexit #brexit2016
1863,706460098038800384,1010182364,2016-03-06 07:43,,Wicklow,"Brexit would be 'poison', says German Finance Minister, Schauble . And look at Greece --that's Hegemony Schauble",#Brexit #Schauble #Greece
1864,706456780360933377,2603476530,2016-03-06 07:29,,"Λευκωσία, Κύπρος - Cyprus","Boris Johnson compares Brexit to prison break: Leaving the EU would be ""wonderful"" argues the cha...  ",
1865,706453462201057280,2686840032,2016-03-06 07:16,,,"Trump, Brexit and the art of the deal ",
1866,706450399692267520,2891284953,2016-03-06 07:04,,Wantage & Didcot,EU set to patrol UK coastline and overrule UK coastguard. Stop this by voting Brexit ,#Brexit
1867,706447766914871296,330334324,2016-03-06 06:54,,London,Where do you stand on the Brexit ? Luxury brands are speaking up against it   pic.twitter.,#Brexit #Luxury
1868,706443443199938560,926062267,2016-03-06 06:36,,"London, UK",After about 5min  eventually gave up trying to explain to  the meaning of words rebate & netcontribution brexit,#rebate #netcontribution #brexit
